cts_ln,speaker,perseus,comp,anceps_n,anceps,elision
['484'],['#hippolytus'],"ritusque melius vita quae priscos colat,",0.8333333333333334,315, ri*tu_sqve^ me^li^u*s vi_ta^ qv[ae] pri*sco_s co^la*t,0
['485'],['#hippolytus'],quam quae relictis moenibus silvas amat.,0.8611111111111112,316, qva*m qv[ae] re^li_cti*s m[oe]ni^bu_s si*lva_s a^ma*t,0
['486'],['#hippolytus'],non illum avarae mentis inflammat furor,1.0,317, no*n i_ll(u)m a^va_r[ae] me_nti^s i_nfla*mma_t fu^ro*r,1
['487'],['#hippolytus'],"qui se dicavit montium insontem iugis,",0.8823529411764706,318, qvi* se_ di^ca_vi*t mo_nti^(u)m i_nso*nte_m ju^gi*s,1
['488'],['#hippolytus'],"non aura populi et vulgus infidum bonis,",1.0,319, no*n [au]ra^ po^pu^l(i) e*t vu_lgu^s i_nfi*du_m bo^ni*s,1
['489'],['#hippolytus'],"non pestilens invidia, non fragilis favor;",1.0,320, no*n pe_sti^le_ns i*nvi^di^a^ no_n fra^gi^li_s fa^vo*r,0
['490'],['#hippolytus'],.non ille regno servit aut regno imminens,1.0,321, no*n i_lle^ re_gno* se_rvi^t [au]t re*gn(o) i_mmi^ne*ns,1
['491'],['#hippolytus'],"vanos honores sequitur aut fluxas opes,",0.9142857142857143,322, va*no_s ho^no_re*s se^qvi^tu^r [au]t flu*xa_s o^pe*s,0
['492'],['#hippolytus'],"spei metusque liber, haud illum niger",1.0,323,spe*i_ me^tu_sque* li_be^r h[au]d i*llu_m ni^ge*r,0
['493'],['#hippolytus'],edaxque livor dente degeneri petit;,0.9032258064516129,324,e*da_xqve^ li_vo*r de_nte^ de_ge^ne^ri_ pe^ti*t,0
['494'],['#hippolytus'],nec scelera populos inter atque urbes sata,0.9230769230769231,325, ne*c sce^le^ra^ po^pu^lo*s i_nte^r a_tqv(e) u*rbe_s sa^ta*,1
['495'],['#hippolytus'],novit nec omnes conscius strepitus pavet,1.0,326, no*vi_t ne^c o_mne*s co_nsci^u_s stre^pi^tu_s pa^ve*t,0
['496'],['#hippolytus'],aut verba fingit; mille non quaerit tegi,0.9166666666666666,327, [au]t ve_rba^ fi_ngi*t mi_lle^ no_n qv[ae]ri_t te^gi*,0
['497'],['#hippolytus'],dives columnis nec trabes multo insolens,1.0,328, di*ve_s co^lu_mni*s ne_c tra^be_s mu*lt(o) i_nso^le*ns,1
['498'],['#hippolytus'],suffigit auro; non cruor largus pias,1.0,329, su*ffi_gi^t [au]ro* no_n cru^o_r la*rgu_s pi^a*s,0
['499'],['#hippolytus'],"inundat aras, fruge nec sparsi sacra",1.0,330, i*nu_nda^t a_ra*s fru_ge^ ne_c spa*rsi_ sa^cra*,0
['500'],['#hippolytus'],centena nivei colla summittunt boves:,1.0,331, ce*nte_na^ ni^ve^i* co_lla^ su_mmi*ttu_nt bo^ve*s,0
['501'],['#hippolytus'],sed rure vacuo potitur et aperto aethere,0.918918918918919,332,se*d ru_re^ ua^cu^o* po^ti^tu^r e^t a^pe*rt(o) [ae]the^re*,1
['502'],['#hippolytus'],"innocuus errat, callidas tantum feris",1.0,333, i*nno^cu^u^s e_rra*t ca_lli^da_s ta*ntu_m fe^ri*s,0
['503'],['#hippolytus'],struxisse fraudes novit et fessus gravi,1.0,334, stru*xi_sse^ fr[au]de*s no_vi^t e_t fe*ssu_s gra^vi*,0
['504'],['#hippolytus'],labore niveo corpus Iliso fovet:,1.0,335, la*bo_re^ ni^ve^o* co_rpu^s i_li*so_ fo^ve*t,0
['505'],['#hippolytus'],"nunc ille ripam celeris Alphei legit,",1.0,336,nu*nc i_lle^ ri_pa*m ce^le^ri^s a_lphe*i_ le^gi*t,0
['506'],['#hippolytus'],"nunc nemoris alti densa metatur loca,",1.0,337, nu*nc ne^mo^ri^s a_lti* de_nsa^ me_ta*tu_r lo^ca*,0
['507'],['#hippolytus'],"ubi Lerna puro gelida perlucet vado,",1.0,338, u^bi^ le_rna^ pu_ro* ge^li^da^ pe_rlu*ce_t va^do*,0
['508'],['#hippolytus'],sedesque mutas: hinc aves querulae fremunt,0.5789473684210527,339, so*le_sqve^ vi_ta*t hi_nc a^ve_s qve^ru^l[ae] fre^mu*nt,0
['509'],['#hippolytus'],ornique ventis lene percussae tremunt,0.7058823529411765,340, ra*mi_qve^ ve_nti*s le_ne^ pe_rcu*ssi_ tre^mu*nt,0
['510'],['#hippolytus'],veteresque fagi. iuvit aut amnis vagi,0.6666666666666666,341, ve^te^re_sqve^ fa_gi* ju^va^t e^t [au]t a*mni_s va^gi*,0
['511'],['#hippolytus'],"pressisse ripas, caespite aut nudo leves",1.0,342, pre*ssi_sse^ ri_pa*s c[ae]spi^t(e) [au]t nu*do_ le^ve*s,1
['512'],['#hippolytus'],"duxisse somnos, sive fons largus citas",1.0,343, du*xi_sse^ so_mno*s si_ve^ fo_ns la*rgu_s ci^ta*s,0
['513'],['#hippolytus'],defundit undas sive per flores novos,1.0,344, de*fu_ndi^t u_nda*s si_ve^ pe_r flo*re_s no^vo*s,0
['514'],['#hippolytus'],fugiente dulcis murmurat rivo sonus.,1.0,345, fu^gi^e_nte^ du_lci*s mu_rmu^ra_t ri*vo_ so^nu*s,0
['515'],['#hippolytus'],excussa silvis poma compescunt famem,1.0,346, e*xcu_ssa^ si_lvi*s po_ma^ co_mpe*scu_nt fa^me*m,0
['516'],['#hippolytus'],et fraga parvis vulsa dumetis cibos,1.0,347, e*t fra_ga^ pa_rvi*s vu_lsa^ du_me*ti_s ci^bo*s,0
['517'],['#hippolytus'],"faciles ministrant, regios luxus procul",1.0,348, fa^ci^le_s mi^ni_stra*nt re_gi^o_s lu*xu_s pro^cu*l,0
['518'],['#hippolytus'],est impetus fugisse: sollicito bibunt,1.0,349, e*st i_mpe^tu_s fu*gi_sse^ so_lli^ci^to_ bi^bu*nt,0
['519'],['#hippolytus'],auro superbi; quam iuvat nuda manu,0.8,350, [au]ro_ su^pe_rbi* qva_m ju^va_t nu*da_ ma^nu*,0
['520'],['#hippolytus'],captasse fontem! certior somnus premit,1.0,351, ca*pta_sse^ fo_nte*m ce_rti^o_r so*mnu_s pre^mi*t,0
['521'],['#hippolytus'],secura duro membra versantem toro.,0.8,352, se*cu_ra^ du_ro* me_mbra^ la_xa*nte_m to^ro*,0
['522'],['#hippolytus'],non in recessu furta et obscuro improbus,1.0,353, no*n i_n re^ce_ssu* fu_rt(a) e^t o_bscu*r(o) i_mpro^bu*s,2
['523'],['#hippolytus'],quaerit cubili seque multiplici timens,1.0,354,qu[ae]ri_t cu^bi_li* se_que^ mu_lti^pli^ci_ ti^me*ns,0
['524'],['#hippolytus'],domo recondit: aethera ac lucem petit,1.0,355, do*mo_ re^co_ndi*t [ae]the^r(a) a_c lu*ce_m pe^ti*t,1
['525'],['#hippolytus'],"et teste caelo vivit, hoc equidem reor",0.9117647058823529,356, e*t te_ste^ c[ae]lo* vi_vi^t ho_c e^qvi^de_m re^o*r,0
['526'],['#hippolytus'],vixisse ritu prima quos mixtos deis,0.90625,357, vi*xi_sse^ ri_tu* pri_ma^ qvo_s mi*xto_s de^i*s,0
['527'],['#hippolytus'],"profudit aetas, nullus his auri fuit",1.0,358, pro*fu_di^t [ae]ta*s nu_llu^s hi_s [au]ri_ fu^i*t,0
['528'],['#hippolytus'],"caecus cupido, nullus in campo sacer",1.0,359, c[ae]cu_s cu^pi_do* nu_llu^s i_n ca*mpo_ sa^ce*r,0
['529'],['#hippolytus'],divisit agros arbiter populis lapis;,1.0,360, di*vi_si^t a_gro*s a_rbi^te_r po^pu^li_s la^pi*s,0
['530'],['#hippolytus'],nondum secabant credulae pontum rates:,1.0,361, no*ndu_m se^ca_ba*nt cre_du^l[ae] po*ntu_m ra^te*s,0
['531'],['#hippolytus'],sua quisque norat maria; non vasto aggere,0.8378378378378378,362, su^a^ qvi_sqve^ no_ra*t ma^ri^a^ no_n va*st(o) a_gge^re*,1
['532'],['#hippolytus'],crebraque turre duxerant urbes latus;,0.7647058823529411,363, cre*bra_qve^ tu_rre* ci_nxe^ra_nt u*rbe_s la^tu*s,0
['533'],['#hippolytus'],non arma saeva miles aptabat manu,1.0,364, no*n a_rma^ s[ae]va* mi_le^s a_pta*ba_t ma^nu*,0
['534'],['#hippolytus'],nec torta clausas fregerat saxo gravi,1.0,365, ne*c to_rta^ cl[au]sa*s fre_ge^ra_t sa*xo_ gra^vi*,0
['535'],['#hippolytus'],"ballista portas, iussa nec dominum pati",0.9142857142857143,366, ba*lli_sta^ po_rta*s ju_ssa^ ne_c do^mi^nu_m pa^ti*,0
['536'],['#hippolytus'],iuncto ferebat terra servitium bove:,0.96875,367, ju*ncto_ fe^re_ba*t te_rra^ se_rvi^ti^u_m bo^ve*,0
['537'],['#hippolytus'],sed arva per se feta poscentes nihil,1.0,368, se*d a_rva^ pe_r se* fe_ta^ po_sce*nte_s ni^hi*l,0
['538'],['#hippolytus'],"pavere gentes, silva nativas opes",1.0,369, pa*ve_re^ ge_nte*s si_lva^ na_ti*va_s o^pe*s,0
['539'],['#hippolytus'],et opaca dederant antra nativas domos.,1.0,370, e^t o^pa_ca^ de^de^ra*nt a_ntra^ na_ti*va_s do^mo*s,0
['540'],['#hippolytus'],rupere foedus impius lucri furor,1.0,371, ru*pe_re^ f[oe]du*s i_mpi^u_s lu*cri_ fu^ro*r,0
['541'],['#hippolytus'],et ira praeceps quaeque succensas agit,0.8285714285714286,372, e*t i_ra^ pr[ae]ce*ps qv[ae]qve^ su_cce*nsa_s a^gi*t,0
['542'],['#hippolytus'],libido mentes; venit imperii sitis,1.0,373, li*bi_do^ me_nte*s ve_ni^t i_mpe^ri^i_ si^ti*s,0
['543'],['#hippolytus'],"cruenta, factus praeda maiori minor:",0.9032258064516129,374, cru*e_nta^ fa_ctu*s pr[ae]da^ ma_jo*ri_ mi^no*r,0
['544'],['#hippolytus'],pro iure vires esse. tum primum manu,0.90625,375, pro* ju_re^ vi_re*s e_sse^ tu_m pri*mu_m ma^nu*,0
['545'],['#hippolytus'],bellare nuda saxaque et ramos rudes,0.90625,376, be*lla_re^ nu_da* sa_xa^qv(e) e_t ra*mo_s ru^de*s,1
['546'],['#hippolytus'],vertere in arma: non erat gracili levis,1.0,377, ve*rte_r(e) i^n a_rma* no_n e^ra_t gra^ci^li_ le^vi*s,1
['547'],['#hippolytus'],armata ferro cornus aut longo latus,1.0,378, a*rma_ta^ fe_rro* co_rnu^s [au]t lo*ngo_ la^tu*s,0
['548'],['#hippolytus'],mucrone cingens ensis aut crista procul,1.0,379, mu*cro_ne^ ci_nge*ns e_nsi^s [au]t cri*sta_ pro^cu*l,0
['549'],['#hippolytus'],galeae comantes: tela faciebat dolor.,0.84375,380, ga^le^[ae] mi^ca_nte*s te_la^ fa^ci^e*ba_t do^lo*r,0
['550'],['#hippolytus'],invenit artes bellicus Mavors novas,1.0,381, i*nve_ni^t a_rte*s be_lli^cu_s ma*vo_rs no^va*s,0
['551'],['#hippolytus'],"et mille formas mortis, hinc terras cruor",1.0,382, e*t mi_lle^ fo_rma*s mo_rti^s hi_nc te*rra_s cru^o*r,0
['552'],['#hippolytus'],infecit omnis fusus et rubuit mare.,1.0,383,i*nfe_ci^t o_mni*s fu_su^s e_t ru^bu^i_t ma^re*,0
['553'],['#hippolytus'],tum scelera dempto fine per cunctas domos,1.0,384, tu*m sce^le^ra^ de_mpto* fi_ne^ pe_r cu*ncta_s do^mo*s,0
['554'],['#hippolytus'],"iere, nullum caruit exemplo nefas:",1.0,385, i*e_re^ nu_llu*m ca^ru^i^t e_xe*mplo_ ne^fa*s,0
['555'],['#hippolytus'],"a fratre frater, dextera gnati parens",1.0,386, a* fra_tre^ fra_te*r de_xte^ra_ gna*ti_ pa^re*ns,0
['556'],['#hippolytus'],"cecidit, maritus coniugis ferro iacet",0.8181818181818182,387, ce^ci^di_t ma^ri_tu*s co_nju^gi_s fe*rro_ ja^ce*t,0
['557'],['#hippolytus'],perimuntque fetus impiae matres suos;,0.9090909090909091,388, pe^ri^mu_ntqve^ fe_tu*s i_mpi^[ae] ma*tre_s su^o*s,0
['558'],['#hippolytus'],taceo novercas. mitius nil est feris,1.0,389, ta^ce^o_ no^ve_rca*s mi_ti^u_s ni*l e_st fe^ri*s,0
['559'],['#hippolytus'],sed dux malorum femina: haec scelerum artifex,1.0,390, se*d du_x ma^lo_ru*m fe_mi^n(a) h[ae]c sce^le^r(u)m a_rti^fe*x,2
['560'],['#hippolytus'],"obsedit animos, huius incestis stupris",0.7941176470588235,391, o*bse_di^t a^ni^mo*s hu_ju^s i_nce*st[ae] stu^pri*s,0
['561'],['#hippolytus'],"fumant tot urbes, bella tot gentes gerunt",1.0,392, fu*ma_nt to^t u_rbe*s be_lla^ to_t ge*nte_s ge^ru*nt,0
['562'],['#hippolytus'],et versa ab imo regna tot populos premunt.,1.0,393, e*t ve_rs(a) a^b i_mo* re_gna^ to_t po^pu^lo_s pre^mu*nt,1
['563'],['#hippolytus'],"sileantur aliae: sola coniunx Aegei,",1.0,394,si^le^a_ntu^r a^li^[ae] so_la^ co_niu*nx [ae]ge^i*,0
['564'],['#hippolytus'],"Medea, reddet feminas dirum genus.",1.0,395, me*de_a^ re_dde*t fe_mi^na_s di*ru_m ge^nu*s,0
['565'],['#nutrix'],Cur omnium fit culpa paucarum scelus?,1.0,396, cu*r o_mni^u_m fi*t cu_lpa^ p[au]ca*ru_m sce^lu*s,0
['566'],['#hippolytus'],"Detestor omnis, horreo fugio execror.",1.0,397,de*te_sto^r o_mni*s ho_rre^o_ fu^gi^(o) e_xe^cro*r,1
['567'],['#hippolytus'],"sit ratio, sit natura, sit dirus furor:",1.0,398,si*t ra^ti^o^ si_t na*tu_ra^ si_t di*ru_s fu^ro*r,0
['568'],['#hippolytus'],"odisse placuit, ignibus iunges aquas",0.84375,399, o*di_sse^ pla^cu^i*t i_gni^bu_s ju*nge_s a^qva*s,0
['569'],['#hippolytus'],et amica ratibus ante promittet vada,1.0,400, e^t a^mi_ca^ ra^ti^bu*s a_nte^ pro_mi*tte_t va^da*,0
['570'],['#hippolytus'],"incerta Syrtis, ante ab extremo sinu",1.0,401, i*nce_rta^ sy_rti*s a_nt(e) a^b e_xtre*mo_ si^nu*,1
['571'],['#hippolytus'],Hesperia Tethys lucidum attollet diem,1.0,402, he*spe^ri^a^ te_thy*s lu_ci^d(u)m a_tto*lle_t di^e*m,1
['572'],['#hippolytus'],"et ora dammis blanda praebebunt lupi,",1.0,403, e*t o_ra^ da_mmi*s bla_nda^ pr[ae]be*bu_nt lu^pi*,0
['573'],['#hippolytus'],quam victus animum feminae mitem geram.,0.9428571428571428,404, qva*m vi_ctu^s a^ni^mu*m fe_mi^n[ae] mi*te_m ge^ra*m,0
['574'],['#nutrix'],Saepe obstinatis induit frenos Amor,1.0,405, s[ae]p(e) o_bsti^na_ti*s i_ndu^i_t fre*no_s a^mo*r,1
['575'],['#nutrix'],"et odia mutat, regna materna aspice:",1.0,406, e*t o^di^a^ mu_ta*t re_gna^ ma_te*rn(a) a_spi^ce*,1
['576'],['#nutrix'],illae feroces sentiunt Veneris iugum;,0.9090909090909091,407, i*ll[ae] fe^ro_ce*s se_nti^u_nt ve^ne^ri_s ju^gu*m,0
['577'],['#nutrix'],testaris istud unicus gentis puer.,1.0,408, te*sta_ri^s i_stu*d u_ni^cu_s ge*nti_s pu^e*r,0
['578'],['#hippolytus'],Solamen unum matris amissae fero.,1.0,409, so*la_me^n u_nu*m ma_tri^s a_mi*ss[ae] fe^ro*,0
['579'],['#hippolytus'],odisse quod iam feminas omnis licet.,0.8125,410, o*di_sse^ qvo_d ja*m fe_mi^na_s o*mni_s li^ce*t,0
['580'],['#nutrix'],Vt dura cautes undique intractabilis,0.8787878787878788,411, u*t du_ra^ c[au]te*s u_ndi^qv(e) i_ntra*cta_bi^li*s,1
['581'],['#nutrix'],resistit undis et lacessentes aquas,0.9375,412, re*si_sti^t u_ndi*s e_t la^ce_sse*nte_s a^qva*s,0
['582'],['#nutrix'],"longe remittit, verba sic spernit mea.",1.0,413, lo*nge_ re^mi_tti*t ve_rba^ si_c spe*rni_t me^a*,0
['583'],['#nutrix'],"Sed Phaedra praeceps graditur, impatiens",0.8571428571428571,414, se*d ph[ae]dra^ pr[ae]ce*ps gra^di^tu^r i_mpa^ti^e_ns mo^r[ae],0
['584'],['#nutrix'],quo se dabit fortuna? quo verget furor?,0.8529411764705882,415, qvo* se_ da^bi_t fo*rtu_na^ qvo_ ve*rge_t fu^ro*r,0
['585'],['#nutrix'],terrae repente corpus exanimum accidit,1.0,416, te*rr[ae] re^pe_nte* co_rpu^s e_xa^ni^m(u)m a_cci^di*t,1
['586'],['#nutrix'],"et ora morti similis obduxit color,",1.0,417, e*t o_ra^ mo_rti* si^mi^li^s o_bdu*xi_t co^lo*r,0
['587'],['#nutrix'],"attolle vultus, dimove vocis moras:",0.7,418,a*tto_lle^ uu_ltu*s di_mo^ue_ uo*ci_s mo^ra*s,0
['588'],['#nutrix'],"tuus en, alumna, temet Hippolytus tenet.",1.0,419, tu^u^s e_n a^lu_mna* te_me^t hi_ppo^ly^tu_s te^ne*t,0
['589'],['#phaedra nutrix'],Quis me dolori reddit atque aestus graves,0.868421052631579,420, qvi*s me_ do^lo_ri* re_ddi^t a_tqv(e) [ae]stu_s gra^ve*s,1
['590'],['#phaedra nutrix'],reponit animo? quam bene excideram mihi!,0.9142857142857143,421, re*po_ni^t a^ni^mo* qva_m be^n(e) e_xci^de^ra_m mi^hi*,1
['591'],['#hippolytus'],Cur dulce munus redditae lucis fugis?,1.0,422, cu*r du_lce^ mu_nu*s re_ddi^t[ae] lu*ci_s fu^gi*s,0
['592'],['#phaedra'],"Aude, anime, tempta, perage mandatum tuum.",1.0,423, [au]d(e) a^ni^me^ te_mpta* pe^ra^ge^ ma_nda*tu_m tu^u*m,1
['593'],['#phaedra'],intrepida constent verba: qui timide rogat,0.9210526315789473,424,i*ntre^pi^da^ co_nste*nt ve_rba^ qvi_ ti^mi^de_ ro^ga*t,0
['594'],['#phaedra'],"docet negare, magna pare sceleris mei",0.9696969696969697,425, do*ce_t ne^ga_re* ma_gna^ pa_rs sce^le^ri_s me^i*,0
['595'],['#phaedra'],olim peracta est; serus est nobis pudor:,1.0,426, o*li_m pe^ra_ct(a) e*st se_ru^s e_st no*bi_s pu^do*r,1
['596'],['#phaedra'],"amavimus nefanda, si coepta exsequor,",0.78125,427,a*dmo_ui^mu_s ne*fa_nda^ si_ c[oe]pt(a) e_xe^quo*r,1
['597'],['#phaedra'],forsan iugali crimen abscondam face:,0.90625,428, fo*rsa_n ju^ga_li* cri_me^n a_bsco*nda_m fa^ce*,0
['598'],['#phaedra'],honesta quaedam scelera successus facit—,0.9166666666666666,429, ho*ne_sta^ qv[ae]da*m sce^le^ra^ su_cce*ssu_s fa^ci*t,0
['599'],['#phaedra'],"en incipe, anime!— Commodes paulum, precor,",1.0,430, e*n i_nci^p(e) a^ni^me* co_mmo^de_s p[au]lu_m pre^co*r,1
['600'],['#phaedra'],"secretus aures, si quis est abeat comes.",0.9142857142857143,431, se*cre_tu^s [au]re*s si_ qvi^s e_st a^be^a_t co^me*s,0
['601'],['#hippolytus'],En locus ab omni liber arbitrio vacat.,1.0,432, e*n lo^cu^s a^b o_mni* li_be^r a_rbi^tri^o_ va^ca*t,0
['602'],['#phaedra'],Sed ora coeptis transitum verbis negant;,1.0,433, se*d o_ra^ c[oe]pti*s tra_nsi^tu_m ve*rbi_s ne^ga*nt,0
['603'],['#phaedra'],"vis magna vocem mittit et maior tenet,",0.9117647058823529,434, vi*s ma_gna^ vo_ce*m mi_tti^t e_t ma*jo_r te^ne*t,0
['604'],['#phaedra'],"vos testor omnis, caelites, hoc quod volo—",0.9166666666666666,435, vo*s te_sto^r o_mni*s c[ae]li^te_s ho*c qvo_d vo^lo*,0
['605'],['#phaedra'],me nolle,0.0,,,0
['606'],['#hippolytus'],Auimusne cupiens aliquid effari nequit?,0.8,436, a^ni^mu_sne^ cu^pi^e*ns a^li^qvi^d e_ffa*ri_ ne^qvi*t,0
['607'],['#phaedra'],"Curae leves loquuntur, ingentes stupent.",0.8857142857142857,437, cu*r[ae] le^ve_s lo*cu_ntu^r i_nge*nte_s stu^pe*nt,0
['608'],['#hippolytus'],"Committe curas auribus, mater, meis.",1.0,438, co*mmi_tte^ cu_ra*s [au]ri^bu_s ma*te_r me^i*s,0
['609'],['#phaedra'],Matris superbum est nomen et nimium potens:,1.0,439, ma*tri_s su^pe_rb(u)m e*st no_me^n e_t ni^mi^u_m po^te*ns,1
['610'],['#phaedra'],nostros humilius nomen affectus decet;,1.0,440, no*stro_s hu^mi^li^u*s no_me^n a_ffe*ctu_s de^ce*t,0
['611'],['#phaedra'],"me vel sororem, Hippolyte, vel famulam voca,",0.7631578947368421,441,me* ue_l so^ro_r(e)m hi*ppo^ly^te^ ue_l fa^mu^la_m uo^ca*,1
['612'],['#phaedra'],"famulamque potius: omne servitium feram,",0.9142857142857143,442, fa^mu^la_mqve^ po^ti^u*s o_mne^ se_rvi^ti^u_m fe^ra*m,0
['613'],['#phaedra'],"non me per altas ire si iubeas nives,",0.9090909090909091,443, no*n me_ pe^r a_lta*s i_re^ si_ ju^be^a_s ni^ve*s,0
['614'],['#phaedra'],pigeat gelatis ingredi Pindi iugis;,0.9032258064516129,444, pi^ge^a_t ge^la_ti*s i_ngre^di_ pi*ndi_ ju^gi*s,0
['615'],['#phaedra'],"non, si per ignes ire et infesta agmina,",1.0,445, no*n si_ pe^r i_gne*s i_r(e) e^t i_nfe*st(a) a_gmi^na*,2
['616'],['#phaedra'],cuncter paratis ensibus pectus dare.,1.0,446, cu*ncte_r pa^ra_ti*s e_nsi^bu_s pe*ctu_s da^re*,0
['617'],['#phaedra'],"mandata recipe sceptra, me famulam accipe:",1.0,447, ma*nda_ta^ re^ci^pe* sce_ptra^ me_ fa^mu^l(a)m a_cci^pe*,1
['618'],['#phaedra'],"te imperia regere, me decet iussa exequi",0.8888888888888888,448, t(e) i*mpe^ri^a^ re^ge^re* me_ de^ce_t ju*ss(a) e_xe^qvi*,2
['619'],['#phaedra'],muliebre non est regna tutari urbium;,1.0,449,mu*li^e^bre^ no_n e*st re_gna^ tu_ta*r(i) u_rbi^u*m,1
['620'],['#phaedra'],tu qui iuventae flore primaevo viges,0.8181818181818182,450, tu* qvi_ ju^ve_nt[ae] flo_re^ pri_m[ae]vo_ vi^ge*s,0
['621'],['#phaedra'],"cives paterno fortis imperio rege,",1.0,451, ci*ve_s pa^te_rno* fo_rti^s i_mpe^ri^o_ re^ge*,0
['622'],['#phaedra'],sinu receptam supplicem ac servam tege.,1.0,452, si*nu_ re^ce_pta*m su_ppli^c(e)m a_c se*rva_m te^ge*,1
"['623', '623b']","['#phaedra', '#hippolytus']",miserere viduae— Summus hoc omen deus,1.0,453, mi^se^re_re^ vi^du^[ae] su_mmu^s ho_c o*me_n de^u*s,0
['624'],['#hippolytus'],"avertat, aderit sospes actutum parens.",1.0,454, a*ve_rta^t a^de^ri*t so_spe^s a_ctu*tu_m pa^re*ns,0
['625'],['#phaedra'],Regni tenacis dominus et tacitae Stygis,1.0,455, re*gni_ te^na_ci*s do^mi^nu^s e_t ta^ci^t[ae] sty^gi*s,0
['626'],['#phaedra'],nullam relictos fecit ad superos viam:,1.0,456, nu*lla_m re^li_cto*s fe_ci^t a_d su^pe^ro_s vi^a*m,0
['627'],['#phaedra'],thalami remittet ille raptorem sui?,1.0,457, tha^la^mi_ re^mi_tte*t i_lle^ ra_pto*re_m su^i*,0
['628'],['#phaedra'],nisi forte amori placidus et Pluton sedet.,1.0,458, ni^si^ fo_rt(e) a^mo_ri* pla^ci^du^s e_t plu*to_n se^de*t,1
['629'],['#hippolytus'],"Illum quidem aequi caelites reducem dabunt,",0.8461538461538461,459, i*llu_m qvi^d(e)m [ae]qvi* c[ae]li^te_s re^du^ce_m da^bu*nt,1
['630'],['#hippolytus'],"sed dum tenebit vota in incerto deus,",1.0,460, se*d du_m te^ne_bi*t vo_t(a) i^n i_nce*rto_ de^u*s,1
['631'],['#hippolytus'],pietate caros debita fratres colam,1.0,461, pi^e^ta_te^ ca_ro*s de_bi^ta_ fra*tre_s co^la*m,0
['632'],['#hippolytus'],et te merebor esse ne viduam putes,1.0,462,e*t te_ me^re_bo*r e_sse^ ne_ vi^du^a_m pu^te*s,0
['633'],['#hippolytus'],ac tibi parentis ipse supplebo locum.,1.0,463, a*c ti^bi^ pa^re_nti*s i_pse^ su_pple*bo_ lo^cu*m,0
['634'],['#phaedra'],"O spes amantum credula, o fallax Amor!",1.0,464, o* spe_s a^ma_ntu*m cre_du^l(a) o_ fa*lla_x a^mo*r,1
['635'],['#phaedra'],satisne dixi? precibus admotis agam.,1.0,465, sa*ti_sne^ di_xi* pre^ci^bu^s a_dmo*ti_s a^ga*m,0
['636'],['#phaedra'],"Miserere, tacitae mentis exaudi preces—",0.7941176470588235,466, mi^se^re_re^ pa^vi^d[ae] me_nti^s e_x[au]di_ pre^ce*s,0
"['637', '637b']","['#phaedra', '#hippolytus']",libet loqui pigetque. Quodnam istud malum est?,0.7804878048780488,467, li*be_t lo^qvi_ pi*ge_tqve^ qvo_dn(a)m i*stu_d ma^l(u)m e*st,2
['638'],['#phaedra'],Quod in novercam cadere vix credas malum.,0.9459459459459459,468, qvo*d i_n no^ve_rca*m ca^de^re^ vi_x cre*da_s ma^lu*m,0
['639'],['#hippolytus'],Ambigua voce verba perplexa iacis:,0.9,469, a*mbi^gu^a^ vo_ce* ve_rba^ pe_rple*xa_ ja^ci*s,0
"['640', '640b']","['#hippolytus', '#phaedra']","effare aperte, Pectus insanum vapor",1.0,470, e*ffa_r(e) a^pe_rte* pe_ctu^s i_nsa*nu_m va^po*r,1
['641'],['#phaedra'],amorque torret. intimis fervet ferus,0.78125,471, a*mo_rqve^ to_rre*t i_nti^mi_s s[ae]vi_t fe^ru*s,0
['642'],['#phaedra'],penitus medullas atque per venas meat,0.9117647058823529,472, pe^ni^tu_s me^du_lla*s a_tqve^ pe_r ve*na_s me^a*t,0
['643'],['#phaedra'],visceribus ignis mersus et venas latens,1.0,473, vi*sce^ri^bu^s i_gni*s me_rsu^s e_t ve*na_s la^te*ns,0
['644'],['#phaedra'],ut agilis altas flamma percurrit trabes.,1.0,474, u*t a^gi^li^s a_lta*s fla_mma^ pe_rcu*rri_t tra^be*s,0
['645'],['#hippolytus'],Amore nempe Thesei casto furis?,1.0,475,a*mo_re^ ne_mpe* the_se^i_ ca*sto_ fu^ri*s,0
['646'],['#phaedra'],Hippolyte. sic est: Thesei vultus amo,0.90625,476,hi*ppo^ly^te^ si_c e*st the_se^i_ uu*ltu_s a^mo*,0
['647'],['#phaedra'],illos priores quos tulit quondam puer.,0.8235294117647058,477, i*llo_s pri^o_re*s qvo_s tu^li_t qvo*nda_m pu^e*r,0
['648'],['#phaedra'],cum prima puras barba signaret genas,1.0,478, cu*m pri_ma^ pu_ra*s ba_rba^ si_gna*re_t ge^na*s,0
['649'],['#phaedra'],monstrique caecam Gnosii vidit domum,0.9090909090909091,479, mo*nstri_qve^ c[ae]ca*m gno_si^i_ vi*di_t do^mu*m,0
['650'],['#phaedra'],et longa curva fila collegit via.,1.0,480, e*t lo_nga^ cu_rva* fi_la^ co_lle*gi_t vi^a*,0
['651'],['#phaedra'],quis tum ille fulsit! presserant vittae comam,0.9512195121951219,481, qvi*s t(u)m i_lle^ fu_lsi*t pre_sse^ra_nt vi*tt[ae] co^ma*m,1
['652'],['#phaedra'],et ora flavus tenera tinguebat pudor:,0.9090909090909091,482, e*t o_ra^ fla_vu*s te^ne^ra^ ti_ngve*ba_t pu^do*r,0
['653'],['#phaedra'],inerant lacertis mollibus fortes tori;,1.0,483, i^ne^ra_nt la^ce_rti*s mo_lli^bu_s fo*rte_s to^ri*,0
['654'],['#phaedra'],tuaeque Phoebes vultus aut Phoebi mei.,0.9117647058823529,484, tu*[ae]qve^ ph[oe]be*s vu_ltu^s [au]t ph[oe]bi_ me^i*,0
['655'],['#phaedra'],"tuusque potius— talis, en talis fuit",0.9032258064516129,485, tu*u_sue^ po^ti^u*s ta_li^s e_n ta*li_s fu^i*t,0
['656'],['#phaedra'],"cum placuit hosti, sic tulit celsum caput:",1.0,486, cu*m pla^cu^i^t ho_sti* si_c tu^li_t ce*lsu_m ca^pu*t,0
['657'],['#phaedra'],in te magis refulget incomptus decor;,1.0,487, i*n te_ ma^gi_s re*fu_lge^t i_nco*mptu_s de^co*r,0
['658'],['#phaedra'],est genitor in te totus et torvae tamen,1.0,488, e*st ge^ni^to^r i_n te* to_tu^s e_t to*rv[ae] ta^me*n,0
['659'],['#phaedra'],pars «aliqua matris miscet ex aequo decus:,0.8378378378378378,489, pa*rs a^li^qva^ ma_tri*s mi_sce^t e_x [ae]qvo_ de^cu*s,0
['660'],['#phaedra'],in ore Graio Scythicus apparet rigor.,0.9090909090909091,490, i*n o_re^ gra_jo* scy^thi^cu^s a_ppa*re_t ri^go*r,0
['661'],['#phaedra'],si cum parente Creticum intrasses fretum.,1.0,491, si* cu_m pa^re_nte* cre_ti^c(u)m i_ntra*sse_s fre^tu*m,1
['662'],['#phaedra'],tibi fila potius nostra nevisset soror.,1.0,492, ti^bi^ fi_la^ po^ti^u*s no_stra^ ne_vi*sse_t so^ro*r,0
['663'],['#phaedra'],"te te, soror, quacumque siderei poli",0.8064516129032258,493, te* te_ so^ro_r qva*cu_mqve^ si_de^re^i_ po^li*,0
['664'],['#phaedra'],"in parte fulges, invoco ad causam parem:",1.0,494, i*n pa_rte^ fu_lge*s i_nvo^c(o) a_d c[au]sa_m pa^re*m,1
['665'],['#phaedra'],"domus sorores una corripuit duas,",1.0,495, do*mu_s so^ro_re*s u_na^ co_rri^pu^i_t du^a*s,0
['666'],['#phaedra'],"te genitor, at me gnatus. en supplex iacet",0.918918918918919,496, te* ge^ni^to^r a_t me* gna_tu^s e_n su*pple_x ja^ce*t,0
['667'],['#phaedra'],adlapsa genibus regiae proles domus.,1.0,497, a*dla_psa^ ge^ni^bu*s re_gi^[ae] pro*le_s do^mu*s,0
['668'],['#phaedra'],"respersa nulla labe et intacta, innocens",1.0,498, re*spe_rsa^ nu_lla* la_b(e) e^t i_nta*ct(a) i_nno^ce*ns,2
['669'],['#phaedra'],tibi mutor uni. certa descendi ad preces:,1.0,499, ti^bi^ mu_to^r u_ni* ce_rta^ de_sce*nd(i) a_d pre^ce*s,1
['670'],['#phaedra'],finem hic dolori faciet aut vitae dies.,1.0,500, fi*n(e)m hi_c do^lo_ri* fa^ci^e^t [au]t vi*t[ae] di^e*s,1
"['671', '671b']","['#phaedra', '#hippolytus']","miserere amantis— Magne regnator deum,",1.0,501, mi^se^re_r(e) a^ma_nti*s ma_gne^ re_gna*to_r de^u*m,1
['672'],['#hippolytus'],tam lentus audis scelera? tam lentus vides?,1.0,502, ta*m le_ntu^s [au]di*s sce^le^ra^ ta_m le*ntu_s vi^de*s,0
['673'],['#hippolytus'],"et quando saeva fulmen .emittes manu,",0.90625,503, e*t qva_ndo^ s[ae]va* fu_lme^n e_mi*tte_s ma^nu*,0
['674'],['#hippolytus'],si nunc serenum est? omnis impulsus ruat,1.0,504, si* nu_nc se^re_n(u)m e*st o_mni^s i_mpu*lsu_s ru^a*t,1
['675'],['#hippolytus'],"aether et atris nubibus condat diem,",1.0,505, [ae]the_r e^t a_tri*s nu_bi^bu_s co*nda_t di^e*m,0
['676'],['#hippolytus'],ac versa retro sidera obliquos agant,0.9090909090909091,506, a*c ve_rsa^ re_tro* si_de^r(a) o_bli*qvo_s a^ga*nt,1
['677'],['#hippolytus'],"retorta cursus, tuque, sidereum caput,",0.90625,507, re*to_rta^ cu_rsu*s tu_qve^ si_de^re^u_m ca^pu*t,0
['678'],['#hippolytus'],"radiate Titan, tu nefas stirpis tuae",1.0,508,ra^di^a_te^ ti_ta*n tu_ ne^fa_s sti*rpi_s tu^[ae],0
['679'],['#hippolytus'],speculare? lucem merge et in tenebras fuge.,1.0,509,spe^cu^la_re^ lu_ce*m me_rg(e) e^t i_n te^ne^bra_s fu^ge*,1
['680'],['#hippolytus'],"cur dextra, divum rector atque hominum, vacat",0.925,510, cu*r de_xtra^ di_vu*m re_cto^r a_tqv(e) ho^mi^nu_m va^ca*t,1
['681'],['#hippolytus'],tua nec trisulca mundus ardescit face?,1.0,511, tu^a^ ne_c tri^su_lca* mu_ndu^s a_rde*sci_t fa^ce*,0
['682'],['#hippolytus'],"in me tona, me fige, me velox cremet",1.0,512, i*n me_ to^na_ me* fi_ge^ me_ ve*lo_x cre^me*t,0
['683'],['#hippolytus'],"transactus ignis— sum nocens, merui mori:",1.0,513, tra*nsa_ctu^s i_gni*s su_m no^ce_ns me^ru^i_ mo^ri*,0
