cts_ln,speaker,perseus,comp,anceps_n,anceps,elision
['921'],['#theseus'],pietas nefandum; vera fallaces probant,1.0,663, pi^e^ta_s ne^fa_ndu*m ve_ra^ fa_lla*ce_s pro^ba*nt,0
['922'],['#theseus'],simulantque molles dura. silvarum incola,0.9166666666666666,664, si^mu^la_ntqve^ mo_lle*s du_ra^ si_lva*r(u)m i_nco^la*,1
['923'],['#theseus'],"ille efferatus castus intactus rudis,",1.0,665, i*ll(e) e_ffe^ra_tu*s ca_stu^s i_nta*ctu_s ru^di*s,1
['924'],['#theseus'],mihi te reservas? a meo primum toro,1.0,666, mi^hi^ te_ re^se_rva*s a_ me^o_ pri*mu_m to^ro*,0
['925'],['#theseus'],et scelere tanto placuit ordiri virum?,1.0,667, e*t sce^le^re^ ta_nto* pla^cu^i^t o_rdi*ri_ vi^ru*m,0
['926'],['#theseus'],"iam iam superno numiui grates ago,",0.7666666666666667,668, ja*m ja_m su^pe_rno* nu_mi^ni_ gra*te_s a^go*,0
['927'],['#theseus'],"quod icta nostra cecidit Antiope manu,",0.9411764705882353,669,qvo*d i_cta^ no_stra* ce^ci^di^t a_nti^o^pe_ ma^nu*,0
['928'],['#theseus'],quod non ad antra Stygia descendens tibi,0.9459459459459459,670, qvo*d no_n a^d a_ntra* sty^gi^a^ de_sce*nde_ns ti^bi*,0
['929'],['#theseus'],"matrem reliqui, profugus ignotas procul",0.9142857142857143,671, ma*tre_m re^li_qvi* pro^fu^gu^s i_gno*ta_s pro^cu*l,0
['930'],['#theseus'],percurre gentes: te licet terra ultimo,1.0,672, pe*rcu_rre^ ge_nte*s te_ li^ce_t te*rr(a) u_lti^mo*,1
['931'],['#theseus'],summota mundo dirimat Oceani plagis,1.0,673, su*mmo_ta^ mu_ndo* di^ri^ma^t o_ce^a^ni_ pla^gi*s,0
['932'],['#theseus'],"orbemque nostris pedibus obversum colas,",0.9166666666666666,674, o*rbe_mqve^ no_stri*s pe^di^bu^s o_bve*rsu_m co^la*s,0
['933'],['#theseus'],licet in recessu penitus extremo abditus,1.0,675, li^ce^t i_n re^ce_ssu* pe^ni^tu^s e_xtre*m(o) a_bdi^tu*s,1
['934'],['#theseus'],horrifera celsi regna transieris poli,1.0,676, ho*rri^fe^ra^ ce_lsi* re_gna^ tra_nsi^e^ri_s po^li*,0
['935'],['#theseus'],hiemesque supra positus et canas nives,0.9142857142857143,677, hi^e^me_sqve^ su_pra* po^si^tu^s e_t ca*na_s ni^ve*s,0
['936'],['#theseus'],gelidi frementes liqueris Boreae ruinas,0.8055555555555556,678, ge^li^di_ fre^me_nte*s li_qve^ri_s bo^re^[ae] mi^na*s,0
['937'],['#theseus'],"post te furentes, sceleribus poenas dabis.",1.0,679, po*st te_ fu^re_nte*s sce^le^ri^bu_s p[oe]na_s da^bi*s,0
['938'],['#theseus'],profugum per omnis pertinax latebras premam:,1.0,680, pro^fu^gu_m pe^r o_mni*s pe_rti^na_x la^te^bra_s pre^ma*m,0
['939'],['#theseus'],longinqua clausa abstrusa diversa invia,0.9166666666666666,681, lo*ngi_nqva^ cl[au]s(a) a*bstru_sa^ di_ve*rs(a) i_nvi^a*,2
['940'],['#theseus'],"emetiemur, nullus obstabit locus:",1.0,682, e*me_ti^e_mu*r nu_llu^s o_bsta*bi_t lo^cu*s,0
['941'],['#theseus'],"scis unde redeam, tela quo mitti haud queunt,",0.85,683, sci*s u_nde^ re^de^a*m te_la^ qvo_ mi*tt(i) h[au]d qve^u*nt,1
['942'],['#theseus'],"huc vota mittam, genitor aequoreus dedit",0.9166666666666666,684, hu*c vo_ta^ mi_tta*m ge^ni^to^r [ae]qvo^re^u_s de^di*t,0
['943'],['#theseus'],ut vota prono terna concipiam deo.,1.0,685, u*t vo_ta^ pro_no* te_rna^ co_nci^pi^a_m de^o*,0
['944'],['#theseus'],et invocata munus hoc sanxit Styge.,1.0,686, e*t i_nvo^ca_ta* mu_nu^s ho_c sa*nxi_t sty^ge*,0
['945'],['#theseus'],"En perage donum triste, regnator freti!",1.0,687, e*n pe^ra^ge^ do_nu*m tri_ste^ re_gna*to_r fre^ti*,0
['946'],['#theseus'],non cernat ultra lucidum Hippolytum diem,0.918918918918919,688, no*n ce_rna^t u_ltra* lu_ci^d(u)m hi_ppo^ly^tu_s di^e*m,1
['947'],['#theseus'],"adeatque manes iuvenis iratos patri,",0.84375,689, a^de^a_tqve^ ma_ne*s ju^ve^ni^s i_ra*to_s pa^tri*,0
['948'],['#theseus'],"fer abominandam nunc opem gnato, parens:",1.0,690,fe^r a^bo_mi^na_nda*m nu_nc o^pe_m gna*to_ pa^re*ns,0
['949'],['#theseus'],numquam supremum numinis munus tui,0.9032258064516129,691, nu*mqva_m su^pre_mu*m nu_mi^ni_s mu*nu_s tu^i*,0
['950'],['#theseus'],consumeremus. magna ni premerent mala:,1.0,692, co*nsu_me^re_mu*s ma_gna^ ni_ pre^me^re_nt ma^la*,0
['951'],['#theseus'],inter profunda Tartara et Ditem horridum,1.0,693, i*nte_r pro^fu_nda* ta_rta^r(a) e_t di*t(e)m ho_rri^du*m,2
['952'],['#theseus'],"et imminentes regis inferni minas,",1.0,694, e*t i_mmi^ne_nte*s re_gi^s i_nfe*rni_ mi^na*s,0
['953'],['#theseus'],"voto peperci: redde nunc pactam fidem,",1.0,695, vo*to_ pe^pe_rci* re_dde^ nu_nc pa*cta_m fi^de*m,0
['954'],['#theseus'],"genitor, moraris? cur adhuc undae silent?",1.0,696, ge^ni^to_r mo^ra_ri*s cu_r a^dhu_c u*nd[ae] si^le*nt,0
['955'],['#theseus'],nunc atra ventis nubila impellentibus,1.0,697, nu*nc a_tra^ ve_nti*s nu_bi^l(a) i_mpe*lle_nti^bu*s,1
['956'],['#theseus'],"subtexe noctem, sidera et caelum eripe,",1.0,698, su*bte_xe^ no_cte*m si_de^r(a) e_t c[ae]l(u)m e_ri^pe*,2
['957'],['#theseus'],"effunde pontum, vulgus aequoreum cie",0.90625,699, e*ffu_nde^ po_ntu*m vu_lgu^s [ae]qvo^re^u_m ci^e*,0
['958'],['#theseus'],fluctusque ab imo tumidus Oceano voca.,0.8,700, flu*ctu_sqv(e) a^b i_pso* tu^mi^du^s o_ce^a^no_ vo^ca*,1
['959'],['#chorus'],"O magna parens, Natura, deum",0.0,,,0
['960'],['#chorus'],"tuque igniferi rector Olympi,",0.0,,,0
['961'],['#chorus'],qui sparsa cito sidera mundo,0.0,,,0
['962'],['#chorus'],cursusque vagos rapis astrorum,0.0,,,0
['963'],['#chorus'],"celerique polos cardine versas,",0.0,,,0
['964'],['#chorus'],cur tanta tibi cura perennes,0.0,,,0
['965'],['#chorus'],"agitare vias aetheris alti,",0.0,,,0
['966'],['#chorus'],ut nunc canae frigora brumae,0.0,,,0
['967'],['#chorus'],"nudent silvas,",0.0,,,0
['968'],['#chorus'],"nunc arbustis redeant umbrae,",0.0,,,0
['969'],['#chorus'],nunc aestivi colla leonis,0.0,,,0
['970'],['#chorus'],Cererem magno fervore coquant,0.0,,,0
['971'],['#chorus'],viresque suas temperet annus?,0.0,,,0
['972'],['#chorus'],"sed cur idem qui tanta regis,",0.0,,,0
['973'],['#chorus'],sub quo vasti pondera mundi,0.0,,,0
['974'],['#chorus'],"librata suos ducunt orbes,",0.0,,,0
['975'],['#chorus'],"hominum nimium' securus abes,",0.0,,,0
['976'],['#chorus'],non sollicitus,0.0,,,0
['977'],['#chorus'],"prodesse bonis, nocuisse malis?",0.0,,,0
['978'],['#chorus'],res humanas ordine nullo,0.0,,,0
['979'],['#chorus'],Fortuna regit sparsitque manu,0.0,,,0
['980'],['#chorus'],"munera caeca, peiora fovens;",0.0,,,0
['981'],['#chorus'],"vincit sanctos dira libido,",0.0,,,0
['982'],['#chorus'],fraus sublimi regnat in aula.,0.0,,,0
['983'],['#chorus'],tradere turpi fasces populus,0.0,,,0
['984'],['#chorus'],"gaudet, eosdem colit atque odit.",0.0,,,0
['985'],['#chorus'],tristis virtus perversa tulit,0.0,,,0
['986'],['#chorus'],praemia recti:,0.0,,,0
['987'],['#chorus'],castos sequitur mala paupertas,0.0,,,0
['988'],['#chorus'],vitioque potens regnat adulter:,0.0,,,0
"['989', '989b']","['#chorus', '#chorus']",o vane pudor falsumque decus! Sed quid citato nuntius properat gradu,0.0,,,0
['990'],['#chorus'],rigatque maestis lugubrem vultum genis?,0.9142857142857143,702, ri*ga_tqve^ m[ae]sti*s lu_gu^bre_m vu*ltu_m ge^ni*s,0
['991'],['#nuntius theseus'],"O sors acerba et dura, famulatus gravis,",1.0,703, o* so_rs a^ce_rb(a) e*t du_ra^ fa^mu^la*tu_s gra^vi*s,1
['992'],['#nuntius theseus'],cur me ad nefandum nuntium casus vocat?,0.9142857142857143,704, cu*r m(e) a_d ne^fa_ndi* nu_nti^u_m ca*su_s vo^ca*s,1
['993'],['#theseus'],Ne metue cladis fortiter fari asperas:,1.0,705, ne* me^tu^e^ cla_di*s fo_rti^te_r fa*r(i) a_spe^ra*s,1
['994'],['#theseus'],non imparatum pectus aerumnis fero.,0.9032258064516129,706, no*n i_mpa^ra_tu*m pe_ctu^s [ae]ru*mni_s ge^ro*,0
['995'],['#nuntius'],Vocem dolori lingua luctificam negat.,0.9090909090909091,707, vo*ce_m do^lo_ri* li_ngva^ lu_cti^fi^ca_m ne^ga*t,0
['996'],['#theseus'],Proloquere quae sors aggravet quassam domum.,0.775,708,pro*lo^qve^re^ qv[ae] so*rs a_ggra^ve_t qva*ssa_m do^mu*m,0
['997'],['#nuntius'],"Hippolytus, heu me, flebili leto occubat.",1.0,709,hi*ppo^ly^tu^s h[eu] me* fle_bi^li_ le*t(o) o_ccu^ba*t,1
['998'],['#theseus'],Gnatum parens obisse iam pridem scio:,0.9090909090909091,710, gna*tu_m pa^re_ns o*bi_sse^ ja_m pri*de_m sci^o*,0
['999'],['#theseus'],"nunc raptor obiit, mortis effare ordinem.",1.0,711,nu*nc ra_pto^r o^bi^i*t mo_rti^s e_ffa*r(e) o_rdi^ne*m,1
['1000'],['#nuntius'],Vt profugus urbem liquit infesto gradu,0.8857142857142857,712, u*t pro^fu^gu^s u_rbe*m li_qvi^t i_nfe*sto_ gra^du*,0
['1001'],['#nuntius'],"celerem citatis passibus cursum explicans,",1.0,713, ce^le^re_m ci^ta_ti*s pa_ssi^bu_s cu*rs(u)m e_xpli^ca*ns,1
['1002'],['#nuntius'],celso sonipedes ocius subigit iugo,0.9032258064516129,714,ce*lso_ so^ni^pe^de*s o_ci^u_s su^bi^gi_t ju^go*,0
['1003'],['#nuntius'],et ora frenis domita substrictis ligat.,1.0,715, e*t o_ra^ fre_ni*s do^mi^ta^ su_bstri*cti_s li^ga*t,0
['1004'],['#nuntius'],tum multa secum effatus et patrium solum,1.0,716, tu*m mu_lta^ se_c(u)m e*ffa_tu^s e_t pa^tri^u_m so^lu*m,1
['1005'],['#nuntius'],abominatus saepe genitorem ciet,1.0,717, a*bo_mi^na_tu*s s[ae]pe^ ge^ni^to*re_m ci^e*t,0
['1006'],['#nuntius'],acerque habenis lora permissis quatit:,0.8235294117647058,718, a*ce_rqv(e) ha^be_ni*s lo_ra^ pe_rmi*ssi_s qva^ti*t,1
['1007'],['#nuntius'],cum subito vastum tonuit ex alto mare,0.9117647058823529,719,cu*m su^bi^to^ ua_stu*m to^nu^i^t e_x a*lto_ ma^re*,0
['1008'],['#nuntius'],"crevitque in astra, nullus inspirat salo",0.9166666666666666,720, cre*vi_tqv(e) i^n a_stra* nu_llu^s i_nspi*ra_t sa^lo*,1
['1009'],['#nuntius'],"ventus, quieti nulla pars caeli strepit",0.9142857142857143,721, ve*ntu_s qvi^e_ti* nu_lla^ pa_rs c[ae]li_ stre^pi*t,0
['1010'],['#nuntius'],placidumque pelagus propria tempestas agit.,0.9230769230769231,722, pla^ci^du_mqve^ pe^la^gu*s pro^pri^a^ te_mpe*sta_s a^gi*t,0
['1011'],['#nuntius'],non tantus Auster Sicula disturbat freta,1.0,723, no*n ta_ntu^s [au]ste*r si^cu^la^ di_stu*rba_t fre^ta*,0
['1012'],['#nuntius'],nec tam furens Ionius exsurgit sinus,0.9090909090909091,724,ne*c ta_m fu^re_ns i*o_nju^s e_xsu*rgi_t si^nu*s,0
['1013'],['#nuntius'],"regnante Coro, saxa cum fluctu tremunt",1.0,725, re*gna_nte^ co_ro* sa_xa^ cu_m flu*ctu_ tre^mu*nt,0
['1014'],['#nuntius'],et cana summum spuma Leucaten ferit.,1.0,726,e*t ca_na^ su_mmu*m spu_ma^ l[eu]ca*te_n fe^ri*t,0
['1015'],['#nuntius'],"consurgit ingens pontus in vastum aggerem,",1.0,727, co*nsu_rgi^t i_nge*ns po_ntu^s i_n va*st(u)m a_gge^re*m,1
['1016'],['#nuntius'],tumidumque monstro pelagus in terras ruit.,0.9210526315789473,728, tu^mi^du_mqve^ mo_nstro* pe^la^gu^s i_n te*rra_s ru^i*t,0
['1017'],['#nuntius'],nec ista ratibus tanta construitur lues:,1.0,729, ne*c i_sta^ ra^ti^bu*s ta_nta^ co_nstru^i^tu_r lu^e*s,0
['1018'],['#nuntius'],terris minatur; fluctus haud cursu levi,1.0,730, te*rri_s mi^na_tu*r flu_ctu^s h[au]d cu*rsu_ le^vi*,0
['1019'],['#nuntius'],provolvitur: nescio quid onerato sinu,0.9090909090909091,731, pro*vo_lvi^tu_r ne*sci^o^ qvi^d o^ne^ra*to_ si^nu*,0
['1020'],['#nuntius'],"gravis unda portat, quae novum tellus caput",0.9230769230769231,732, gra^vi^s u_nda^ po_rta*t qv[ae] no^vu_m te*llu_s ca^pu*t,0
['1021'],['#nuntius'],ostendit astris? Cyclas exoritur nova?,0.8787878787878788,733,o*ste_nde^t a_stri*s cy_cla^s e_xo^ri^tu_r no^ua*,0
['1022'],['#nuntius'],latuere rupes numine Epidauri dei,1.0,734, la^tu^e_re^ ru_pe*s nu_mi^n(e) e^pi^d[au]ri_ de^i*,1
['1023'],['#nuntius'],et scelere petrae nobiles Scironides,1.0,735, e*t sce^le^re^ pe_tr[ae] no_bi^le_s sci*ro_ni^de*s,0
['1024'],['#nuntius'],et quae duobus terra comprirnitur fretis.,0.8108108108108109,736, e*t qv[ae] du^o_bu*s te_rra^ co_mpri^mi^tu_r fre^ti*s,0
['1025'],['#nuntius'],"haec dum stupentes quaerimus, totum en mare",0.6923076923076923,737, h[ae]c du_m stu^pe_nte*s se^qvi^mu^r e_n to*tu_m ma^re*,0
['1026'],['#nuntius'],"immugit, omnes undique scopuli adstrepunt;",0.918918918918919,738, i*mmu_gi^t o_mne*s u_ndi^qve_ sco^pu^l(i) a_dstre^pu*nt,1
['1027'],['#nuntius'],summum cacumen rorat expulso sale.,1.0,739, su*mmu_m ca^cu_me*n ro_ra^t e_xpu*lso_ sa^le*,0
['1028'],['#nuntius'],spumat vomitque vicibus alternis aquas,0.8571428571428571,740, spu*ma_t vo^mi_tqve* vi^ci^bu^s a_lte*rni_s a^qva*s,0
['1029'],['#nuntius'],qualis per alta vehitur Oceani freta,0.9393939393939394,741, qva*li_s pe^r a_lta* ve^hi^tu^r o_ce^a^ni_ fre^ta*,0
['1030'],['#nuntius'],"fluctum refundens ore physeter capax. ,",1.0,742, flu*ctu_m re^fu_nde*ns o_re^ phy_se*te_r ca^pa*x,0
['1031'],['#nuntius'],inhorruit concussus undarum globus,1.0,743, i*nho_rru^i_t co*ncu_ssu^s u_nda*ru_m glo^bu*s,0
['1032'],['#nuntius'],solvitque sese et litori invexit malum,0.9142857142857143,744, so*lvi_tqve^ se_s(e) e*t li_to^r(i) i_nve*xi_t ma^lu*m,2
['1033'],['#nuntius'],"maius timore, pontus in terras ruit",0.9032258064516129,745, ma*ju_s ti^mo_re* po_ntu^s i_n te*rra_s ru^i*t,0
['1034'],['#nuntius'],suumque monstrum sequitur— os quassat tremor.,0.775,746, su*u_mqve^ mo_nstru*m se^qvi^tu^r o_s qva*ssa_t tre^mo*r,0
['1035'],['#nuntius'],quis habitus illi corporis vasti fuit!,0.8235294117647058,747,qui*s ha^bi^tu^s i_lle* co_rpo^ri_s ua*sti_ fu^i*t,0
['1036'],['#nuntius'],caerulea taurus colla sublimis gerens,1.0,748, c[ae]ru^le^a^ t[au]ru*s co_lla^ su_bli*mi_s ge^re*ns,0
['1037'],['#nuntius'],erexit altam fronte viridanti iubam;,0.90625,749, e*re_xi^t a_lta*m fro_nte^ vi^ri^da*nti_ ju^ba*m,0
['1038'],['#nuntius'],"stant hispidae auris, orbibus varius color,",0.9210526315789473,750,sta*nt hi_spi^d(ae) [au]re*s o_rbi^bu_s va^ri^u_s co^lo*r,1
['1039'],['#nuntius'],et quem feri dominator habuisset gregis,0.9166666666666666,751, e*t qve_m fe^ri_ do^mi^na_to^r ha^bu^i*sse_t gre^gi*s,0
['1040'],['#nuntius'],et quem sub undis natus: hinc flammam vomunt,0.925,752, e*t qve_m su^b u_ndi*s na_tu^s hi_nc fla*mma_m vo^mu*nt,0
['1041'],['#nuntius'],"oculi, hinc relucent caerula insignes nota;",1.0,753, o^cu^l(i) hi_nc re^lu_ce*nt c[ae]ru^l(a) i_nsi*gne_s no^ta*,2
['1042'],['#nuntius'],opima cervix arduos tollit toros,1.0,754, o*pi_ma^ ce_rvi*x a_rdu^o_s to*lli_t to^ro*s,0
['1043'],['#nuntius'],naresque hiulcis haustibus patulae fremunt;,0.9230769230769231,755, na*re_sqv(e) hi^u_lci*s h[au]sti^bu_s pa^tu^l[ae] fre^mu*nt,1
['1044'],['#nuntius'],"musco tenaci pectus ac palear viret,",1.0,756, mu*sco_ te^na_ci* pe_ctu^s a_c pa^le^a_r vi^re*t,0
['1045'],['#nuntius'],longum iubente spargitur fuco latus;,0.8125,757, lo*ngu_m ru^be_nti* spa_rgi^tu_r fu*co_ la^tu*s,0
['1046'],['#nuntius'],tum pone tergus ultima in monstrum coit,1.0,758, tu*m po_ne^ te_rgu*s u_lti^m(a) i_n mo*nstru_m co^i*t,1
['1047'],['#nuntius'],facies et ingens belua immensam trahit,1.0,759, fa^ci^e_s e^t i_nge*ns be_lu^(a) i_mme*nsa_m tra^hi*t,1
['1048'],['#nuntius'],"squamosa partem, talis extremo mari",0.9032258064516129,760, sqva*mo_sa^ pa_rte*m ta_li^s e_xtre*mo_ ma^ri*,0
['1049'],['#nuntius'],pistrix citatas sorbet aut frangit rates.,1.0,761, pi*stri_x ci^ta_ta*s so_rbe^t [au]t fra*ngi_t ra^te*s,0
['1050'],['#nuntius'],"tremuere terrae, fugit attonitum pecus",1.0,762, tre^mu^e_re^ te_rr[ae] fu_gi^t a_tto^ni^tu_m pe^cu*s,0
['1051'],['#nuntius'],passim per agros nec suos pastor sequi,0.9714285714285714,763, pa*ssi_m pe^r a_gro*s ne_c su^o_s pa*sto_r se^qvi*,0
['1052'],['#nuntius'],meminit iuvencos; omnis e saltu fera,0.90625,764, me^mi^ni_t ju^ve_nco*s o_mni^s e_ sa*ltu_ fe^ra*,0
['1053'],['#nuntius'],"diffugit, omnis frigido exsanguis metu",0.9117647058823529,765, di*ffu_gi^t o_mni*s fri_gi^d(o) e_xsa*ngvi_s me^tu*,1
['1054'],['#nuntius'],"venator horret, solus immunis metu",1.0,766, ve*na_to^r ho_rre*t so_lu^s i_mmu*ni_s me^tu*,0
['1055'],['#nuntius'],Hippolytus artis continet frenis equos,0.9428571428571428,767, hi*ppo^ly^tu^s a_rti*s co_nti^ne_t fre*ni_s e^qvo*s,0
['1056'],['#nuntius'],pavidosque notae vocis hortatu ciet.,0.90625,768, pa^vi^do_sqve^ no_t[ae] vo_ci^s ho_rta*tu_ ci^e*t,0
['1057'],['#nuntius'],"est alta ad agros collibus ruptis via,",0.8823529411764706,769, e*st a_lt(a) a^d a_rgo*s co_lli^bu_s ru*pti_s vi^a*,1
['1058'],['#nuntius'],vicina tangens spatia suppositi maris;,1.0,770,vi*ci_na^ ta_nge*ns spa^ti^a^ su_ppo^si^ti_ ma^ri*s,0
['1059'],['#nuntius'],hic se illa moles acuit atque iras parat.,0.918918918918919,771, hi*c s(e) i_lla^ mo_le*s a^cu^i^t a_tqv(e) i*ra_s pa^ra*t,2
['1060'],['#nuntius'],ut cepit animos seque praetemptans satis,1.0,772,u*t ce_pi^t a^ni^mo*s se_que^ pr[ae]te*mpta_ns sa^ti*s,0
['1061'],['#nuntius'],"prolusit irae, praepeti cursu evolat,",1.0,773, pro*lu_si^t i_r[ae] pr[ae]pe^ti_ cu*rs(u) e_vo^la*t,1
['1062'],['#nuntius'],"summam citato vix gradu tangens humum,",1.0,774, su*mma_m ci^ta_to* vi_x gra^du_ ta*nge_ns hu^mu*m,0
['1063'],['#nuntius'],et torva currus ante trepidantes stetit.,0.9444444444444444,775, e*t to_rva^ cu_rru*s a_nte^ tre^pi^da*nti_s ste^ti*t,0
['1064'],['#nuntius'],contra feroci gustus insurgens minax,0.8787878787878788,776, co*ntra_ fe^ro_ci* gna_tu^s i_nsu*rge_ns mi^na*x,0
['1065'],['#nuntius'],vultu nec ora mutat et magnum intonat:,1.0,777, vu*ltu_ ne^c o_ra* mu_ta^t e_t ma*gn(u)m i_nto^na*t,1
['1066'],['#nuntius'],'haud frangit animum vanus hic terror meum:,1.0,778, h[au]d fra_ngi^t a^ni^mu*m va_nu^s hi_c te*rro_r me^u*m,0
['1067'],['#nuntius'],nam mihi paternus vincere est tauros labor.',1.0,779, na*m mi^hi^ pa^te_rnu*s vi_nce^r(e) e_st t[au]ro_s la^bo*r,1
['1068'],['#nuntius'],inobsequentes protinus frenis equi,0.8709677419354839,780, i*no_bse^qve_nte*s pro_ti^nu_s fre*ni_s e^qvi*,0
['1069'],['#nuntius'],"rapuere currum iamque derrantes via,",0.71875,781, ra^pu^e_re^ cu_rsu*m ja_mqve^ de_rra*nte_s vi^a*,0
['1070'],['#nuntius'],"quacumque rabidos pavidus evexit furor,",0.8571428571428571,782, qva*cu_mqve^ ra^bi^do*s pa^vi^du^s e_ve*xi_t fu^ro*r,0
['1071'],['#nuntius'],hac ire pergunt seque per scopulos agunt.,1.0,783,ha*c i_re^ pe_rgu*nt se_que^ pe_r sco^pu^lo_s a^gu*nt,0
['1072'],['#nuntius'],"at ille, qualis turbido rector mari",0.9032258064516129,784, a*t i_lle^ qva_li*s tu_rbi^do_ re*cto_r ma^ri*,0
['1073'],['#nuntius'],"ratem retentat, ne det obliquum latus,",0.9090909090909091,785, ra*te_m re^te_nta*t ne_ de^t o_bli*qvu_m la^tu*s,0
['1074'],['#nuntius'],"et arte fluctum fallit, haud aliter citos",1.0,786, e*t a_rte^ flu_ctu*m fa_lli^t h[au]d a^li^te_r ci^to*s,0
['1075'],['#nuntius'],currus gubernat: ora nunc pressis trahit,1.0,787, cu*rru_s gu^be_rna*t o_ra^ nu_nc pre*ssi_s tra^hi*t,0
['1076'],['#nuntius'],"constricti frenis, terga nunc torto frequens",0.85,788, co*nstri_cta^ fre_ni*s te_rga^ nu_nc to*rto_ fre^qve*ns,0
['1077'],['#nuntius'],"verbere cohercet. sequitur adsiduus comes,",0.8378378378378378,789, ve*rbe^re^ co^e_rce*t se^qvi^tu^r a_dsi^du^u_s co^me*s,0
['1078'],['#nuntius'],"nunc aequa carpens spatia, nunc contra obvius",0.926829268292683,790, nu*nc [ae]qva^ ca_rpe*ns spa^ti^a^ nu_nc co*ntr(a) o_bvi^u*s,1
['1079'],['#nuntius'],"oberrat, omni parte terrorem movens.",1.0,791, o*be_rra^t o_mni* pa_rte^ te_rro*re_m mo^ve*ns,0
['1080'],['#nuntius'],non-licuit ultra fugere: nam toto obvius,1.0,792, no*n li^cu^i^t u_ltra* fu^ge^re^ na_m to*t(o) o_bvi^u*s,1
['1081'],['#nuntius'],incurrit ore corniger ponti horridus.,1.0,793, i*ncu_rri^t o_re* co_rni^ge_r po*nt(i) ho_rri^du*s,1
['1082'],['#nuntius'],tum vero pavida sonipedes mente exciti,0.8285714285714286,794,tu*m ue_ro^ pa^ui^da* so^ni^pe^de_s me*nt(e) e_xci^ti*,1
['1083'],['#nuntius'],imperia solvunt seque luctantur iugo,0.9090909090909091,795,i*mpe^ri^a^ so_luu*nt se_que^ lu_cta*ntu_r iu^go*,0
['1084'],['#nuntius'],eripere rectique in pedes iactant onus.,0.8285714285714286,796, e*ri^pe^re^ re_cti*qv(e) i_n pe^de_s ja*cta_nt o^nu*s,1
['1085'],['#nuntius'],praeceps in ora fusus implicuit cadens,1.0,797, pr[ae]ce_ps i^n o_ra* fu_su^s i_mpli^cu^i_t ca^de*ns,0
['1086'],['#nuntius'],laqueo tenaci corpus et quanto magis,0.8181818181818182,798, la^qve^o_ te^na_ci* co_rpu^s e_t qva*nto_ ma^gi*s,0
['1087'],['#nuntius'],"pugnat, sequaces hoc magis nodos ligat.",0.9117647058823529,799, pu*gna_t se^qva_ce*s ho_c ma^gi_s no*do_s li^ga*t,0
['1088'],['#nuntius'],"sensere pecudes facinus— et curru levi,",1.0,800, se*nse_re^ pe^cu^de*s fa^ci^nu^s e_t cu*rru_ le^vi*,0
['1089'],['#nuntius'],"dominante nullo, qua timor iussit ruunt.",0.8285714285714286,801,do^mi^na_nte^ nu_llo* qva_ ti^mo_r ju*ssi_t ru^u*nt,0
['1090'],['#nuntius'],talis per auras non suum agnoscens onus,1.0,802, ta*li_s pe^r [au]ra*s no_n su^(u)m a_gno*sce_ns o^nu*s,1
['1091'],['#nuntius'],Solique falso creditum indignans diem,0.9117647058823529,803, so*li_qve^ fa_lso* cre_di^t(u)m i_ndi*gna_ns di^e*m,1
['1092'],['#nuntius'],Phaethonta currus devio excussit polo.,0.8857142857142857,804, pha^e^tho_nta^ cu_rru*s de_vi^(u)m e_xcu*ssi_t po^lo*,1
['1093'],['#nuntius'],late cruentat arva et inrisum caput,0.90625,805, la*te_ cru^e_nta*t a_rv(a) e^t i_nli*su_m ca^pu*t,1
['1094'],['#nuntius'],"scopulis resultat; auferant dumi comas,",0.9117647058823529,806, sco^pu^li_s re^su_lta*t [au]fe^ru_nt du*mi_ co^ma*s,0
['1095'],['#nuntius'],et ora duras pulchra populatur lapis,0.8181818181818182,807, e*t o_ra^ du_ru*s pu_lcra^ po^pu^la*tu_r la^pi*s,0
['1096'],['#nuntius'],peritque multo vulnere infelix decor.,0.9090909090909091,808, pe*ri_tqve^ mu_lto* vu_lne^r(e) i_nfe*li_x de^co*r,1
['1097'],['#nuntius'],moribunda celeres membra pervolvunt rotae:,1.0,809, mo^ri^bu_nda^ ce^le^re*s me_mbra^ pe_rvo*lvu_nt ro^t[ae],0
['1098'],['#nuntius'],tandemque raptum truncus ambusta sude,0.9117647058823529,810, ta*nde_mqve^ ra_ptu*m tru_ncu^s a_mbu*sta_ su^de*,0
['1099'],['#nuntius'],"medium per inguen stipite ingesto tenet,",0.9166666666666666,811, me^di^u_m pe^r i_ngve*n sti_pi^t(e) i_nge*sto_ te^ne*t,1
['1100'],['#nuntius'],paulumque domino currus affixo stetit.,0.9117647058823529,812, p[au]lu_mqve^ do^mi^no* cu_rru^s a_ffi*xo_ ste^ti*t,0
['1101'],['#nuntius'],haesere biiuges vulnere— et pariter moram,0.918918918918919,813, h[ae]se_re^ bi^ju^ge*s vu_lne^r(e) e_t pa^ri^te_r mo^ra*m,1
['1102'],['#nuntius'],"dominumque rumpunt, inde semanimem secant",0.9459459459459459,814,do^mi^nu_mque^ ru_mpu*nt i_nde^ se_mia^ni^me_m se^ca*nt,0
['1103'],['#nuntius'],"virgulta, acutis asperi vepres rubis",1.0,815, vi*rgu_lt(a) a^cu_ti*s a_spe^ri_ ve*pre_s ru^bi*s,1
['1104'],['#nuntius'],omnisque truncus corporis partem tulit.,0.7428571428571429,816, o*mni_sqve^ ru_scu*s co_rpo^ri_s pa*rte_m tu^li*t,0
['1105'],['#nuntius'],"errant per agros funebris famuli manus,",1.0,817, e*rra_nt pe^r a_gro*s fu_ne^bri_s fa^mu^li_ ma^nu*s,0
['1106'],['#nuntius'],per illa qua distinctus Hippolytus loca,0.8055555555555556,818, pe*r i_lla^ qva_ di*stra_ctu^s hi_ppo^ly^tu_s lo^ca*,0
['1107'],['#nuntius'],"longum cruenta tramitem signat nota,",1.0,819, lo*ngu_m cru^e_nta* tra_mi^te_m si*gna_t no^ta*,0
['1108'],['#nuntius'],maestaeque domini membra vestigant canes.,0.918918918918919,820, m[ae]st[ae]qve^ do^mi^ni* me_mbra^ ve_sti*ga_nt ca^ne*s,0
['1109'],['#nuntius'],necdum dolentum sedulus potuit labor,1.0,821,ne*cdu_m do^le_ntu*m se_du^lu_s po^tu^i_t la^bo*r,0
['1110'],['#nuntius'],"explere corpus, hocine est formae decus?",1.0,822, e*xple_re^ co_rpu*s ho_ci^n(e) e_st fo*rm[ae] de^cu*s,1
['1111'],['#nuntius'],qui modo paterni clarus imperii comes,0.9411764705882353,823, qvi* mo^do^ pa^te_rni* cla_ru^s i_mpe^ri^i_ co^me*s,0
['1112'],['#nuntius'],"et certus heres siderum fulsit modo,",1.0,824, e*t ce_rtu^s he_re*s si_de^ru_m fu*lsi_t mo^do*,0
['1113'],['#nuntius'],passim ad supremos ille colligitur rogos,1.0,825, pa*ss(i)m a_d su^pre_mo*s i_lle^ co_lli^gi^tu_r ro^go*s,1
"['1114', '1114b']","['#nuntius', '#theseus']","et funeri confertur. O nimium potens,",1.0,826, e*t fu_ne^ri_ co*nfe_rtu^r o_ ni^mi^u_m po^te*ns,0
['1115'],['#theseus'],quanto parentes sanguinis vinclo tenes.,0.8571428571428571,827, qva*nto_ pa^re_nte*s sa_ngvi^ni_s vi*nclo_ te^ne*s,0
['1116'],['#theseus'],"natura, quam te colimus inviti quoque:",0.7878787878787878,828, na*tu_ra^ qva_m te* co^li^mu^s i_nvi*ti_ qvo^qve*,0
['1117'],['#theseus'],"occidere volui noxium, amissum fleo.",0.9032258064516129,829,o*cci^de^re^ uo^lu^i* no_xi^(u)m a_mi*ssu_m fle^o*,1
['1118'],['#nuntius'],Gaudere non est ipse quod voluit potens.,0.0,,,0
['1119'],['#theseus'],"Equidem malorum maximum hunc cumulum reor,",0.9210526315789473,831, e^qvi^de_m ma^lo_ru*m ma_xi^m(u)m hu_nc cu^mu^lu_m re^o*r,1
['1120'],['#theseus'],si abominaiida casus optanda efficit.,0.8787878787878788,832, s(i) a*bo_mi^na_nda* ca_su^s o_pta*nd(a) e_ffi^ci*t,2
['1121'],['#nuntius'],"Et si odia servas, cur madent fletu genae?",1.0,833, e*t s(i) o^di^a^ se_rva*s cu_r ma^de_nt fle*tu_ ge^n[ae],1
['1122'],['#theseus'],"Quod interemi non, quod amisi fleo.",0.8333333333333334,834, qvo*d i_nte^re_mi* no_n qvo^d a_mi*si_ fle^o*,0
['1123'],['#chorus'],Quanti casus humana rotant!,0.0,,,0
['1124'],['#chorus'],minor in parvis Fortuna furit,0.0,,,0
['1125'],['#chorus'],leviusque ferit leviora deus;,0.0,,,0
['1126'],['#chorus'],servat placidos obscura quies,0.0,,,0
['1127'],['#chorus'],praebetque senes casa securos.,0.0,,,0
['1128'],['#chorus'],Admota aetheriis culmina sedibus,0.0,,,0
['1129'],['#chorus'],"Euros excipiunt, excipiunt Notos,",0.0,,,0
['1130'],['#chorus'],insani Boreae minas,0.0,,,0
['1131'],['#chorus'],imbriferumque Corum.,0.0,,,0
['1132'],['#chorus'],Raros patitur fulminis ictus,0.0,,,0
['1133'],['#chorus'],umida vallis:,0.0,,,0
['1134'],['#chorus'],tremuit telo Iovis altisoni,0.0,,,0
['1135'],['#chorus'],Caucasus ingens Plirygiurnque nemus,0.0,,,0
['1136'],['#chorus'],matris Cybeles: metuens caelo,0.0,,,0
['1137'],['#chorus'],Iuppiter alto vicina petit;,0.0,,,0
['1138'],['#chorus'],non capit umquam magnos motus,0.0,,,0
['1139'],['#chorus'],humilis tecti plebeia domus.,0.0,,,0
['1140'],['#chorus'],circa regna tonat,0.0,,,0
['1141'],['#chorus'],Volat ambiguis mobilis alis,0.0,,,0
['1142'],['#chorus'],"hora, nec ulli praestat velox",0.0,,,0
['1143'],['#chorus'],"Fortuna fidem,",0.0,,,0
['1144'],['#chorus'],hic qui clari sidera mundi,0.0,,,0
['1145'],['#chorus'],nitidumque diem morte relicta.,0.0,,,0
['1146'],['#chorus'],luget maestos tristis reditus,0.0,,,0
['1147'],['#chorus'],ipsoque magis flebile Averno,0.0,,,0
['1148'],['#chorus'],sedis patriae videt hospitium.,0.0,,,0
