cts_ln,speaker,perseus,comp,anceps_n,anceps,elision
['1'],['#hippolytus'],"Ite, umbrosas cingite silvas",0.0,,,0
['2'],['#hippolytus'],"summaque montis iuga, Cecropii!",0.0,,,0
['3'],['#hippolytus'],"celeri planta lustrate vagi,",0.0,,,0
['4'],['#hippolytus'],quae saxosae loca Parnetbo,0.0,,,0
"['5', '5b']","['#hippolytus', '#hippolytus']","subiecta iacent, quae Thriasiis vallibus amnis",0.0,,,0
['6'],['#hippolytus'],rapida currens verberat unda;,0.0,,,0
['7'],['#hippolytus'],scandite colles,0.0,,,0
['8'],['#hippolytus'],semper canos nive Riphaea;,0.0,,,0
['9'],['#hippolytus'],"hac, Aegalei qua nemus alta",0.0,,,0
['10'],['#hippolytus'],"texitur alno, qua prata iacent",0.0,,,0
['11'],['#hippolytus'],quae rorifera mulcens aura,0.0,,,0
['12'],['#hippolytus'],"Zephyrus vernas evocat herbas,",0.0,,,0
['14'],['#hippolytus'],ubi per graciles levis Ilisos,0.0,,,0
['15'],['#hippolytus'],labitur agros piger et steriles,0.0,,,0
['16'],['#hippolytus'],amne maligno radit harenas;,0.0,,,0
['17'],['#hippolytus'],vos qua Marathon tramite laevo,0.0,,,0
['18'],['#hippolytus'],"saltus aperit,",0.0,,,0
['19'],['#hippolytus'],qua comitatae gregibus parvis,0.0,,,0
['20'],['#hippolytus'],nocturna petunt pabula fetae;,0.0,,,0
['21'],['#hippolytus'],vos qua tepidis subditus austris,0.0,,,0
['22'],['#hippolytus'],frigora mollit durus Acbarneus.,0.0,,,0
['23'],['#hippolytus'],"alius rupem dulcis Hymetti,",0.0,,,0
['24'],['#hippolytus'],parvas alius calcet Aphidnas:,0.0,,,0
['25'],['#hippolytus'],"pars illa diu vacat immunis,",0.0,,,0
['26'],['#hippolytus'],qua curvati litora ponti,0.0,,,0
['27'],['#hippolytus'],Sunion urget,0.0,,,0
['28'],['#hippolytus'],"si quem tangit gloria silvae,",0.0,,,0
['29'],['#hippolytus'],vocat hunc Phlyus:,0.0,,,0
"['30', '30b']","['#hippolytus', '#hippolytus']","hic versatur, metus agricolis, vulnere multo iam notus aper.",0.0,,,0
['31'],['#hippolytus'],at vos laxas,0.0,,,0
['32'],['#hippolytus'],canibus tacitis mittite habenas;,0.0,,,0
['33'],['#hippolytus'],teneant acres lora Molossos,0.0,,,0
['34'],['#hippolytus'],et pugnaces tendunt Cretes,0.0,,,0
"['35', '35b']","['#hippolytus', '#hippolytus']",fortia trito vine ala collo. at Spartanos,0.0,,,0
['36'],['#hippolytus'],(genus est audax avidumque ferae),0.0,,,0
['37'],['#hippolytus'],nodo cautus propiore liga:,0.0,,,0
['38'],['#hippolytus'],"veniet tempus,",0.0,,,0
['39'],['#hippolytus'],cum latratu cava saxa sonent;,0.0,,,0
"['40', '40b']","['#hippolytus', '#hippolytus']",nunc dimissi nare sagaci captent auras,0.0,,,0
['41'],['#hippolytus'],"lustraque presso quaerant rostro,",0.0,,,0
['42'],['#hippolytus'],"dum lux dubia est, dum signa pedum",0.0,,,0
['43'],['#hippolytus'],roscida tellus impressa tenet.,0.0,,,0
['44'],['#hippolytus'],alius raras,0.0,,,0
"['45', '45b']","['#hippolytus', '#hippolytus']","cervice gravi portare plagas, alius teretes properet laqueos.",0.0,,,0
['46'],['#hippolytus'],picta rubenti linea pinna,0.0,,,0
['47'],['#hippolytus'],vano cludat terrore feras.,0.0,,,0
['48'],['#hippolytus'],"tibi vibretur missile telum,",0.0,,,0
['49'],['#hippolytus'],tu grave dextra laevaque simul,0.0,,,0
['50'],['#hippolytus'],"robur lato dirige ferro,",0.0,,,0
['51'],['#hippolytus'],tu praecipites clamore feras,0.0,,,0
['52'],['#hippolytus'],subsessor ages; tu iam victor,0.0,,,0
['53'],['#hippolytus'],curvo solves viscera cultro.,0.0,,,0
['54'],['#hippolytus'],"Ades en comiti, diva virago,",0.0,,,0
"['55', '55b']","['#hippolytus', '#hippolytus']","cuius regno pars terrarum secreta vacat,",0.0,,,0
['56'],['#hippolytus'],cuius certis petitur telis,0.0,,,0
['57'],['#hippolytus'],fera quae gelidum,0.0,,,0
['58'],['#hippolytus'],potat Araxen,0.0,,,0
['59'],['#hippolytus'],et quae stanti ludit in Histro.,0.0,,,0
"['60', '60b']","['#hippolytus', '#hippolytus']","* tua Gaetulos dextra leones, tua Cretaeas sequitur cervas;",0.0,,,0
['61'],['#hippolytus'],nunc veloces figis dammas,0.0,,,0
['62'],['#hippolytus'],leviore manu.,0.0,,,0
['63'],['#hippolytus'],"tibi dant variae pectora tigres,",0.0,,,0
['64'],['#hippolytus'],tibi villosi terga bisontes,0.0,,,0
['65'],['#hippolytus'],latisque feri cornibus uri.,0.0,,,0
['66'],['#hippolytus'],"quicquid solis pascitur arvis,",0.0,,,0
['67'],['#hippolytus'],sive illud Arabs divite silva,0.0,,,0
['68'],['#hippolytus'],sive illud inops novit Garamans,0.0,,,0
['69'],['#hippolytus'],sive ferocis iuga Pyrenes,0.0,,,0
['70'],['#hippolytus'],"sive Hyrcani celant saltus,",0.0,,,0
['71'],['#hippolytus'],"vacuisque vagus Sarmata campis,",0.0,,,0
['72'],['#hippolytus'],"arcus metuit, Diana, tuos.",0.0,,,0
['73'],['#hippolytus'],tua si gratus numina cultor,0.0,,,0
['74'],['#hippolytus'],tulit in saltus.,0.0,,,0
['75'],['#hippolytus'],"retia vinctas tenuere feras,",0.0,,,0
['76'],['#hippolytus'],nulli laqueum rupere pedes:,0.0,,,0
['77'],['#hippolytus'],fertur plaustro praeda gementi;,0.0,,,0
['78'],['#hippolytus'],tum rostra canes sanguine multo-,0.0,,,0
['79'],['#hippolytus'],rubicunda gerunt repetitque casas,0.0,,,0
['80'],['#hippolytus'],rustica longo turba triumpho.,0.0,,,0
['81'],['#hippolytus'],"en, diva, faves:",0.0,,,0
['82'],['#hippolytus'],signum arguti misere canes.,0.0,,,0
['83'],['#hippolytus'],"vocor in silvas, hac, hac pergam",0.0,,,0
['84'],['#hippolytus'],qua via longum compensat iter.,0.0,,,0
['85'],['#phaedra nutrix'],"O magna vasti Creta dominatrix freti,",1.0,0,o* ma_gna^ va_sti* cre_ta^ do^mi^na*tri_x fre^ti*,0
['86'],['#phaedra nutrix'],cuius per omne litus innumerae rates,0.9090909090909091,1, cu*ju_s pe^r o_mne* li_tu^s i_nnu^me^r[ae] ra^te*s,0
['87'],['#phaedra nutrix'],tenuere † pontum quicquid Assyria tenus,0.7941176470588235,2,te^nu^e_re^ po_ntu*m qvi_dqvi^d a_ssy^ri^a_ te^nu*s,0
['88'],['#phaedra nutrix'],"tellure Nereus pervius rostris secat,",0.8181818181818182,3, te*llu_re^ ne_re*vs pe_rvi^u_m ro*stri_s se^ca*t,0
['89'],['#phaedra nutrix'],cur me in penates obsidem invisos datam,1.0,4, cu*r m(e) i_n pe^na_te*s o_bsi^d(e)m i_nvi*so_s da^ta*m,2
['90'],['#phaedra nutrix'],hostique nuptam degere aetatem in malis,0.9166666666666666,5, ho*sti_qve^ nu_pta*m de_ge^r(e) [ae]ta*t(e)m i_n ma^li*s,2
['91'],['#phaedra nutrix'],lacrimisque cogis? profugus en coniunx abest,0.85,6, la^cri^mi_sqve^ co_gi*s pro^fu^gu^s e_n co*nju_nx a^be*st,0
['92'],['#phaedra nutrix'],"praestatque nuptae quam solet Theseus fidem,",0.775,7, pr[ae]sta_tqve^ nu_pt[ae] qva_m so^le_t the*se_vs fi^de*m,0
['93'],['#phaedra nutrix'],fortis per altas invii retro lacus,1.0,8, fo*rti_s pe^r a_lta*s i_nvi^i_ re*tro_ la^cu*s,0
['94'],['#phaedra nutrix'],"vadit tenebras miles audacis proci,",1.0,9,va*di_t te^ne_bra*s mi_le^s [au]da*ci_s pro^ci*,0
['95'],['#phaedra nutrix'],solio ut revulsam regis inferni abstrahat;,1.0,10,so^li^(o) u_t re^vu_lsa*m re_gi^s i_nfe*rn(i) a_bstra^ha*t,2
['96'],['#phaedra nutrix'],"pergit furoris socius, haud illum timor",1.0,11, pe*rgi_t fu^ro_ri*s so^ci^u^s h[au]d i*llu_m ti^mo*r,0
['97'],['#phaedra nutrix'],pudorque tenuit— stupra et illicitos toros,0.9210526315789473,12,pu*do_rue^ te^nu^i*t stu_pr(a) e^t i_lli^ci^to_s to^ro*s,1
['98'],['#phaedra nutrix'],Acheronte in imo quaerit Hippolyti pater.,0.918918918918919,13,a^che^ro_nt(e) i^n i_mo* qv[ae]ri^t hi_ppo^ly^ti_ pa^te*r,1
['99'],['#phaedra nutrix'],"Sed maior alius incubat maestae dolor,",0.9117647058823529,14, se*d ma_jo^r a^li^u*s i_ncu^ba_t m[ae]st[ae] do^lo*r,0
['100'],['#phaedra nutrix'],"non. me quies nocturna, non altus sopor",0.9117647058823529,15, no*n me_ qvi^e_s no*ctu_rna^ no_n a*ltu_s so^po*r,0
['101'],['#phaedra nutrix'],solvere curis: alitur et crescit malum,1.0,16, so*lve_re^ cu_ri*s a^li^tu^r e_t cre*sci_t ma^lu*m,0
['102'],['#phaedra nutrix'],et ardet intus qualis Aetnaeo vapor,0.90625,17,e*t a_rde^t i_ntu*s qua_li^s [ae]tn[ae]o_ ua^po*r,0
['103'],['#phaedra nutrix'],exundat antro. Palladis telae vacant,1.0,18, e*xu_nda^t a_ntro* pa_lla^di_s te*l[ae] va^ca*nt,0
['104'],['#phaedra nutrix'],et inter ipsas pensa labuntur manus;,1.0,19, e*t i_nte^r i_psa*s pe_nsa^ la_bu*ntu_r ma^nu*s,0
['105'],['#phaedra nutrix'],non colere donis templa votivis libet.,1.0,20, no*n co^le^re^ do_ni*s te_mpla^ vo_ti*vi_s li^be*t,0
['106'],['#phaedra nutrix'],non inter aras. Atthidum mixtam choris.,1.0,21, no*n i_nte^r a_ra*s a_tthi^du_m mi*xta_m cho^ri*s,0
['107'],['#phaedra nutrix'],"iactare tacitis conscias sacris faces,",0.9705882352941176,22, ja*cta_re^ ta^ci^ti*s co_nsci^a_s sa*cri_s fa^ce*s,0
['108'],['#phaedra nutrix'],nec adire castis precibus aut ritu pio,1.0,23, ne^c a^di_re^ ca_sti*s pre^ci^bu^s [au]t ri*tu_ pi^o*,0
['109'],['#phaedra nutrix'],adiudicatae praesidem terrae deam:,0.9,24, a*dju_di^ca_t[ae] pr[ae]si^de_m te*rr[ae] de^a*m,0
['110'],['#phaedra nutrix'],iuvat excitatas consequi cursu feras,0.8787878787878788,25, ju^va^t e_xci^ta_ta*s co_nse^qvi_ cu*rsu_ fe^ra*s,0
['111'],['#phaedra nutrix'],et rigida molli gaesa iaculari manu.,0.90625,26, e*t ri^gi^da^ mo_lli* g[ae]sa^ ja^cu^la*ri_ ma^nu*,0
['112'],['#phaedra nutrix'],Quo tendis. anime? quid furens saltus amas?,0.8648648648648649,27, qvo* te_ndi^s a^ni^me* qvi_d fu^re_ns sa*ltu_s a^ma*s,0
['113'],['#phaedra nutrix'],fatale miserae matris agnosco malum:,1.0,28, fa*ta_le^ mi^se^r[ae] ma_tri^s a_gno*sco_ ma^lu*m,0
['114'],['#phaedra nutrix'],peccare noster novit in silvis amor.,1.0,29, pe*cca_re^ no_ste*r no_vi^t i_n si*lvi_s a^mo*r,0
['115'],['#phaedra nutrix'],"genetrix, tui me miseret: infando malo",1.0,30, ge^ne^tri_x tu^i_ me* mi^se^re^t i_nfa*ndo_ ma^lo*,0
['116'],['#phaedra nutrix'],correpta pecoris efferum saevi ducem,1.0,31, co*rre_pta^ pe^co^ri*s e_ffe^ru_m s[ae]vi_ du^ce*m,0
['117'],['#phaedra nutrix'],"audax amasti; torvus, impatiens iugi",0.9354838709677419,32, [au]da_x a^ma_sti* to_rvu^s i_mpa^ti^e_ns ju^gi*,0
['118'],['#phaedra nutrix'],"adulter ille, ductor indomiti gregis—",1.0,33, a*du_lte^r i_lle* du_cto^r i_ndo^mi^ti_ gre^gi*s,0
['119'],['#phaedra nutrix'],"sed amabat aliquid, quis meas miserae deus",0.8421052631578947,34, se^d a^ma_ba^t a^li^qvi*d qvi_s me^a_s mi^se^r[ae] de^u*s,0
['120'],['#phaedra nutrix'],aut quis iuvare Daedalus flammas queat?,0.7428571428571429,35, [au]t qvi_s ju^va_re* d[ae]da^lu_s fla*mma_s qve^a*t,0
['121'],['#phaedra nutrix'],"non si ipse remeet, arte Mopsopia potens",0.8888888888888888,36,no*n s(i) i_lle^ re^me^e*t a_rte^ mo_pso^pi^a_ po^te*ns,1
['122'],['#phaedra nutrix'],"qui nostra caeca monstra conclusit domo,",0.9444444444444444,37, qvi* no_stra^ c[ae]ca* mo_nstra^ co_nclu*si_t do^mo*,0
['123'],['#phaedra nutrix'],promittat ullam casibus nostris opem.,1.0,38, pro*mi_tta^t u_lla*m ca_si^bu_s no*stri_s o^pe*m,0
['124'],['#phaedra nutrix'],stirpem perosa Solis invisi Venus,1.0,39, sti*rpe_m pe^ro_sa* so_li^s i_nvi*si_ ve^nu*s,0
['125'],['#phaedra nutrix'],per nos catenas vindicat Martis sui,1.0,40, pe*r no_s ca^te_na*s vi_ndi^ca_t ma*rti_s su^i*,0
['126'],['#phaedra nutrix'],"suasque, probris omne Phoebeum genus",0.90625,41, su*a_sqve^ pro_bri*s o_mne^ ph[oe]be*u_m ge^nu*s,0
['127'],['#phaedra nutrix'],onerat nefandis: nulla Minois levi,0.9666666666666667,42,o^ne^ra_t ne^fa_ndi*s nu_lla^ mi_no*i_s le^ui*,0
['128'],['#phaedra nutrix'],"defuncta amore est, iungitur semper nefas.",0.918918918918919,43, de*fu_nct(a) a^mo_r(e) e*st ju_ngi^tu_r se*mpe_r ne^fa*s,2
['129'],['#nutrix'],"Thesea coniunx, clara progenies Iovis,",0.8181818181818182,44, the*se_a^ co_nju*nx cla_ra^ pro_ge^ni^e_s jo^vi*s,0
['130'],['#nutrix'],"nefanda casto pectore exturba ocius,",1.0,45, ne*fa_nda^ ca_sto* pe_cto^r(e) e_xtu*rb(a) o_ci^u*s,2
['131'],['#nutrix'],extingue flammas neve te dirae spei,0.90625,46,e*xti_ngue^ fla_mma*s ne_ue^ te_ di*r[ae] spe^i*,0
['132'],['#nutrix'],praebe obsequentem: quisquis in primo obstitit,0.7857142857142857,47, pr[ae]b(e) o_bse^qve_nte*m qvi_sqvi^s i_n pri*m(o) o_bsti^ti*t,2
['133'],['#nutrix'],"pepulitque amorem, tutus ac victor fuit;",0.9142857142857143,48, pe^pu^li_tqv(e) a^mo_re*m tu_tu^s a_c vi*cto_r fu^i*t,1
['134'],['#nutrix'],"qui blandiendo dulce nutrivit malum,",0.9375,49, qvi* bla_ndi^e_ndo* du_lce^ nu_tri*vi_t ma^lu*m,0
['135'],['#nutrix'],sero recusat ferre quod subiit iugum.,0.8181818181818182,50, se*ro_ re^cu_sa*t fe_rre^ qvo_d su^bi^i_t ju^gu*m,0
['136'],['#nutrix'],"Nec me fugit, quam durus et veri insolens",0.918918918918919,51, ne*c me_ fu^gi_t qva*m du_ru^s e_t ve*r(i) i_nso^le*ns,1
['137'],['#nutrix'],"ad recta flecti regius nolit tumor,",1.0,52, a*d re_cta^ fle_cti* re_gi^u_s no*li_t tu^mo*r,0
['138'],['#nutrix'],quemcumque dederit exitum casus feram:,0.8529411764705882,53, qve*mcu_mqve^ de^de^ri*t e_xi^tu_m ca*su_s fe^ra*m,0
['139'],['#nutrix'],fortem facit vicina libertas senem.,1.0,54, fo*rte_m fa^ci_t vi*ci_na^ li_be*rta_s se^ne*m,0
['140'],['#nutrix'],Honesta primum est velle nec labi via.,1.0,55, ho*ne_sta^ pri_m(u)m e*st ve_lle^ ne_c la*bi_ vi^a*,1
['141'],['#nutrix'],"pudor est secundus nosse peccandi modum,",1.0,56, pu^do^r e_st se^cu_ndu*s no_sse^ pe_cca*ndi_ mo^du*m,0
['142'],['#nutrix'],"quo, misera, pergis? quid domum infamem aggravas",0.8809523809523809,57, qvo* mi^se^ra^ pe_rgi*s qvi_d do^m(u)m i_nfa*m(e)m a_ggra^va*s,2
['143'],['#nutrix'],superasque matrem? maius est monstro nefas:,0.8421052631578947,58, su^pe^ra_sqve^ ma_tre*m ma_ju^s e_st mo*nstro_ ne^fa*s,0
['144'],['#nutrix'],"nam monstra fato, moribus scelera imputes,",1.0,59, na*m mo_nstra^ fa_to* mo_ri^bu_s sce^le^r(a) i_mpu^te*s,1
['145'],['#nutrix'],"si, quod maritus supera non cernit loca,",0.9142857142857143,60, si* qvo_d ma^ri_tu*s su^pe^ra^ no_n ce*rni_t lo^ca*,0
['146'],['#nutrix'],"tutum esse facinus credis et vacuum metu,",1.0,61, tu*t(u)m e_sse^ fa^ci^nu*s cre_di^s e_t va^cu^u_m me^tu*,1
['147'],['#nutrix'],erras; teneri crede Lethaeo abditum,1.0,62, e*rra_s te^ne_ri* cre_de^ le_th[ae](o) a_bdi^tu*m,1
['148'],['#nutrix'],Thesea profundo et ferre perpetuam Styga:,1.0,63, the*se^a^ pro^fu_nd(o) e*t fe_rre^ pe_rpe^tu^a_m sty^ga*,1
['149'],['#nutrix'],"quid ille, lato maria qui regno premit",0.8529411764705882,64, qvi*d i_lle^ la_to* ma^ri^a^ qvi_ re*gno_ pre^mi*t,0
['150'],['#nutrix'],"populisque reddit iura centeni», pater?",0.7575757575757576,65, po^pu^li_sqve^ re_ddi*t ju_ra^ ce_nte*ni_s pa^te*r,0
['151'],['#nutrix'],latere tantum facinus occultum sinet?,1.0,66, la*te_re^ ta_ntu*m fa^ci^nu^s o_ccu*ltu_m si^ne*t,0
['152'],['#nutrix'],sagax parentum est cura. credamus tamen,1.0,67, sa*ga_x pa^re_nt(u)m e*st cu_ra^ cre_da*mu_s ta^me*n,1
['153'],['#nutrix'],astu doloque tegere nos tantum nefas:,0.9090909090909091,68,a*stu_ do^lo_qve* te^ge^re^ no_s ta*ntu_m ne^fa*s,0
['154'],['#nutrix'],quid ille rebus lumen infundens suum,0.9393939393939394,69, qvi*d i_lle^ re_bu*s lu_me^n i_nfu*nde_ns su^u*m,0
['155'],['#nutrix'],matris parens? quid ille qui mundum quatit,0.7631578947368421,70, ma*tri_s pa^re_ns qvi*d i_lle^ qvi_ mu*ndu_m qva^ti*t,0
['156'],['#nutrix'],"vibrans corusca fulmen Aetnaeum manu,",1.0,71, vi*bra_ns co^ru_sca* fu_lme^n [ae]tn[ae]u_m ma^nu*,0
['157'],['#nutrix'],"sator deorum? credis hoc posse effici,",1.0,72, sa*to_r de^o_ru*m cre_di^s ho_c po*ss(e) e_ffi^ci*,1
['158'],['#nutrix'],inter videntes omnia ut lateas avos?,1.0,73,i*nte_r vi^de_nte*s o_mni^(a) u_t la^te^a_s a^vo*s,1
['159'],['#nutrix'],sed ut secundus numinum abscondat favor,1.0,74, se*d u_t se^cu_ndu*s nu_mi^n(u)m a_bsco*nda_t fa^vo*r,1
['160'],['#nutrix'],coitus nefandos utque contingat stupro,0.9142857142857143,75, co^i^tu_s ne^fa_ndo*s u_tqve^ co_nti*nga_t stu^pro*,0
['161'],['#nutrix'],negata magnis sceleribus semper fides:,1.0,76, ne*ga_ta^ ma_gni*s sce^le^ri^bu_s se*mpe_r fi^de*s,0
['162'],['#nutrix'],"quid poena praesens, conscius mentis pavor",0.9473684210526315,77, qvi*d p[oe]na^ pr[ae]se*ns co_nsci^u_s me*nti_s pa^vo*r,0
['163'],['#nutrix'],animusque culpa plenus et semet timens?,0.9142857142857143,78, a^ni^mu_sqve^ cu_lpa* ple_nu^s e_t se*me_t ti^me*ns,0
['164'],['#nutrix'],"scelus aliqua tutum, nulla securum tulit.",0.9166666666666666,79, sce^lu^s a^li^qva^ tu_tu*m nu_lla^ se_cu*ru_m tu^li*t,0
['165'],['#nutrix'],"compesce amoris impii flammas, precor,",1.0,80, co*mpe_sc(e) a^mo_ri*s i_mpi^i_ fla*mma_s pre^co*r,1
['166'],['#nutrix'],nefasque quod non ulla tellus barbara,0.8235294117647058,81, ne*fa_sqve^ qvo_d no*n u_lla^ te_llu*s ba_rba^ra*,0
['167'],['#nutrix'],"commisit umquam, non vagi campis Getae",0.9117647058823529,82, co*mmi_si^t u_mqva*m no_n va^gi_ ca*mpi_s ge^t[ae],0
['168'],['#nutrix'],nec inhospitalis Taurus aut sparsus Scythes;,1.0,83, ne^c i^nho_spi^ta_li*s t[au]ru^s [au]t spa*rsu_s scy^the*s,0
['169'],['#nutrix'],expelle facinus mente castifica horridum,1.0,84, e*xpe_lle^ fa^ci^nu*s me_nte^ ca_sti^fi^c(a) ho_rri^du*m,1
['170'],['#nutrix'],memorque matris metue concubitus novos.,0.9428571428571428,85, me*mo_rqve^ ma_tri*s me^tu^e^ co_ncu^bi^tu_s no^vo*s,0
['171'],['#nutrix'],miscere thalamos patris et gnati apparas,1.0,86, mi*sce_re^ tha^la^mo*s pa_tri^s e_t gna*t(i) a_ppa^ra*s,1
['172'],['#nutrix'],uteroque prolem capere confusam impio?,0.9117647058823529,87, u^te^ro_qve^ pro_le*m ca^pe^re^ co_nfu*s(a)m i_mpi^o*,1
['173'],['#nutrix'],perge et nefandis verte naturam ignibus—,1.0,88, pe*rg(e) e_t ne^fa_ndi*s ve_rte^ na_tu*r(a)m i_gni^bu*s,2
['174'],['#nutrix'],cur monstra cessant? aula cur fratris vacat?,1.0,89, cu*r mo_nstra^ ce_ssa*nt [au]la^ cu_r fra*tri_s va^ca*t,0
['175'],['#nutrix'],"prodigia totiens orbis insueta audiet,",0.9117647058823529,90, pro*di^gi^a^ to^ti^e*ns o_rbi^s i_nsve*t(a) [au]di^e*t,1
['176'],['#nutrix'],"natura totiens legibus cedet suis,",1.0,91, na*tu_ra^ to^ti^e*ns le_gi^bu_s ce*de_t su^i*s,0
"['177', '177b']","['#nutrix', '#phaedra']",quotiens amabit Cressa? Quae memoras scio,0.8648648648648649,92, qvo^ti^e_ns a^ma_bi*t cre_ssa^ qv[ae] me^mo^ra_s sci^o*,0
['178'],['#phaedra'],"vera esse, nutrix; sed furor cogit sequi",0.9714285714285714,93, ve*r(a) e_sse^ nu_tri*x se_d fu^ro_r co*gi_t se^qvi*,1
['179'],['#phaedra'],"peiora, vadit animus in praeceps sciens",0.9142857142857143,94, pe*jo_ra^ va_di*t a^ni^mu^s i_n pr[ae]ce_ps sci^e*ns,0
['180'],['#phaedra'],remeatque frustra sana consilia appetens.,0.918918918918919,95, re^me^a_tqve^ fru_stra* sa_na^ co_nsi^li^(a) a_ppe^te*ns,1
['181'],['#phaedra'],sic cum gravatam navita adversa ratem,1.0,96, si*c cu_m gra^va_ta*m na_vi^t(a) a_dve*rsa_ ra^te*m,1
['182'],['#phaedra'],"propellit unda, cedit in vanum labor",1.0,97, pro*pe_lli^t u_nda* ce_di^t i_n va*nu_m la^bo*r,0
['183'],['#phaedra'],et victa prono puppis aufertur vado.,0.90625,98, e*t vi_cta^ pro_no* pu_ppi^s a_vfe*rtu_r va^do*,0
['184'],['#phaedra'],quid ratio possit? vicit ac regnat furor,0.9166666666666666,99,qui*d ra^ti^o^ po_ssi*t ui_ci^t a_c re*gna_t fu^ro*r,0
['185'],['#phaedra'],potensque tota mente dominatur deus.,0.90625,100, po*te_nsqve^ to_ta* me_nte^ do^mi^na*tu_r de^u*s,0
['186'],['#phaedra'],hic volucer omni pollet in- terra impotens,1.0,101, hi*c vo^lu^ce^r o_mni* po_lle^t i_n te*rr(a) i_mpo^te*ns,1
['187'],['#phaedra'],ipsumque flammis torret indomitis Iovem;,0.8333333333333334,102, i*psu_mqve^ fla_mmi*s to_rre^t i_ndo^mi^ti_s jo^ve*m,0
['188'],['#phaedra'],"Gradivus istas belliger sensit faces,",1.0,103, gra*di_vu^s i_sta*s be_lli^ge_r se*nsi_t fa^ce*s,0
['189'],['#phaedra'],"opifex trisulci fulminis sensit deus,",1.0,104, o^pi^fe_x tri^su_lci* fu_lmi^ni_s se*nsi_t de^u*s,0
['190'],['#phaedra'],et qui furentis semper Aetnaeis iugis,1.0,105,e*t qui_ fu^re_nti*s se_mpe^r [ae]tn[ae]i_s iu^gi*s,0
['191'],['#phaedra'],versat caminos igne tam parvo calet;,1.0,106, ve*rsa_t ca^mi_no*s i_gne^ ta_m pa*rvo_ ca^le*t,0
['192'],['#phaedra'],"ipsumque Phoebum, tela qui nervo regit,",0.8235294117647058,107, i*psu_mqve^ ph[oe]bu*m te_la^ qvi_ ne*rvo_ re^gi*t,0
['193'],['#phaedra'],figit sagitta certior missa puer,1.0,108, fi*gi_t sa^gi_tta* ce_rti^o_r mi*ssa_ pu^e*r,0
['194'],['#phaedra'],volitatque caelo pariter et terris gravis.,0.9210526315789473,109, vo^li^ta_tqve^ c[ae]lo* pa^ri^te^r e_t te*rri_s gra^vi*s,0
['195'],['#nutrix'],Deum esse amorem turpis et vitio favens,1.0,110, de*(u)m e_ss(e) a^mo_re*m tu_rpi^s e_t vi^ti^o_ fa^ve*ns,2
['196'],['#nutrix'],"finxit libido, quoque liberior foret",0.8125,111,fi*nxi_t li^bi_do* qvo_qve^ li_be^ri^o_r fo^re*t,0
['197'],['#nutrix'],titulum furori numinis falsi addidit.,1.0,112, ti^tu^lu_m fu^ro_ri* nu_mi^ni_s fa*ls(i) a_ddi^di*t,1
['198'],['#nutrix'],natum per omnis scilicet terras vagum,1.0,113, na*tu_m pe^r o_mni*s sci_li^ce_t te*rra_s va^gu*m,0
['199'],['#nutrix'],"Erycina mittit, ille per caelum volans",1.0,114, e^ry^ci_na^ mi_tti*t i_lle^ pe_r c[ae]lu_m vo^la*ns,0
['200'],['#nutrix'],proterva tenera tela molitur manu,1.0,115, pro*te_rva^ te^ne^ra* te_la^ mo_li*tu_r ma^nu*,0
['201'],['#nutrix'],regnumque tantum minimus e superis habet:,0.918918918918919,116, re*gnu_mqve^ ta_ntu*m mi^ni^mu^s e_ su^pe^ri_s ha^be*t,0
['202'],['#nutrix'],vana ista demens animus ascivit sibi,1.0,117, va*n(a) i_sta^ de_me*ns a^ni^mu^s a_sci*vi_t si^bi*,1
['203'],['#nutrix'],Venerisque numen finxit atque arcus dei.,0.8333333333333334,118, ve^ne^ri_sqve^ nu_me*n fi_nxi^t a_tqv(e) a*rcu_s de^i*,1
['204'],['#nutrix'],quisquis secundis rebus exultat nimis,0.8529411764705882,119, qvi*sqvi_s se^cu_ndi*s re_bu^s e_xu*lta_t ni^mi*s,0
['205'],['#nutrix'],"fluitque luxu, semper insolita appetit.",0.9117647058823529,120, flu*i_tqve^ lu_xu* se_mpe^r i_nso^li^t(a) a_ppe^ti*t,1
['206'],['#nutrix'],tunc illa magnae dira fortunae comes,1.0,121, tu*nc i_lla^ ma_gn[ae] di_ra^ fo_rtu*n[ae] co^me*s,0
['207'],['#nutrix'],"subit libido: non placent suetae dapes,",1.0,122,su*bi_t li^bi_do* no_n pla^ce_nt sue*t[ae] da^pe*s,0
['208'],['#nutrix'],non tecta sani moris aut vilis scyphus.,0.9142857142857143,123, no*n te_xta^ sa_ni* mo_ri^s [au]t vi*li_s scy^phu*s,0
['209'],['#nutrix'],cur in penates rarius tenues subit,1.0,124, cu*r i_n pe^na_te*s ra_ri^u_s te^nu^e_s su^bi*t,0
['210'],['#nutrix'],haec delicatae eligens pestis domos?,0.90625,125, h[ae]c de_li^ca_ta*s e_li^ge_ns pe*sti_s do^mo*s,0
['211'],['#nutrix'],cur sancta parvis habitat in tectis Venus,1.0,126, cu*r sa_ncta^ pa_rvi*s ha^bi^ta^t i_n te*cti_s ve^nu*s,0
['212'],['#nutrix'],mediumque sanos vulgus affectus tenet,0.9117647058823529,127, me^di^u_mqve^ sa_no*s vu_lgu^s a_ffe*ctu_s te^ne*t,0
['213'],['#nutrix'],et se coercent modica? contra divites,1.0,128, e*t se_ co^e_rce*nt mo^di^ca^ co_ntra* di_vi^te*s,0
['214'],['#nutrix'],regnoque fulti plura quam fas est petunt?,0.8378378378378378,129, re*gno_qve^ fu_lti* plu_ra^ qva_m fa*s e_st pe^tu*nt,0
['215'],['#nutrix'],quod non potest vult posse qui nimium potest.,0.8780487804878049,130, qvo*d no_n po^te_st vu*lt po_sse^ qvi_ ni^mi^u_m po^te*st,0
['216'],['#nutrix'],quid deceat alto praeditam solio vides:,0.9142857142857143,131, qvi*d de^ce^a^t a_lto* pr[ae]di^ta_m so^li^o_ vi^de*,0
['217'],['#nutrix'],metue ac verere sceptra remeantis viri.,1.0,132, me^tu^(e) a_c ve^re_re* sce_ptra^ re^me^a*nti_s vi^ri*,1
['218'],['#phaedra'],Amoris in me maximum regnum puto,0.9655172413793104,133, a*mo_ri^s i_n me* ma_xi^mu_m re*gnu_m re^o*r,0
['219'],['#phaedra'],reditusque nullos metuo: non umquam amplius,1.0,134,re^di^tu_sque^ nu_llo*s me^tu^o^ no_n u*mqu(a)m a_mpli^u*s,1
['220'],['#phaedra'],convexa tetigit supera qui mersus semel,0.9166666666666666,135, co*nve_xa^ te^ti^gi*t su^pe^ra^ qvi_ me*rsu_s se^me*l,0
['221'],['#phaedra'],adiit silentem nocte perpetua domum.,1.0,136,a^di^i_t si^le_nte*m no_cte^ pe_rpe^tu^a_ do^mu*m,0
['222'],['#nutrix'],Ne crede Diti. clauserit regnum licet,1.0,137, ne* cre_de^ di_ti* cl[au]se^ri_t re*gnu_m li^ce*t,0
['223'],['#nutrix'],canisque diras Stygius observet fores:,0.9117647058823529,138, ca*ni_sqve^ di_ra*s sty^gi^u^s o_bse*rve_t fo^re*s,0
['224'],['#nutrix'],solus negatas invenit Theseus vias.,0.8064516129032258,139,so*lu_s ne^ga_ta*s i_nue^ni_t the*s[eu]s ui^a*s,0
['225'],['#phaedra'],Veniam ille amori forsitan nostro dabit.,1.0,140, ve^ni^(a)m i_ll(e) a^mo_ri* fo_rsi^ta_n no*stro_ da^bi*t,2
['226'],['#nutrix'],Immitis etiam coniugi castae fuit:,0.9,141, i*mmi_ti^s e^ti^a*m co_nju^gi_ ca*st[ae] fu^i*t,0
['227'],['#nutrix'],experta saevam est barbara Antiope manum.,1.0,142,e*xpe_rta^ s[ae]v(a)m e*st ba_rba^r(a) a_nti^o^pe_ ma^nu*m,2
['228'],['#nutrix'],sed posse flecti coniugem iratum puta:,0.9117647058823529,143, se*d po_sse^ fle_cti* co_nju^g(e)m i_ra*tu_m pu^ta*,1
['229'],['#nutrix'],quis huius animum flectet intractabilem?,0.8611111111111112,144, qvi*s hu_ju^s a^ni^mu*m fle_cte^t i_ntra*cta_bi^le*m,0
['230'],['#nutrix'],"exosus omne feminae nomen fugit,",1.0,145, e*xo_su^s o_mne* fe_mi^n[ae] no*me_n fu^gi*t,0
['231'],['#nutrix'],"immitis annos caelibi vitae dicat,",1.0,146, i*mmi_ti^s a_nno*s c[ae]li^bi_ vi*t[ae] di^ca*t,0
['232'],['#nutrix'],conubia vitat: genus Amazonium scias.,0.90625,147,co*nu_bia^ ui_ta*t ge^nu^s a^ma_zo^ni^u_m sci^a*s,0
['233'],['#phaedra'],"Hunc in nivosi collis haerentem iugis,",0.9117647058823529,148, hu*nc i_n ni^vo_si* co_lli^s h[ae]re*nte_m ju^gi*s,0
['234'],['#phaedra'],et aspera agili saxa calcantem pede,1.0,149, e*t a_spe^r(a) a^gi^li* sa_xa^ ca_lca*nte_m pe^de*,1
['235'],['#phaedra'],"sequi per alta nemora, per montes placet.",0.9166666666666666,150, se*qvi_ pe^r a_lta* ne^mo^ra^ pe_r mo*nte_s pla^ce*t,0
['236'],['#nutrix'],Resistet ille seque mulcendum dabit,1.0,151,re*si_ste^t i_lle* se_que^ mu_lce*ndu_m da^bi*t,0
['237'],['#nutrix'],castosque ritus Venere non casta exuet?,0.9142857142857143,152, ca*sto_sqve^ ri_tu*s ve^ne^re^ no_n ca*st(a) e_xu^e*t,1
['238'],['#nutrix'],"tibi ponet odium, cuius odio forsitan",0.9090909090909091,153, ti^bi^ po_ne^t o^di^u*m cu_ju^s o^di^o* fo_rsi^ta*n,0
['239'],['#nutrix'],persequitur omnes? precibus haud vinci potest.,0.926829268292683,154, pe*rse^qvi^tu^r o_mne*s pre^ci^bu^s h[au]d vi*nci_ po^te*st,0
['240'],['#phaedra'],Ferus est? amore didicimus vinci feros.,1.0,155, fe^ru^s e_st a^mo_re* di^di^ci^mu_s vi*nci_ fe^ro*s,0
"['241', '241b']","['#nutrix', '#phaedra']","Fugiet. Per ipsa maria si fugiet, sequar.",0.9428571428571428,156, fu^gi^e_t pe^r i_psa* ma^ri^a^ si_ fu^gi^a_t se^qva*r,0
