cts_ln,speaker,perseus,comp,anceps_n,anceps,elision
"['242', '242b']","['#nutrix', '#phaedra']",Patris memento. Meminimus matris simul.,1.0,157, pa*tri_s me^me_nto* me^mi^ni^mu_s ma*tri_s si^mu*l,0
"['243', '243b']","['#nutrix', '#phaedra']",Genus omne profugit. Paelicis careo metu.,1.0,158,ge^nu^s o_mne^ pro^fu^gi*t p[ae]li^ci_s ca^re^o_ me^tu*,0
"['244', '244b']","['#nutrix', '#phaedra']",Aderit maritus— Nempe Perithoi comes?,0.9375,159, a^de^ri_t ma^ri_tu*s ne_mpe^ pi_ri^tho^i_ co^me*s,0
"['245', '245b']","['#nutrix', '#phaedra']","Aderitque genitor, Mitis, Ariadnae pater.",0.9142857142857143,160, a^de^ri_tqve^ ge^ni^to*r mi_ti^s a^ri^a*dn[ae] pa^te*r,0
['246'],['#nutrix'],Per has senectae splendidas supplex comas,1.0,161, pe*r ha_s se^ne_ct[ae] sple_ndi^da_s su*pple_x co^ma*s,0
['247'],['#nutrix'],fessumque curis pectus et cara ubera,0.9090909090909091,162, fe*ssu_mqve^ cu_ri*s pe_ctu^s e_t ca*r(a) u_be^ra*,1
['248'],['#nutrix'],"precor, furorem siste teque ipsa adiuva:",0.8285714285714286,163, pre*co_r fu^ro_re*m si_ste^ te_qv(e) i*ps(a) a_dju^va*,2
['249'],['#nutrix'],pars sanitatis velle sanari fuit.,1.0,164, pa*rs sa_ni^ta_ti*s ve_lle^ sa_na*ri_ fu^i*t,0
['250'],['#phaedra'],Non omnis animo cessit ingenuo pudor.,1.0,165,no*n o_mni^s a^ni^mo* ce_ssi^t i_nge^nu^o_ pu^do*r,0
['251'],['#phaedra'],"paremus, altrix. qui regi non vult amor",0.9117647058823529,166, pa*re_mu^s a_ltri*x qvi_ re^gi_ no*n vu_lt a^mo*r,0
['252'],['#phaedra'],"vincatur. haud te, fama, maculari sinam.",1.0,167, vi*nca_tu^r h[au]d te* fa_ma^ ma^cu^la*ri_ si^na*m,0
['253'],['#phaedra'],"haec sola ratio est, unicum effugium mali:",1.0,168, h[ae]c so_la^ ra^ti^(o) e*st u_ni^c(u)m e_ffu^gi^u_m ma^li*,2
['254'],['#phaedra'],"virum sequamur, morte praevertam nefas.",0.9117647058823529,169, vi*ru_m se^qva_mu*r mo_rte^ pr[ae]ve*rta_m ne^fa*s,0
['255'],['#nutrix'],"Moderare, alumna, mentis effrenae impetus,",1.0,170, mo^de^ra_r(e) a^lu_mna* me_nti^s e_ffre*n(ae) i_mpe^tu*s,2
['256'],['#nutrix'],"animos coerce, dignam ob hoc vita reor",1.0,171, a^ni^mo_s co^e_rce* di_gn(a)m o^b ho_c vi*ta_ re^o*r,1
['257'],['#nutrix'],quod esse temet autumas dignam nece.,0.9375,172, qvo*d e_sse^ te_me*t [au]tu^ma_s di*gna_m ne^ce*,0
['258'],['#phaedra'],Decreta mors est: quaeritur fati genus.,0.9117647058823529,173, de*cre_ta^ mo_rs e*st qv[ae]ri^tu_r fa*ti_ ge^nu*s,0
['259'],['#phaedra'],laqueone vitam finiam an ferro incubem?,0.9142857142857143,174,la^qve^o_ne^ vi_ta*m fi_ni^(a)m a_n fe*rr(o) i_ncu^be*m,2
['260'],['#phaedra'],an missa praeceps arce Palladia cadam?,1.0,175,a*n mi_ssa^ pr[ae]ce*ps a_rce^ pa_lla^di^a_ ca^da*m,0
['262'],['#nutrix'],Sic te senectus nostra praecipiti sinat,1.0,176, si*c te_ se^ne_ctu*s no_stra^ pr[ae]ci^pi^ti_ si^na*t,0
['263'],['#nutrix'],perire leto? siste furibundum impetum.,1.0,177, pe*ri_re^ le_to* si_ste^ fu^ri^bu*nd(u)m i_mpe^tu*m,1
['264'],['#nutrix'],haud quisquam ad vitam facile revocari potest,0.8571428571428571,178,h[au]d qui_squ(a)m a^d ui_ta*m fa^ci^le^ re^uo^ca*ri_ po^te*st,1
['265'],['#phaedra'],Prohibere nulla ratio periturum potest:,1.0,179,pro^hi^be_re^ nu_lla* ra^ti^o^ pe^ri^tu*ru_m po^te*st,0
['266'],['#phaedra'],ubi qui mori constituit et debet mori.,0.9117647058823529,180, u^bi^ qvi_ mo^ri_ co*nsti^tu^i^t e_t de*be_t mo^ri*,0
['261'],['#phaedra'],proin castitatis vindicem armemus manum.,0.9166666666666666,181,pr[oi]n ca_sti^ta_ti*s ui_ndi^c(e)m a_rme*mu_s ma^nu*m,1
['267'],['#nutrix'],"Solamen annis unicum fessis, era,",1.0,182, so*la_me^n a_nni*s u_ni^cu_m fe*ssi_s e^ra*,0
['268'],['#nutrix'],"si tam protervus incubat menti furor,",1.0,183, si* ta_m pro^te_rvu*s i_ncu^ba_t me*nti_ fu^ro*r,0
['269'],['#nutrix'],"contemne famam— fama vix vero favet,",1.0,184, co*nte_mne^ fa_ma*m fa_ma^ vi_x ve*ro_ fa^ve*t,0
['270'],['#nutrix'],peius merenti melior et peior bono.,0.8387096774193549,185, pe*ju_s me^re_nti* me^li^o^r e_t pe*jo_r bo^no*,0
['271'],['#nutrix'],temptemus animum tristem et intractabilem.,1.0,186, te*mpte_mu^s a^ni^mu*m tri_st(e)m e^t i_ntra*cta_bi^le*m,1
['272'],['#nutrix'],meus iste labor est aggredi iuvenem ferum,0.9210526315789473,187,me^u^s i_ste^ la^bo^r e*st a_ggre^di_ ju^ve^ne_m fe^ru*m,0
['273'],['#nutrix'],mentemque saevam flectere immitis viri.,0.9142857142857143,188, me*nte_mqve^ s[ae]va*m fle_cte^r(e) i_mmi*ti_s vi^ri*,1
['274'],['#chorus'],"Diva non miti generata ponto,",0.0,,,0
['275'],['#chorus'],"quam vocat matrem geminus Cupido,",0.0,,,0
['276'],['#chorus'],impotens flammis simul et sagittis,0.0,,,0
['277'],['#chorus'],iste lascivus puer et renidens,0.0,,,0
['278'],['#chorus'],tela quam certo moderatur arcu!,0.0,,,0
['279'],['#chorus'],labitur totas furor in medullas,0.0,,,0
['280'],['#chorus'],igne furtivo populante venas.,0.0,,,0
['281'],['#chorus'],"non habet latam data plaga frontem,",0.0,,,0
['282'],['#chorus'],"sed vorat tectas penitus medullas,",0.0,,,0
['283'],['#chorus'],nulla pax isti puero: per orbem,0.0,,,0
['284'],['#chorus'],spargit effusas agilis sagittas;,0.0,,,0
['285'],['#chorus'],"quaeque nascentem videt ora solem,",0.0,,,0
['286'],['#chorus'],"quaeque ad Hesperiae iacet ora metas,",0.0,,,0
['287'],['#chorus'],"si qua ferventi subiecta cancro,",0.0,,,0
['288'],['#chorus'],si qua Parrbasiae glacialis ursae,0.0,,,0
['289'],['#chorus'],"semper errantes patitur colonos,",0.0,,,0
['290'],['#chorus'],"novit hos aestus, iuvenum feroces",0.0,,,0
['291'],['#chorus'],concitat flammas senibusque fessis,0.0,,,0
['292'],['#chorus'],"rursus extinctos revocat calores,",0.0,,,0
['293'],['#chorus'],virginum ignoto ferit igne pectus,0.0,,,0
['294'],['#chorus'],et iubet caelo superos relicto,0.0,,,0
['295'],['#chorus'],vultibus falsis habitare terras.,0.0,,,0
['296'],['#chorus'],Thessali Phoebus pecoris magister,0.0,,,0
['297'],['#chorus'],egit armentum positoque plectro,0.0,,,0
['298'],['#chorus'],"impari tauros calamo vocavit,",0.0,,,0
['299'],['#chorus'],induit formas quotiens minores,0.0,,,0
['300'],['#chorus'],ipse qui caelum nebulasque ducit:,0.0,,,0
['301'],['#chorus'],"Candidas ales modo movit alas,",0.0,,,0
['302'],['#chorus'],dulcior vocem moriente cygno ;,0.0,,,0
['303'],['#chorus'],fronte nunc torva petulans iuvencus,0.0,,,0
['304'],['#chorus'],"virginum stravit sua terga ludo,",0.0,,,0
['305'],['#chorus'],perque fraternos nova regna fluctus,0.0,,,0
['306'],['#chorus'],ungula lentos imitante remos,0.0,,,0
['307'],['#chorus'],"* pectore adverso domuit profundum,",0.0,,,0
['308'],['#chorus'],"pro sua vector timidus rapina,",0.0,,,0
['309'],['#chorus'],arsit obscuri dea clara mundi,0.0,,,0
['310'],['#chorus'],nocte deserta nitidosque fratri,0.0,,,0
['311'],['#chorus'],tradidit currus aliter regendos:,0.0,,,0
['312'],['#chorus'],ille nocturnas agitare bigas,0.0,,,0
['313'],['#chorus'],"discit et gyro breviore flecti,",0.0,,,0
['316'],['#chorus'],dum tremunt axes graviore curru;,0.0,,,0
['314'],['#chorus'],nec suum tempus tenuere nectes,0.0,,,0
['315'],['#chorus'],et dies tardo remeavit ortu.,0.0,,,0
['317'],['#chorus'],natus Alcmena posuit pharetras,0.0,,,0
['318'],['#chorus'],"et minax vasti spolium leonis,",0.0,,,0
['319'],['#chorus'],passus aptari digitis zmaragdos,0.0,,,0
['320'],['#chorus'],et^dari legem rudibus capillis;,0.0,,,0
['321'],['#chorus'],crura distincto religavit auro.,0.0,,,0
['322'],['#chorus'],luteo plantas cohibente socco;,0.0,,,0
['323'],['#chorus'],"et manu, clavam modo qua gerebat,",0.0,,,0
['324'],['#chorus'],fila deduxit properante fuso:,0.0,,,0
['325'],['#chorus'],Vidit Persis ditique ferox,0.0,,,0
['326'],['#chorus'],Lydia regno,0.0,,,0
['327'],['#chorus'],deiecta feri terga leonis,0.0,,,0
['328'],['#chorus'],"umerisque, quibus sederat alti",0.0,,,0
['329'],['#chorus'],"regia caeli,",0.0,,,0
"['330', '330b']","['#chorus', '#chorus']",tenuem Tyrio stamine pallam. sacer est ignis (credite laesis),0.0,,,0
['331'],['#chorus'],"nimiumque potens, qua terra salo",0.0,,,0
['332'],['#chorus'],cingitur alto quaque per ipsum,0.0,,,0
['333'],['#chorus'],candida mundum sidera currunt:,0.0,,,0
['334'],['#chorus'],"haec regna tenet puer immitis,",0.0,,,0
['335'],['#chorus'],spicula cuius sentit in imis,0.0,,,0
['336'],['#chorus'],pervius undis rex Nereidum,0.0,,,0
['337'],['#chorus'],flammamque nequit relevare mari.,0.0,,,0
['338'],['#chorus'],ignes sentit genus aligerum;,0.0,,,0
['339'],['#chorus'],Venere instinctus suscipit audax,0.0,,,0
['340'],['#chorus'],grege pro toto bella iuvencus;,0.0,,,0
['341'],['#chorus'],"si coniugio timuere suo,",0.0,,,0
['342'],['#chorus'],poscunt timidi proelia cervi.,0.0,,,0
['348'],['#chorus'],Poeni quatiunt colla leones,0.0,,,0
['349'],['#chorus'],cum movit Amor.,0.0,,,0
"['343', '343b']","['#chorus', '#chorus']",et mugitu dant concepti signa furoris.,0.0,,,0
['344'],['#chorus'],tunc virgatas India tigres,0.0,,,0
['345'],['#chorus'],decolor horret;,0.0,,,0
['346'],['#chorus'],tunc vulnificos acuit dentes,0.0,,,0
['347'],['#chorus'],aper et toto est spumeus ore;,0.0,,,0
['350'],['#chorus'],tum silva gemit murmure saevo.,0.0,,,0
['351'],['#chorus'],amat insani belua ponti,0.0,,,0
['352'],['#chorus'],Lucaeque boves: vindicat omnes,0.0,,,0
['353'],['#chorus'],"natura, sibi nihil immune est,",0.0,,,0
['354'],['#chorus'],"odiumque perit, cum iussit Amor:",0.0,,,0
['355'],['#chorus'],veteres cedunt ignibus irae.,0.0,,,0
['356'],['#chorus'],quid plura canam?,0.0,,,0
['357'],['#chorus'],vincit saevas cura novercas.,0.0,,,0
['358'],['#chorus'],"altrix, profare quid feras; quonam in loco est",0.8536585365853658,189, a*ltri_x pro^fa_re* qvi_d fe^ra_s qvo*n(a)m i_n lo^c(o) e*st,2
['359'],['#chorus'],regina? saevis ecquis- est flammis modus?.,0.9142857142857143,190, re*gi_na^ s[ae]vi*s e_cqvi^s e_st fla*mmi_s mo^du*s,0
['360'],['#nutrix phaedra chorus'],"Spes nulla tantum posse leniri malum,",1.0,191, spe*s nu_lla^ ta_ntu*m po_sse^ le_ni*ri_ ma^lu*m,0
['361'],['#nutrix phaedra chorus'],finisque flammis nullus insanis erit.,0.9090909090909091,192, fi*ni_sqve^ fla_mmi*s nu_llu^s i_nsa*ni_s e^ri*t,0
['362'],['#nutrix phaedra chorus'],"torretur aestu tacito et inclusus quoque,",0.8918918918918919,193, to*rre_tu^r [ae]stu* ta^ci^t(o) e^t i_nclu*su_s qvo^qve*,1
['363'],['#nutrix phaedra chorus'],"quamvis tegatur, proditur vultu furor;",0.9393939393939394,194, qva*mvi_s te^ga_tu*r pro_di^tu_r vu*ltu_ fu^ro*r,0
['364'],['#nutrix phaedra chorus'],erumpit oculis ignis et lassae genae,1.0,195, e*ru_mpi^t o^cu^li*s i_gni^s e_t la*ss[ae] ge^n[ae],0
['365'],['#nutrix phaedra chorus'],"lucem recusant, nil idem dubiae placet",1.0,196, lu*ce_m re^cu_sa*nt ni_l i^de_m du^bi^[ae] pla^ce*t,0
['366'],['#nutrix phaedra chorus'],"artusque varie iactat incertus dolor,",0.8181818181818182,197, a*rtu_sqve^ va^ri^e* ja_cta^t i_nce*rtu_s do^lo*r,0
['367'],['#nutrix phaedra chorus'],nunc ut soluto labitur moriens gradu,0.8484848484848485,198, nu*nc u_t so^lu_to* la_bi^tu_r ma*rce_ns gra^du*,0
['368'],['#nutrix phaedra chorus'],"et vix labante sustinet collo caput,",1.0,199, e*t vi_x la^ba_nte* su_sti^ne_t co*llo_ ca^pu*t,0
['369'],['#nutrix phaedra chorus'],"nunc se quieti reddit et. somni immemor,",0.9142857142857143,200, nu*nc se_ qvi^e_ti* re_ddi^t e_t so*mn(i) i_mme^mo*r,1
['370'],['#nutrix phaedra chorus'],noctem querelis ducit; attolli iubet,0.8125,201, no*cte_m qve^re_li*s du_ci^t a_tto*lli_ ju^be*t,0
['371'],['#nutrix phaedra chorus'],iterumque poni corpus et solvi comas,0.9090909090909091,202, i^te^ru_mqve^ po_ni* co_rpu^s e_t so*lvi_ co^ma*s,0
['372'],['#nutrix phaedra chorus'],rursusque fingi: semper impatiens sui,0.9090909090909091,203, ru*rsu_sqve^ fi_ngi* se_mpe^r i_mpa^ti^e_ns su^i*,0
['373'],['#nutrix phaedra chorus'],"mutatur habitus, nulla iam Cereris subit",0.9166666666666666,204, mu*ta_tu^r ha^bi^tu*s nu_lla^ ja_m ce^re^ri_s su^bi*t,0
['374'],['#nutrix phaedra chorus'],"cura aut salutis; vadit' incerto pede,",1.0,205, cu*r(a) [au]t sa^lu_ti*s va_di^t i_nce*rto_ pe^de*,1
['375'],['#nutrix phaedra chorus'],"iam viribus defecta: non idem vigor,",0.967741935483871,206, ja*m vi_ri^bu_s de*fe_cta^ no_n i*de_m vi^go*r,0
['376'],['#nutrix phaedra chorus'],non ora tinguens nitida purpureus rubor;,0.9166666666666666,207, no*n o_ra^ ti_ngve*ns ni^ti^da^ pu_rpu^re^u_s ru^bo*r,0
['377'],['#nutrix phaedra chorus'],"populatur artus cura, iam gressus tremunt",0.918918918918919,208, po^pu^la_tu^r a_rtu*s cu_ra^ ja_m gre*ssu_s tre^mu*nt,0
['378'],['#nutrix phaedra chorus'],tenerque nitidi corporis cecidit decor.,0.9142857142857143,209, te*ne_rqve^ ni^ti^di* co_rpo^ri_s ce^ci^di_t de^co*r,0
['379'],['#nutrix phaedra chorus'],et qui ferebant signa Phoebeae facis,0.9090909090909091,210, e*t qvi_ fe^re_ba*nt si_gna^ ph[oe]be*[ae] fa^ci*s,0
['380'],['#nutrix phaedra chorus'],oculi nihil gentile nec patrium micant.,1.0,211, o^cu^li_ ni^hi_l ge*nti_le^ ne_c pa^tri^u_m mi^ca*nt,0
['381'],['#nutrix phaedra chorus'],lacrimae cadunt per ora et assiduo genae,1.0,212, la^cri^m[ae] ca^du_nt pe*r o_r(a) e^t a_ssi^du^o_ ge^n[ae],1
['382'],['#nutrix phaedra chorus'],"rore irrigantur, qualiter Tauri iugis",0.8181818181818182,213, ro*r(e) i_rri^ga_ntu*r qva_li^te_r t[au]ri_ ju^gi*s,1
['383'],['#nutrix phaedra chorus'],tepido madescunt imbre percussae nives.,1.0,214, te^pi^do_ ma^de_scu*nt i_mbre^ pe_rcu*ss[ae] ni^ve*s,0
['404'],['#chorus'],Sepone questus: non levat miseros dolor;,0.0,,,0
['405'],['#chorus'],agreste placa virginis numen deae.,0.0,,,0
['384'],['#chorus'],"Sed en, patescunt regiae fastigia.",1.0,215, se*d e_n pa^te_scu*nt re_gi^[ae] fa*sti_gi^a*,0
['385'],['#chorus'],reclinis ipsa sedis auratae toro,1.0,216, re*cli_ni^s i_psa* se_di^s [au]ra*t[ae] to^ro*,0
['386'],['#chorus'],solitos amictus mente non sana abnuit.,1.0,217,so^li^to_s a^mi_ctu*s me_nte^ no_n sa*n(a) a_bnu^i*t,1
['387'],['#phaedra'],"Removete, famulae, purpura atque auro inlitas",0.925,218, re^mo^ve_te^ fa^mu^l[ae] pu_rpu^r(a) a_tqv(e) [au]r(o) i_nli^ta*s,3
['388'],['#phaedra'],"vestes, procul sit muricis Tyrii rubor,",1.0,219, ve*ste_s pro^cu_l si*t mu_ri^ci_s ty^ri^i_ ru^bo*r,0
['389'],['#phaedra'],quae fila ramis ultimi Seres legunt:,0.9375,220, qv[ae] fi_la^ ra_mi*s u_lti^mi_ se*re_s le^gu*nt,0
['390'],['#phaedra'],"brevis expeditos zona constringat sinus,",1.0,221, bre^vi^s e_xpe^di_to*s zo_na^ co_nstri*nga_t si^nu*s,0
['391'],['#phaedra'],"cervix monili vacua, nec niveus lapis",1.0,222, ce*rvi_x mo^ni_li* va^cu^a^ ne_c ni^ve^u_s la^pi*s,0
['392'],['#phaedra'],"deducat auris, Indici donum maris;",1.0,223,de*du_ca^t [au]ri*s i_ndi^ci_ do*nu_m ma^ri*s,0
['393'],['#phaedra'],"odore crinis sparsus Assyrio vacet,",1.0,224, o*do_re^ cri_ni*s spa_rsu^s a_ssy^ri^o_ va^ce*t,0
['394'],['#phaedra'],sic temere iactae. colla perfundant comae,0.918918918918919,225, si*c te^me^re^ ja_ct[ae] co_lla^ pe_rfu*nda_nt co^m[ae],0
['395'],['#phaedra'],"umerosque summos, cursibus motae citis",0.9117647058823529,226, u^me^ro_sqve^ su_mmo*s cu_rsi^bu_s mo*t[ae] ci^ti*s,0
['396'],['#phaedra'],"ventos sequantur, laeva se pharetrae dabit,",0.9210526315789473,227, ve*nto_s se^qva_ntu*r l[ae]va^ se_ pha^re^tr[ae] da^bi*t,0
['397'],['#phaedra'],hastile vibret dextra Thessalicum manus.,0.9166666666666666,228,ha*sti_le^ ui_bre*t de_xtra^ the_ssa^li^cu_m ma^nu*s,0
['398'],['#phaedra'],talis severi mater Hippolyti fuit.,1.0,229,ta*li_s se^ve_ri* ma_te^r hi_ppo^ly^ti_ fu^i*t,0
['399'],['#phaedra'],qualis relictis frigidi Ponti plagis,0.9393939393939394,230, qva*li_s re^li_cti*s fri_gi^di_ po*nti_ pla^gi*s,0
['400'],['#phaedra'],egit catervas Atticum pulsans solum,1.0,231, e*gi_t ca^te_rva*s a_tti^cu_m pu*lsa_ns so^lu*m,0
['401'],['#phaedra'],Tanaitis aut Maeotis et nodo comas,1.0,232,ta^na^i_ti^s [au]t m[ae]o_ti^s e_t no*do_ co^ma*s,0
['402'],['#phaedra'],coegit emisitque. lunata latus,0.8846153846153846,233, co*e_gi^t e_mi*si_tqve^ lu_na*ta_ la^tu*s,0
['403'],['#phaedra'],protecta pelta: talis in silvas ferar.,1.0,234, pro*te_cta^ pe_lta* ta_li^s i_n si*lva_s fe^ra*r,0
['406'],['#nutrix hippolytus'],"Regina nemorum, sola quae montes colis",0.9117647058823529,237, re*gi_na^ ne^mo^ru*m so_la^ qv[ae] mo*nte_s co^li*s,0
['407'],['#nutrix hippolytus'],"et una solis montibus coleris dea,",1.0,238, e*t u_na^ so_li*s mo_nti^bu_s co^le^ri_s de^a*,0
['408'],['#nutrix hippolytus'],"converte tristes ominum in melius minas,",1.0,239, co*nve_rte^ tri_ste*s o_mi^n(u)m i_n me^li^u_s mi^na*s,1
['409'],['#nutrix hippolytus'],o magna silvas inter et lucos dea,1.0,240, o* ma_gna^ si_lva*s i_nte^r e_t lu*co_s de^a*,0
['410'],['#nutrix hippolytus'],"claramque caeli sidus et noctis decus,",0.8235294117647058,241, cla*ru_mqve^ c[ae]li* si_du^s e_t no*cti_s de^cu*s,0
['411'],['#nutrix hippolytus'],"cuius relucet mundus alterna vice,",0.9,242, cu*ju_s re^lu_ce*t mu_ndu^s a_lte*rna_ vi^ce*,0
['412'],['#nutrix hippolytus'],"Hecate triformis, en ades coeptis favens.",1.0,243, he^ca^te_ tri^fo_rmi*s e_n a^de_s c[oe]pti_s fa^ve*ns,0
['413'],['#nutrix hippolytus'],animum rigentem tristis Hippolyti doma:,1.0,244,a^ni^mu_m ri^ge_nte*m tri_sti^s hi_ppo^ly^ti_ do^ma*,0
['414'],['#nutrix hippolytus'],det facilis aures: mitiga pectus ferum:,1.0,245, de*t fa^ci^li^s [au]re*s mi_ti^ga_ pe*ctu_s fe^ru*m,0
['415'],['#nutrix hippolytus'],"amare discat, mutuos ignes ferat.",1.0,246, a*ma_re^ di_sca*t mu_tu^o_s i*gne_s fe^ra*t,0
['416'],['#nutrix hippolytus'],inflecte mentem: torvus aversus ferox,0.8787878787878788,247, i*nne_cte^ me_nte*m to_rvu^s a_ve*rsu_s fe^ro*x,0
['417'],['#nutrix hippolytus'],"in iura Veneris redeat, huc vires tuas",0.9117647058823529,248, i*n ju_ra^ ve^ne^ri*s re^de^a^t hu_c vi*re_s tu^a*s,0
['418'],['#nutrix hippolytus'],intende: sic te lucidi vultus ferant,1.0,249, i*nte_nde^ si_c te* lu_ci^di_ vu*ltu_s fe^ra*nt,0
['419'],['#nutrix hippolytus'],"et nube rapta cornibus puris eas,",0.896551724137931,250, e*t nu_be^ ru_pta* co_rni^bu_s pu*ri_s e^a*s,0
['420'],['#nutrix hippolytus'],sic te regentem frena nocturni aetheris,1.0,251, si*c te_ re^ge_nte*m fre_na^ no_ctu*rn(i) [ae]the^ri*s,1
['421'],['#nutrix hippolytus'],detrahere numquam Thessali cantus queant,0.8378378378378378,252, de*tra^he^re^ nu_mqva*m the_ssa^li_ ca*ntu_s qve^a*nt,0
['422'],['#nutrix hippolytus'],"nullusque de te gloriam pastor ferat,",0.9090909090909091,253, nu*llu_sqve^ de_ te* glo_ri^a_m pa*sto_r fe^ra*t,0
['423'],['#nutrix hippolytus'],"ades invocata, iam fave votis, dea:",0.896551724137931,254, a^de^s i_nvo^ca_ta* ja_m fa^ve_ vo*ti_s de^a*,0
['424'],['#nutrix hippolytus'],ipsum intuor solemne venerantem sacrum,0.9444444444444444,255, i*ps(u)m i_ntu^o_r so*lle_mne^ ve^ne^ra*nte_m sa^cru*m,1
['425'],['#nutrix hippolytus'],nullo latus comitante— quid dubitas? dedit,0.918918918918919,256, nu*llo_ la^tu_s co^mi^ta_nte^ qvi_d du^bi^ta_s de^di*t,0
['426'],['#nutrix hippolytus'],"tempus locumque casus: utendum artibus,",0.9117647058823529,257, te*mpu_s lo^cu_mqve* ca_su^s u_te*nd(u)m a_rti^bu*s,1
['427'],['#nutrix hippolytus'],trepidamus? haud est facile mandatum scelus,1.0,258,tre^pi^da_mu^s h[au]d e*st fa^ci^le^ ma_nda*tu_m sce^lu*s,0
['428'],['#nutrix hippolytus'],"audere, verum iussa qui regis timet,",0.6129032258064516,259, [au]de_re^ ve_ru*m ju_sta^ qvi_ re*ge_s ti^me*t,0
['429'],['#nutrix hippolytus'],deponat omne et pellat ex animo decus:,0.8823529411764706,260, de*po_na^t o_mne* pe_lla^t e_x a^ni^mo_ de^cu*s,0
['430'],['#nutrix hippolytus'],malus est minister regii imperii pudor.,1.0,261, ma^lu^s e_st mi^ni_ste*r re_gi^(i) i_mpe^ri^i_ pu^do*r,1
['431'],['#hippolytus'],"Quid huc seniles fessa moliris gradus,",0.9411764705882353,262, qvi*d hu_c se^ni_le*s fe_ssa^ mo_li*ri_s gra^du*s,0
['432'],['#hippolytus'],"o fida nutrix, turbidam frontem gerens",1.0,263, o* fi_da^ nu_tri*x tu_rbi^da_m fro*nte_m ge^re*ns,0
['433'],['#hippolytus'],et maesta vultu? sospes est certe parens,1.0,264, e*t m[ae]sta^ vu_ltu* so_spe^s e_st ce*rte_ pa^re*ns,0
['434'],['#hippolytus'],sospesque Phaedra stirpis et geminae iugum?,0.8461538461538461,265, so*spe_sqve^ ph[ae]dra* sti_rpi^s e_t ge^mi^n[ae] ju^gu*m,0
['435'],['#nutrix'],"Metus remitte, prospero regnum in statu est",1.0,266, me*tu_s re^mi_tte* pro_spe^ro_ re*gn(u)m i_n sta^t(u) e*st,2
['436'],['#nutrix'],domusque florens sorte felici viget.,0.90625,267, do*mu_sqve^ flo_re*ns so_rte^ fe_li*ci_ vi^ge*t,0
['437'],['#nutrix'],sed tu beatis mitior rebus veni:,1.0,268, se*d tu_ be^a_ti*s mi_ti^o_r re*bu_s ve^ni*,0
['438'],['#nutrix'],"namque anxiam me cura sollicitat tui,",0.9090909090909091,269, na*mqv(e) a_nxi^a_m me* cu_ra^ so_lli^ci^ta_t tu^i*,1
['439'],['#nutrix'],quod te ipse poenis gravibus infestus domas.,0.95,270, qvo*d t(e) i_pse^ p[oe]ni*s gra^vi^bu^s i_nfe*stu_s do^ma*s,1
['440'],['#nutrix'],"quem fata cogunt, ille cum venia est miser;",0.9473684210526315,271, qve*m fa_ta^ co_gu*nt i_lle^ cu_m ve^ni^(a) e_st mi^se*r,1
['441'],['#nutrix'],at si quis ultro se malis offert volens,0.9166666666666666,272, a*t si_ qvi^s u_ltro* se_ ma^li_s o*ffe_rt vo^le*ns,0
['442'],['#nutrix'],"seque ipse torquet, perdere est dignus bona",0.8461538461538461,273, se*qv(e) i_pse^ to_rqve*t pe_rde^r(e) e_st di*gnu_s bo^na*,2
['443'],['#nutrix'],quis nescit uti. potius annorum memor,0.9393939393939394,274, qvi*s ne_sci^t u_ti* po^ti^u^s a_nno*ru_m me^mo*r,0
['444'],['#nutrix'],mentem relaxa: noctibus festis facem,1.0,275, me*nte_m re^la_xa* no_cti^bu_s fe*sti_s fa^ce*m,0
['445'],['#nutrix'],"attolle, curas Bacchus exoneret graves;",1.0,276, a*tto_lle^ cu_ra*s ba_cchu^s e_xo^ne^re_t gra^ve*s,0
['446'],['#nutrix'],"aetate fruere: mobili cursu fugit,",1.0,277, [ae]ta_te^ fru^e^re* mo_bi^li_ cu*rsu_ fu^gi*t,0
['447'],['#nutrix'],"nunc facile pectus, grata nunc iuveni Venus:",0.9230769230769231,278, nu*nc fa^ci^le^ pe_ctu*s gra_ta^ nu_nc ju^ve^ni_ ve^nu*s,0
['448'],['#nutrix'],"exultet animus, cur toro viduo iaces?",0.90625,279, e*xu_lte^t a^ni^mu*s cu_r to^ro_ vi^du^o_ ja^ce*s,0
['449'],['#nutrix'],"tristem iuventam solve; nunc cursus rape,",0.9166666666666666,280, tri*ste_m ju^ve_nta*m so_lve^ nu_nc cu*rsu_s ra^pe*,0
['450'],['#nutrix'],"effunde habenas, optimos vitae dies",1.0,281, e*ffu_nd(e) ha^be_na*s o_pti^mo_s vi*t[ae] di^e*s,1
['451'],['#nutrix'],"effluere prohibe, propria descripsit deus",1.0,282, e*fflu^e^re^ pro^hi^be* pro^pri^a^ de_scri*psi_t de^u*s,0
['452'],['#nutrix'],officia et aevum per suos duxit gradus:,0.9142857142857143,283, o*ffi^ci^(a) e^t [ae]vu*m pe_r su^o_s du*ci_t gra^du*s,1
['453'],['#nutrix'],"laetitia iuvenem, frons decet tristis senem.",0.9230769230769231,284, l[ae]ti^ti^a^ ju^ve^ne*m fro_ns de^ce_t tri*sti_s se^ne*m,0
['454'],['#nutrix'],quid te coherces et necas rectam indolem?,0.8648648648648649,285, qvi*d te_ co^e_rce*s e_t ne^ca_s re*ct(a)m i_ndo^le*m,1
['455'],['#nutrix'],seges illa magnum fenus agricolae dabit,1.0,286, se^ge^s i_lla^ ma_gnu*m fe_nu^s a_gri^co^l[ae] da^bi*t,0
['456'],['#nutrix'],"quaecumque laetis tenera luxuriat satis,",0.8611111111111112,287, qv[ae]cu_mqve^ l[ae]ti*s te^ne^ra^ lu_xu^ri^a_t sa^ti*s,0
['457'],['#nutrix'],arborque celso vertice evincet nemus,0.9090909090909091,288, a*rbo_rqve^ ce_lso* ve_rti^c(e) e_vi*nce_t ne^mu*s,1
['458'],['#nutrix'],"quam non maligna caedit aut resecat"" manus:",0.9473684210526315,289, qva*m no_n ma^li_gna* c[ae]di^t [au]t re^se^ca_t ma^nu*s,0
['459'],['#nutrix'],"ingenia melius recta se in laudes ferunt,",1.0,290, i*nge^ni^a^ me^li^u*s re_cta^ s(e) i_n l[au]de_s fe^ru*nt,1
['460'],['#nutrix'],si nobilem animum vegeta libertas alit.,1.0,291, si* no_bi^l(e)m a^ni^mu*m ve^ge^ta^ li_be*rta_s a^li*t,1
['461'],['#nutrix'],truculentus et silvester ac vitae inscius,0.9210526315789473,292, tru^cu^le_ntu^s e_t si^lu^e_ste^r a_c vi*t(ae) i_nsci^u*s,1
['462'],['#nutrix'],tristem iuventam Venere deserta coles?,0.9117647058823529,293, tri*ste_m ju^ve_nta*m ve^ne^re^ de_se*rta_ co^le*s,0
['463'],['#nutrix'],"hoc esse munus credis indictum viris,",1.0,294, ho*c e_sse^ mu_nu*s cre_di^s i_ndi*ctu_m vi^ri*s,0
['464'],['#nutrix'],"ut dura tolerent, cursibus domitent equos",0.9459459459459459,295, u*t du_ra^ to^le^re*nt cu_rsi^bu_s do^mi^te_nt e^qvo*s,0
['465'],['#nutrix'],et saeva bella Marte sanguineo gerant?,0.9117647058823529,296, e*t s[ae]va^ be_lla* ma_rte^ sa_ngvi^ne^o_ ge^ra*nt,0
['475'],['#nutrix'],quam varia leti genera mortalem trahunt,0.9444444444444444,306, qva*m va^ri^a^ le_ti* ge^ne^ra^ mo_rta*le_m tra^hu*nt,0
['476'],['#nutrix'],"carpuntque turbam, pontus et ferrum et doli!",0.9230769230769231,307, ca*rpu_ntqve^ tu_rba*m po_ntu^s e_t fe*rr(u)m e_t do^li*,1
['466'],['#nutrix'],"providit ille maximus mundi parens,",0.0,,,0
['467'],['#nutrix'],"cum tam rapaces cerneret Pati manus,",0.0,,,0
['468'],['#nutrix'],ut damna semper subole repararet nova.,0.0,,,0
['477'],['#nutrix'],sed fata credas desse: sic atram Styga,1.0,308, se*d fa_ta^ cre_da*s de_sse^ si_c a*tra_m sty^ga*,0
['478'],['#nutrix'],"iam petimus ultro, caelibem vitam probet",0.9722222222222222,309, ja*m pe^ti^mu^s u_ltro* c[ae]li^be_m vi*ta_m pro^be*t,0
['479'],['#nutrix'],"sterilis iuventus: hoc erit, quicquid vides,",0.7368421052631579,310, ste^ri^li_s ju^ve_ntu*s ho_c e^ri_t qvi*dqvi_d vi^de*s,0
['480'],['#nutrix'],unius aevi turba et in semet ruet.,1.0,311, u*ni_u^s [ae]vi* tu_rb(a) e^t i_n se*me_t ru^e*t,1
['469'],['#nutrix'],"excedat agedum rebus humanis Venus,",0.0,,,0
['470'],['#nutrix'],quae supplet ac restituit exhaustum genus:,0.0,,,0
['471'],['#nutrix'],"orbis iacebit squalido turpis situ,",0.0,,,0
['472'],['#nutrix'],"vacuum sine ullis piscibus stabit mare,",0.0,,,0
['473'],['#nutrix'],alesque caelo derit et silvis fera,0.0,,,0
['474'],['#nutrix'],solis et aer pervius ventis erit.,0.0,,,0
['481'],['#nutrix'],proinde vitae sequere naturam ducem:,0.90625,312,pro*i_nde^ ui_t[ae] se^que^re^ na_tu*ra_m du^ce*m,0
['482'],['#nutrix'],"urbem frequenta, civium coetum cole.",0.8709677419354839,313, u*rbe_m fre^qve_nta* ci_vi^u_m c[oe]tu_s co^le*,0
['483'],['#hippolytus'],Non alia magis est libera et vitio carens,1.0,314, no*n a^li^a^ ma^gi^s e*st li_be^r(a) e_t vi^ti^o_ ca^re*ns,1
