comp,perseus_n,perseus_text,pc_n,pc_text,pc_bounds,elision,speaker
0.926829268292683,1,Prima deum magnis canimus freta pervia natis,1,Prima deum magnis canimus freta peruia natis,"['CF', 'CM', 'CM', 'CM', 'DI', 'DI', None]",0,
1.0,2,"fatidicamque ratem, Scythici quae Phasidis oras",2,"Fatidicamque ratem, Scythici quae Phasidis oras","['CF', 'CM', 'CM', 'DI', 'DI', None]",0,
1.0,3,ausa sequi mediosque inter iuga concita cursus,3,Ausa sequi mediosque inter iuga concita cursus,"['CF', 'CM', 'SY', 'CM', 'DI', 'DI', None]",1,
1.0,4,rumpere flammifero tandem consedit Olympo.,4,Rumpere flammifero tandem consedit Olympo.,"['DI', 'CM', 'CM', 'CF', None]",0,
0.8421052631578947,5,"Phoebe, mone, si Cymaeae mihi conscia vatis",5,"Phoebe, mone, si Cumaeae mihi conscia uatis","['CF', 'CM', 'DI', 'CM', 'DI', 'DI', None]",0,
1.0,6,"stat casta cortina domo, si laurea digna",6,"Stat casta cortina domo, si laurea digna","['CM', 'CM', 'CF', 'CM', 'DI', 'DI', None]",0,
0.926829268292683,7,"fronte viret; tuque o, pelagi cui maior aperti",7,Fronte uiret. tuque o pelagi cui maior aperti,"['CF', 'CM', 'SY', 'CM', 'CM', 'DI', 'CF', None]",1,
0.9230769230769231,8,"fama, Caledonius postquam tua carbasa vexit",8,"Fama, Caledonius postquam tua carbasa uexit","['CF', 'CM', 'CM', 'DI', 'DI', None]",0,
1.0,9,"Oceanus Phrygios prius indignatus Iulos,",9,"Oceanus, Phrygios prius indignatus Iulos,","['CM', 'CM', 'DI', 'CF', None]",0,
1.0,10,"eripe me populis et habenti nubila terrae,",10,"Eripe me populis et habenti nubila terrae,","['DI', 'CM', 'CM', 'CF', 'DI', 'DI', None]",0,
0.7906976744186046,11,"sancte pater, veterumque fave veneranda canenti",11,"Sancte pater, ueterumque faue ueneranda canenti","['CF', 'CM', 'CF', 'CM', 'CF', None]",0,
0.775,12,facta virum. versam proles tua pandet Idumen,12,Facta uirum: uersam proles tua pandit Idumen,"['CF', 'CM', 'CM', 'CM', 'DI', 'CF', None]",0,
0.9302325581395349,13,(namque potest ): Solymo nigrantem pulvere fratrem,13,"Namque potest, Solymo nigrantem puluere fratrem","['CF', 'CM', 'CM', 'DI', 'DI', None]",0,
1.0,14,spargentemque faces et in omni turre furentem.,14,Spargentemque faces et in omni turre furentem.,"['CF', 'CM', 'CF', 'DI', 'DI', 'CF', None]",0,
0.8974358974358975,15,ille tibi cultusque deum delubraque gentis,15,Ille tibi cultusque deum delubraque centum,"['CF', 'CM', 'CF', 'CM', 'DI', None]",0,
1.0,16,"instituet, cum tu, genitor, lucebis ab omni",16,"Instituet cum tu, genitor, lucebis ab omni","['CM', 'DI', 'CM', 'CM', 'CF', 'DI', None]",0,
0.7619047619047619,17,"parte poli, neque iam Tyriis Cynosura carinis",17,Parte poli; neque enim Tyriae Cynosura carinae,"['CF', 'CM', 'SY', 'CM', 'CM', 'CF', None]",1,
0.925,18,"certior aut Grais Helice servanda magistris,",18,Certior aut Grais Helice seruanda magistris,"['DI', 'CM', 'CM', 'CM', 'CF', None]",0,
0.9512195121951219,19,"sed tu signa dabis, sed te duce Graecia mittet",19,"Tu <si> signa dabis, sed te duce Graecia mittet","['CM', 'DI', 'CF', 'CM', 'DI', 'CM', 'DI', 'DI', None]",0,
1.0,20,et Sidon Nilusque rates. nunc nostra serenus,20,Et Sidon Nilusque rates. nunc nostra serenus,"['CM', 'CM', 'CF', 'CM', 'DI', 'CF', None]",0,
0.85,21,"orsa iuves, haec ut Latias vox impleat urbes.",21,"Orsa iuues, haec ut Latias uox impleat urbes.","['CF', 'CM', 'DI', 'CM', 'CM', 'DI', 'DI', None]",0,
1.0,22,"Haemoniam primis Pelias frenabat ab annis,",22,"Haemoniam primis Pelias frenabat ab annis,","['CM', 'CM', 'CM', 'CF', 'DI', None]",0,
0.9318181818181818,23,iam gravis et longus populis metus: illius amnes,23,Iam grauis et longus populis metus; illius amnes,"['CM', 'DI', 'CM', 'CM', 'CM', 'DI', 'DI', None]",0,
1.0,24,"Ionium quicumque petunt, ille Othryn et Haemum",24,"Ionium quicumque petunt, ille Othryn et Haemum","['CM', 'CF', 'CM', 'SY', 'CF', 'DI', None]",1,
0.8378378378378378,25,atque imum felix versabat vomere Olympum.,25,Atque imum felix uersabat uomere Olympum.,"['SY', 'CM', 'CM', 'DI', 'SY', None]",2,
0.925,26,sed non ulla quies animo fratrisque paventi,26,Sed non ulla quies animo fratrisque pauenti,"['CM', 'DI', 'CF', 'CM', 'CM', 'CF', None]",0,
0.925,27,progeniem divumque minas; hunc nam fore regi,27,Progeniem diuumque minas; hunc nam fore regi,"['CM', 'CF', 'CM', 'DI', 'CM', 'DI', None]",0,
0.9230769230769231,28,exitio vatesque canunt pecudumque per aras,28,Exitio uatesque canunt pecudumque per aras,"['CM', 'CF', 'CM', 'CF', 'DI', None]",0,
1.0,29,terrifici monitus iterant: super ipsius ingens,29,Terrifici monitus iterant: super ipsius ingens,"['CM', 'CM', 'CM', 'DI', 'DI', None]",0,
0.7857142857142857,30,instat fama viri virtusque haut laeta tyranno.,30,Instat fama uiri uirtusque haud laeta tyranno.,"['DI', 'CF', 'CM', 'SY', 'DI', 'CF', None]",1,
0.9333333333333333,31,ergo anteire metus iuvenemque exstinguere pergit,31,Ergo anteire metus iuuenemque exstinguere pergit,"['SY', 'CF', 'CM', 'SY', 'DI', None]",2,
0.8333333333333334,32,Aesonium letique vias ac tempora versat.,32,Aesonium letique uias ac tempora uersat.,"['CM', 'CF', 'CM', 'DI', 'DI', None]",0,
0.9387755102040817,33,sed neque bella videt Graias neque monstra per urbes,33,Sed neque bella uidet Graias neque monstra per urbes,"['CM', 'DI', 'CF', 'CM', 'CM', 'DI', 'CF', 'DI', None]",0,
0.8888888888888888,34,ulla: Cleonaeo iam tempora clusus hiatu,34,Vlla: Cleonaeo iam tempora clausus hiatu,"['CF', 'CM', 'DI', 'DI', 'CF', None]",0,
1.0,35,Alcides; olim Lernae defensus ab angue,35,"Alcides, olim Lernae defensus ab angue","['CM', 'CM', 'CM', 'CF', 'DI', None]",0,
0.85,36,"Areas, et ambobus iam cornua fracta iuvencis.",36,"Arcas, et ambobus iam cornua fracta iuuencis.","['CF', 'DI', 'CM', 'DI', 'DI', 'CF', None]",0,
0.925,37,ira maris vastique placent discrimina ponti.,37,Ira maris uastique placent discrimina ponti.,"['CF', 'CM', 'CF', 'CM', 'DI', None]",0,
0.9333333333333333,38,tum iuvenem tranquilla tuens nec fronte timendus,38,Tum iuuenem tranquilla tuens nec fronte timendus,"['CM', 'CM', 'CF', 'CM', 'DI', 'CF', None]",0,
0.9302325581395349,39,occupat et fictis dat vultum et pondera dictis.,39,Occupat et fictis dat uultum et pondera dictis.,"['DI', 'CM', 'CM', 'DI', 'SY', 'DI', 'DI', None]",1,
0.9318181818181818,40,"'hanc mihi militiam, veterum quae pulchrior actis,",40,"""Hanc mihi militiam, ueterum quae pulchrior actis,","['CM', 'DI', 'CM', 'CM', 'DI', 'DI', None]",0,['Pelias']
1.0,41,adnue daque animum. nostri de sanguine Phrixus,41,Adnue daque animum. nostri de sanguine Phrixus,"['DI', 'SY', 'CM', 'CM', 'DI', 'DI', None]",1,['Pelias']
1.0,42,Cretheos ut patrias audis effugerit aras.,42,Cretheos ut patrias audis effugerit aras.,"['DI', 'CM', 'CM', 'CM', 'DI', None]",0,['Pelias']
0.9285714285714286,43,"hunc ferus Aeetes, Scythiam Phasimque rigentem",43,"Hunc ferus Aeetes, Scythiam Phasinque rigentem","['CM', 'DI', 'CM', 'CM', 'CF', None]",0,['Pelias']
0.926829268292683,44,"qui colit (heu magni Solis pudor), hospita vina",44,"Qui colit (heu magni Solis pudor), hospita uina","['CM', 'DI', 'CM', 'CM', 'CM', 'DI', 'DI', None]",0,['Pelias']
0.925,46,nil nostri divumque memor. non nuntia tantum,46,Nil nostri diuumque memor. non nuntia tantum,"['CM', 'CM', 'CF', 'CM', 'DI', 'DI', None]",0,['Pelias']
0.8536585365853658,47,"fama refert: ipsum iuvenem tam saeva gementem,",47,"Fama refert: ipsum iuuenem tam saeua gementem,","['CF', 'CM', 'CM', 'CM', 'DI', 'CF', None]",0,['Pelias']
1.0,48,"ipsum ego, cum serus fessos sopor alligat artus,",48,"Ipsum ego, cum serus fessos sopor alligat artus,","['SY', 'DI', 'CM', 'CM', 'CM', 'DI', 'DI', None]",1,['Pelias']
1.0,49,aspicio; lacera adsiduis namque illius umbra,49,"Aspicio, lacera adsiduis namque illius umbra","['CM', 'SY', 'CM', 'SY', 'DI', None]",2,['Pelias']
1.0,50,questibus et magni numen maris excitat Helle.,50,Questibus et magni numen maris excitat Helle.,"['DI', 'CM', 'CM', 'CM', 'DI', 'DI', None]",0,['Pelias']
0.8095238095238095,51,"si mihi quae quondam vires, vel pendere poenas",51,"Si mihi quae quondam uires, tum pendere poenas","['CM', 'DI', 'CM', 'CM', 'CM', 'DI', 'DI', None]",0,['Pelias']
0.9361702127659575,52,Colchida iam et regis caput hic atque arma videres.,52,Colchida iam et regis caput hic atque arma uideres.,"['DI', 'SY', 'CM', 'CM', 'DI', 'CM', 'SY', 'CF', None]",2,['Pelias']
1.0,53,"olim annis ille ardor hebet, necdum mea proles",53,"Olim annis ille ardor hebet, necdum mea proles","['SY', 'CM', 'SY', 'CF', 'CM', 'CM', 'DI', None]",2,['Pelias']
1.0,54,imperio et belli rebus matura marique.,54,Imperio et belli rebus matura marique.,"['SY', 'CM', 'CM', 'CM', 'CF', None]",1,['Pelias']
0.85,55,"tu, cui iam curaeque vigent animique viriles,",55,"Tu, cui iam curaeque uigent animique uiriles,","['CM', 'DI', 'CM', 'CF', 'CM', 'CF', None]",0,['Pelias']
0.9230769230769231,56,"i, decus, et pecoris Nephelaei vellera Graio",56,"I, decus, et pecoris Nephelaei uellera Graio","['CM', 'DI', 'CM', 'CM', 'DI', 'DI', None]",0,['Pelias']
1.0,57,redde tholo ac tantis temet dignare periclis.',57,"Redde tholo ac tantis temet dignare periclis.""","['CF', 'SY', 'CM', 'CM', 'CM', 'CF', None]",1,['Pelias']
0.85,58,"talibus hortatur iuvenem, propiorque iubenti",58,Talibus hortatus iuuenem propiorque iubenti,"['DI', 'CM', 'CM', 'CF', None]",0,
0.8461538461538461,59,"conticuit, certus Scythico concurrere ponto",59,Conticuit: cautes Scythico concurrere ponto,"['CM', 'CM', 'CM', 'DI', None]",0,
1.0,60,"Cyaneas, tantoque silet possessa dracone",60,Cyaneas tantoque silet possessa dracone,"['CM', 'CF', 'CM', 'CF', None]",0,
1.0,61,"vellera, multifidas regis quem filia linguas",61,"Vellera, multifidas regis quem filia linguas","['DI', 'CM', 'CM', 'DI', 'DI', None]",0,
0.926829268292683,62,vibrantem ex adytis cantu dapibusque vocabat,62,Vibrantem ex adytis cantu dapibusque uocabat,"['SY', 'CM', 'CM', 'CM', 'CF', None]",1,
0.75,63,et dabat ex terno liventia mella veneno.,63,Et dabat externo liuentia mella ueneno.,"['CM', 'DI', 'CM', 'DI', 'CF', None]",0,
0.9210526315789473,64,Mox taciti patuere doli nec vellera curae,64,"Mox taciti patuere doli, nec uellera curae","['CM', 'CM', 'CF', 'CM', 'DI', 'DI', None]",0,
0.9117647058823529,65,"esse viro, sed sese odiis immania cogi",65,"Esse uiro, sed sese odiis immania cogi","['CF', 'CM', 'DI', 'SY', 'CM', 'DI', None]",1,
1.0,66,in freta. qua iussos sed tandem quaerere Colchos,66,In freta; qua iussos sed tandem quaerere Colchos,"['CM', 'DI', 'CM', 'CM', 'DI', 'DI', 'DI', None]",0,
0.9142857142857143,67,arte queat? nunc aerii plantaria vellet,67,Arte queat? nunc aerii plantaria uellet,"['CF', 'CM', 'DI', 'CM', 'DI', None]",0,
0.7804878048780488,68,Perseos aut curru saevos frenasse dracones,68,Perseos aut currus et quos frenasse dracones,"['DI', 'CM', 'CM', 'DI', 'CM', 'CF', None]",0,
0.717948717948718,69,"ardet, ut ignaras Cereris qui vomere terras",69,Creditus ignaras Cereris qui uomere terras,"['DI', 'CM', 'CM', 'DI', 'DI', None]",0,
0.8333333333333334,70,imbuit et flava quercum damnavit arista.,70,Imbuit et flaua quercum damnauit arista.,"['DI', 'CM', 'CM', 'CM', 'CF', None]",0,
0.8636363636363636,71,heu quid agat? populumne levem veterique tyranno,71,Heu quid agat? populumne leuem ueterique tyranno,"['CM', 'CF', 'CM', 'CF', 'CM', 'CF', None]",0,
1.0,72,infensum atque olim miserantes Aesona patres,72,Infensum atque olim miserantes Aesona patres,"['SY', 'SY', 'CM', 'DI', 'DI', None]",2,
0.9210526315789473,73,advocet? an socia Iunone et Pallade fretus,73,"Aduocet, an socia Iunone et Pallade fretus","['DI', 'CM', 'CM', 'SY', 'DI', 'DI', None]",1,
0.9302325581395349,74,"armisona superet magis et freta iussa capessat,",74,"Armisona speret magis et freta iussa capessat,","['CM', 'CM', 'DI', 'CM', 'DI', 'CF', None]",0,
1.0,75,siqua operis tanti domito consurgere ponto,75,Siqua operis tanti domito consurgere ponto,"['SY', 'CM', 'CM', 'CM', 'DI', None]",1,
0.925,76,"fama queat? tu sola animos mentesque peruris,",76,"Fama queat? tu sola animos mentemque peruris,","['CF', 'CM', 'DI', 'SY', 'CM', 'CF', None]",1,
0.85,77,Gloria; te viridem videt immunemque senectae,77,Gloria; te uiridem uidet immunemque senectae,"['DI', 'CM', 'CM', 'DI', 'CF', None]",0,
0.8536585365853658,78,Phasidis in ripa stantem iuvenesque vocantem.,78,Phasidis in ripa stantem iuuenesque uocantem.,"['DI', 'CM', 'CM', 'CM', 'CF', None]",0,
0.9333333333333333,79,tandem animi incertum confusaque pectora firmat,79,Tandem animum incertum confusaque pectora firmat,"['SY', 'SY', 'CM', 'DI', 'DI', None]",2,
0.9473684210526315,80,"relligio, tendensque pias ad sidera palmas",80,"Religio, tendensque pias ad sidera palmas","['CM', 'CF', 'CM', 'DI', 'DI', None]",0,
1.0,81,"'omnipotens regina', inquit 'quam, turbidus atro",81,"""Omnipotens regina,"" inquit ""quam, turbidus atro","['CM', 'SY', 'CM', 'DI', 'DI', None]",1,['Jason']
1.0,82,"aethere caeruleum quateret cum Iuppiter imbrem,",82,"Aethere caeruleum quateret cum Iuppiter imbrem,","['DI', 'CM', 'CM', 'DI', 'DI', None]",0,['Jason']
1.0,83,ipse ego praecipiti tumidum per Enipea nimbo,83,Ipse ego praecipiti tumidum per Enipea nimbo,"['SY', 'DI', 'CM', 'CM', 'CF', 'DI', None]",1,['Jason']
0.972972972972973,84,in campos et tuta tuli nec credere quivi,84,In campos et tuta tuli nec credere quiui,"['CM', 'CM', 'DI', 'CF', 'CM', 'DI', 'DI', None]",0,['Jason']
1.0,85,"ante deam, quam te tonitru nutuque reposci",85,Ante deam quam te tonitru nutuque reposci,"['CF', 'CM', 'DI', 'CM', 'CM', 'CF', None]",0,['Jason']
0.918918918918919,86,"coniugis et subita raptam formidine vidi,",86,"Coniugis et subita raptam formidine uidi,","['DI', 'CM', 'CM', 'CM', 'DI', None]",0,['Jason']
0.9302325581395349,87,"da Scythiam Phasimque mihi; tuque, innuba Pallas,",87,"Da Scythiam Phasinque mihi; tuque, innuba Pallas,","['CM', 'CM', 'CF', 'CM', 'SY', 'DI', None]",1,['Jason']
0.8048780487804879,88,eripe me. vestris egomet tune vellera templis,88,Eripe me. uestris egomet tunc uellera templis,"['DI', 'CM', 'CM', 'CM', 'DI', 'DI', None]",0,['Jason']
1.0,89,"illa dabo, dabit auratis et cornibus igni",89,"Illa dabo, dabit auratis et cornibus igni","['CF', 'CM', 'DI', 'CM', 'DI', 'DI', None]",0,['Jason']
0.925,90,"colla pater, niveique greges altaria cingent.'",90,"Colla pater niueique greges altaria cingent.""","['CF', 'CM', 'CF', 'CM', 'DI', None]",0,['Jason']
1.0,91,Accepere deae celerique per aethera lapsu,91,Accepere deae celerique per aethera lapsu,"['CF', 'CM', 'CF', 'DI', 'DI', None]",0,
0.8285714285714286,92,diversas petiere vias. in moenia pernix,92,Diuersas petiere uias. in moenia pernix,"['CM', 'CF', 'CM', 'DI', 'DI', None]",0,
0.8461538461538461,93,Thespia et ad carum Tritonia devolat Argum.,93,Thespiaca ad carum Tritonia deuolat Argum.,"['SY', 'CM', 'CM', 'DI', 'DI', None]",1,
1.0,94,moliri hunc puppem iubet et demittere ferro,94,Moliri hunc puppem iubet et demittere ferro,"['SY', 'CM', 'CM', 'DI', 'CM', 'DI', None]",1,
1.0,95,"robora, Peliacas et iam comes exit in umbras.",95,"Robora, Peliacas et iam comes exit in umbras.","['DI', 'CM', 'DI', 'CM', 'DI', 'CF', 'DI', None]",0,
1.0,96,at Iuno Argolicas pariter Macetumque per urbes,96,At Iuno Argolicas pariter Macetumque per urbes,"['CM', 'SY', 'CM', 'CM', 'CF', 'DI', None]",1,
1.0,97,spargit inexpertos temptare parentibus austros,97,Spargit inexpertos temptare parentibus Austros,"['CF', 'CM', 'CF', 'DI', None]",0,
1.0,98,Aesoniden; iam stare ratem remisque superbam,98,Aesoniden: iam stare ratem remisque superbam,"['CM', 'DI', 'CF', 'CM', 'CF', None]",0,
0.9318181818181818,99,poscere quos revehat rebusque in saecula tollat.,99,Poscere quos reuehat rebusque in saecula tollat.,"['DI', 'CM', 'CM', 'SY', 'DI', 'DI', None]",1,
0.8780487804878049,100,Omnis avet quae iam bellis spectataque fama,100,Omnis adest quae iam bellis spectataque fama,"['CF', 'CM', 'DI', 'CM', 'CM', 'DI', None]",0,
0.9285714285714286,101,"turba ducum, primae seu quos in flore iuventae",101,"Turba ducum, primae seu quos in flore iuuentae","['CF', 'CM', 'CM', 'DI', 'CM', 'DI', 'CF', None]",0,
1.0,102,temptamenta tenent necdum data copia rerum:,102,Temptamenta tenent necdum data copia rerum.,"['CF', 'CM', 'CM', 'DI', 'DI', None]",0,
0.926829268292683,103,"at quibus arvorum studiumque insontis aratri,",103,"At quibus aruorum studiumque insontis aratri,","['CM', 'DI', 'CM', 'SY', 'CF', None]",1,
0.9318181818181818,104,hos stimulant magnaque ratem per lustra viasque,104,Hos stimulant magnaque ratem per lustra uiasque,"['CM', 'CM', 'CF', 'CM', 'DI', 'CF', None]",0,
1.0,105,visi laude canunt manifesto in lumine Fauni,105,Visi laude canunt manifesto in lumine Fauni,"['DI', 'CF', 'CM', 'SY', 'DI', 'DI', None]",1,
0.926829268292683,106,silvarumque deae atque elatis cornibus Amnes.,106,Siluarumque deae atque elatis cornibus Amnes.,"['CF', 'SY', 'SY', 'DI', 'DI', None]",2,
1.0,107,Protinus Inachiis ultro Tirynthius Argis,107,Protinus Inachiis ultro Tirynthius Argis,"['DI', 'CM', 'CM', 'DI', None]",0,
0.8235294117647058,108,"advolat, Arcadio cuius flammata veneno",108,"Aduolat, Arcadio cuius flammata ueneno","['DI', 'CM', 'CM', 'CF', None]",0,
1.0,109,tela puer facilesque umeris gaudentibus arcus,109,Tela puer facilesque umeris gaudentibus arcus,"['CF', 'CM', 'SY', 'CM', 'DI', None]",1,
0.9347826086956522,110,"gestat Hylas: velit ille quidem, sed dextera nondum",110,"Gestat Hylas; uelit ille quidem, sed dextera nondum","['CF', 'CM', 'DI', 'CF', 'CM', 'DI', 'DI', None]",0,
0.926829268292683,111,par oneri clavaeque capax. quos talibus amens,111,Par oneri clauaeque capax. quos talibus amens,"['CM', 'CM', 'CF', 'CM', 'DI', 'DI', None]",0,
0.926829268292683,112,insequitur solitosque novat Saturnia questus:,112,Insequitur solitosque nouat Saturnia questus:,"['CM', 'CF', 'CM', 'DI', None]",0,
0.918918918918919,113,'o utinam Graiae rueret non omne iuventae,113,"""O utinam Graiae rueret non omne iuuentae","['CM', 'CM', 'CM', 'CM', 'DI', 'CF', None]",0,['Juno']
0.9347826086956522,114,"in nova fata decus, nostrique Eurystheos haec nunc",114,"In noua fata decus, nostrique Eurystheos haec nunc","['CM', 'DI', 'CF', 'CM', 'SY', 'DI', 'CM', None]",1,['Juno']
0.9375,115,iussa forent. imbrem et tenebras saevumque tridentem,115,Iussa forent. imbrem et tenebras saeuumque tridentem,"['CF', 'CM', 'SY', 'CM', 'CM', 'CF', None]",1,['Juno']
0.8837209302325582,116,iam iam ego et inviti torsissem coniugis ignem.,116,Iamiam ego et inuiti torsissem coniugis ignem.,"['SY', 'SY', 'DI', 'CM', 'DI', 'DI', None]",2,['Juno']
0.8666666666666667,117,nune quoque nec socium nostrae columenve carinae,117,Nunc quoque nec socium nostrae columenue carinae,"['CM', 'DI', 'CM', 'CM', 'CM', 'CF', None]",0,['Juno']
0.9347826086956522,118,"esse velim, Herculeis nec me umquam fidere fas sit",118,"Esse uelim, Herculeis nec me umquam fidere fas sit","['CF', 'SY', 'CM', 'DI', 'SY', 'DI', 'DI', 'CM', None]",2,['Juno']
1.0,119,auxiliis comiti et tantum debere superbo.',119,"Auxiliis comiti et tantum debere superbo.""","['CM', 'SY', 'CM', 'CM', 'CF', None]",1,['Juno']
1.0,120,Dixit et Haemonias oculos detorquet ad undas.,120,Dixit et Haemonias oculos detorquet ad undas.,"['CF', 'DI', 'CM', 'CM', 'CF', 'DI', None]",0,
0.8636363636363636,121,"fervere cuncta virum coetu, simul undique cernit",121,"Feruere cuncta uirum coetu, simul undique cernit","['DI', 'CF', 'CM', 'CM', 'DI', 'DI', None]",0,
1.0,122,delatum nemus et docta resonare bipenni,122,Delatum nemus et docta resonare bipenni,"['CM', 'DI', 'CM', 'CM', 'CF', None]",0,
0.9210526315789473,123,litora; iam pinus gracili dissolvere lamna,123,Litora; iam pinus gracili dissoluere lamna,"['DI', 'CM', 'CM', 'CM', 'DI', None]",0,
1.0,124,Thespiaden iungique latus lentoque sequaces,124,Thespiaden iungique latus lentoque sequaces,"['CM', 'CF', 'CM', 'CF', None]",0,
0.9230769230769231,125,"molliri videt igne trabes, remisque paratis",125,Molliri uidet igne trabes remisque paratis,"['CM', 'DI', 'CF', 'CM', 'CF', None]",0,
0.9210526315789473,126,Pallada velifero quaerentem bracchia malo.,126,Pallada uelifero quaerentem bracchia malo.,"['DI', 'CM', 'DI', 'DI', None]",0,
0.9210526315789473,127,constitit ut longo moles non pervia ponto,127,"Constitit ut, longo moles non peruia ponto,","['DI', 'CM', 'CM', 'CM', 'DI', 'DI', None]",0,
1.0,128,"puppis, et ut tenues subiere latentia cerae",128,"Puppis, et ut tenues subiere latentia cerae","['CF', 'DI', 'CM', 'CM', 'CF', 'DI', None]",0,
0.8461538461538461,129,"lumina, picturae varios superaddit honores.",129,"Lumina, picturae uarios super addit honores.","['DI', 'CM', 'CM', 'DI', 'CF', None]",0,
1.0,130,hic sperata ... Tyrrheni tergore piscis,130,Hic sperata ** Tyrrheni tergore piscis,"['CM', 'CF', None, 'CM', 'DI', 'DI']",0,
0.9347826086956522,131,Peleos in thalamos vehitur Thetis; aequora delphin,131,Peleos in thalamos uehitur Thetis; aequora delphin,"['DI', 'CM', 'CM', 'CM', 'DI', 'DI', None]",0,
1.0,132,"corripit, illa sedet deiecta in lumina palla",132,"Corripit, <illa> sedet deiecta in lumina palla","['DI', 'CF', 'CM', 'SY', 'DI', 'DI', None]",1,
0.8648648648648649,133,nec love maiorem nasci suspirat Achillen.,133,Nec Ioue maiorem nasci suspirat Achillem.,"['CM', 'DI', 'CM', 'CM', 'CF', None]",0,
1.0,134,hanc Panope Dotoque soror laetataque fluctu,134,Hanc Panope Dotoque soror laetataque fluctu,"['CM', 'CM', 'CF', 'CM', 'DI', None]",0,
0.8780487804878049,135,prosequitur nitidis pariter Galatea lacertis,135,Prosequitur nudis pariter Galatea lacertis,"['CM', 'CM', 'CM', 'CF', None]",0,
0.8333333333333334,136,alta petens: Siculo revocat de litore Cyclops.,136,Antra petens; Siculo reuocat de litore Cyclops.,"['CF', 'CM', 'CM', 'CM', 'DI', 'DI', None]",0,
0.9318181818181818,137,contra ignis viridique torus de fronde dapesque,137,Contra ignis uiridique torus de fronde dapesque,"['SY', 'CM', 'CF', 'CM', 'DI', 'CF', None]",1,
0.9512195121951219,138,vinaque et aequoreos inter cum coniuge divos,138,Vinaque et aequoreos inter cum coniuge diuos,"['SY', 'DI', 'CM', 'CM', 'DI', 'DI', None]",1,
1.0,139,"Aeacides, pulsatque chelyn post pocula Chiron.",139,"Aeacides, pulsatque chelyn post pocula Chiron.","['CM', 'CF', 'CM', 'DI', 'DI', None]",0,
1.0,140,parte alia Pholoe multoque insanus Iaccho,140,Parte alia Pholoe multoque insanus Iaccho,"['SY', 'CM', 'CM', 'SY', 'CF', None]",2,
0.8536585365853658,141,Rhoetus et Atracia subitae de virgine pugnae.,141,Rhoecus et Atracia subitae de uirgine pugnae.,"['CF', 'DI', 'CM', 'CM', 'DI', 'DI', None]",0,
0.918918918918919,142,crateres mensaeque volant araeque deorum,142,Crateres mensaeque uolant araeque deorum,"['CM', 'CF', 'CM', 'CF', None]",0,
0.9302325581395349,143,"poculaque, insignis veterum labor. optimus hasta",143,"Poculaque, insignis ueterum labor. optimus hasta","['SY', 'CM', 'CM', 'DI', 'DI', None]",1,
1.0,144,"hic Peleus, hic ense furens agnoscitur Aeson;",144,"Hic Peleus, hic ense furens agnoscitur Aeson;","['CM', 'CM', 'DI', 'CF', 'CM', 'DI', None]",0,
0.7631578947368421,145,fert gravis invito victorem Nestora tergo,145,Fert grauis inuito uictorem Nestora tergo,"['CM', 'DI', 'CM', 'DI', 'DI', None]",0,
1.0,146,"Monychus, ardenti peragit Clanis Actora quercu;",146,"Monychus, ardenti peragit Clanis Actora quercu;","['DI', 'CM', 'CM', 'DI', 'DI', None]",0,
0.925,147,"nigro Nessus equo fugit, adclinisque tapetis",147,Nigro Nessus equo fugit acclinisque tapetis,"['DI', 'CF', 'CM', 'DI', 'CF', None]",0,
0.9230769230769231,148,in mediis vacuo condit caput Hippasus auro.,148,In mediis uacuo condit caput Hippasus auro.,"['CM', 'CM', 'CM', 'CM', 'DI', 'DI', None]",0,
0.8636363636363636,149,Haec quamquam miranda viris stupet Aesone natus,149,Haec quamquam miranda minus stupet Aesone natus,"['CM', 'CM', 'CF', 'CM', 'DI', 'DI', None]",0,
1.0,150,et secum: 'heu miseros nostrum natosque patresque.,150,"Et secum ""heu miseros nostrum natosque patresque.","['CM', 'SY', 'CM', 'CM', 'CM', 'CF', None]",1,['Jason']
0.9523809523809523,151,haccine nos animae faciles rate nubila contra,151,Hacine nos animae faciles rate nubila contra,"['DI', 'CM', 'CM', 'CM', 'DI', 'DI', None]",0,['Jason']
0.926829268292683,152,mittimur? in solum nunc saeviet Aesona pontus?,152,Mittimur? in solum nunc saeuiet Aesona pontus?,"['DI', 'CM', 'CM', 'DI', 'DI', 'DI', None]",0,['Jason']
0.8636363636363636,153,non iuvenem in casus eademnque pericula Acastum,153,Non iuuenem in casus eademque pericula Acastum,"['CM', 'SY', 'CM', 'CM', 'CF', 'SY', None]",2,['Jason']
0.9230769230769231,154,abripiam? invisae Pelias freta tuta carinae,154,Abripiam? inuisae Pelias freta tuta carinae,"['SY', 'CM', 'CM', 'DI', 'CF', None]",1,['Jason']
1.0,155,optet et exoret nostris cum matribus undas.',155,"Optet et exoret nostris cum matribus undas.""","['CF', 'DI', 'CM', 'CM', 'DI', 'DI', None]",0,['Jason']
0.725,156,Talia cunctanti laevum Iovis armiger aethra,156,Talia iactanti laeuum Iouis armiger aethra,"['DI', 'CM', 'CM', 'DI', 'DI', None]",0,
0.8604651162790697,157,advenit et validis fixam erigit unguibus agnam.,157,Aduenit et ualidis fixam erigit unguibus agnam.,"['DI', 'CM', 'CM', 'SY', 'DI', 'DI', None]",1,
1.0,158,at procul e stabulis trepidi clamore sequuntur,158,At procul e stabulis trepidi clamore sequuntur,"['CM', 'DI', 'CM', 'CM', 'CM', 'CF', None]",0,
1.0,159,pastores fremitusque canum; citus occupat auras,159,Pastores fremitusque canum; citus occupat auras,"['CM', 'CF', 'CM', 'DI', 'DI', None]",0,
1.0,160,raptor et Aegaei super effugit alta profundi.,160,Raptor et Aegaei super effugit alta profundi.,"['CF', 'DI', 'CM', 'DI', 'DI', 'CF', None]",0,
1.0,161,accipit augurium Aesonides laetusque superbi,161,Accipit augurium Aesonides laetusque superbi,"['DI', 'SY', 'CM', 'CF', None]",1,
0.9302325581395349,162,tecta petit Peliae. Drior huic tum regia proles,162,Tecta petit Peliae. prior huic tum regia proles,"['CF', 'CM', 'CM', 'DI', 'CM', 'DI', 'DI', None]",0,
0.926829268292683,163,advolat amplexus fraternaque pectora iungens.,163,Aduolat amplexus fraternaque pectora iungens.,"['DI', 'CM', 'DI', 'DI', None]",0,
1.0,164,"ductor ait: 'non degeneres, ut reris, Acaste,",164,"Ductor ait ""non degeneres, ut reris, Acaste,","['CF', 'CM', 'DI', 'CM', 'DI', 'CF', None]",0,['Jason']
