comp,perseus_n,perseus_text,pc_n,pc_text,pc_bounds,elision,speaker
0.9459459459459459,655,emicuit reserata dies caelumque resolvit,655,Emicuit reserata dies caelumque resoluit,"['CM', 'CF', 'CM', 'CF', None]",0,
1.0,656,arcus et in summos redierunt nubila montes.,656,Arcus et in summos redierunt nubila montes.,"['CF', 'DI', 'CM', 'CM', 'DI', 'DI', None]",0,
1.0,657,"iam placidis ratis exstat aquis, quam gurgite ab imo",657,"Iam placidis ratis exstat aquis, quam gurgite ab imo","['CM', 'CM', 'DI', 'CF', 'CM', 'DI', 'SY', 'DI', None]",1,
0.8095238095238095,658,et Thetis et magnis Nereus socer erigit ulnis.,658,Et Thetis et magnis Pelei socer erigit ulnis.,"['CM', 'DI', 'CM', 'CM', 'CM', 'DI', 'DI', None]",0,
0.9166666666666666,659,ergo umeros ductor sacro velatur amictu,659,Ergo umeros ductor sacro uelatur amictu,"['SY', 'CM', 'CM', 'CM', 'CF', None]",1,
1.0,660,"Aesoniamque capit pateram, quam munere gaudens",660,"Aesoniamque capit pateram, quam munere gaudens","['CF', 'CM', 'CM', 'DI', 'DI', None]",0,
1.0,661,liquerat hospitio pharetrasque rependerat auro,661,Liquerat hospitio pharetrasque rependerat auro,"['DI', 'CM', 'CF', 'DI', None]",0,
0.8837209302325582,662,"Salmoneus, nondum ille furens, qui fingeret alti",662,"Salmoneus, nondum ille furens, cum fingeret alti","['CM', 'SY', 'CF', 'CM', 'DI', 'DI', None]",1,
0.926829268292683,663,quadrifida trabe tela Iovis contraque ruenti,663,Quadrifida trabe tela Iouis contraque ruenti,"['CM', 'DI', 'CF', 'CM', 'CF', None]",0,
1.0,664,aut Athon aut Rhodopen maestae nemora ardua Pisae,664,Aut Athon aut Rhodopen maestae nemora ardua Pisae,"['CM', 'DI', 'CM', 'CM', 'CM', 'SY', 'DI', None]",1,
1.0,665,aemulus et miseros ipse ureret Elidis agros.,665,Aemulus et miseros ipse ureret Elidis agros.,"['DI', 'CM', 'CM', 'SY', 'DI', 'DI', None]",1,
1.0,666,hac pelago libat latices et talibus infit:,666,Hac pelago libat latices et talibus infit:,"['CM', 'CM', 'CM', 'CM', 'DI', 'DI', None]",0,
1.0,667,"'di, quibus undarum tempestatisque sonorae",667,"""Di quibus undarum tempestatisque sonorae","['CM', 'DI', 'CM', 'CF', None]",0,['Jason']
1.0,668,"imperium et magno penitus par regia caelo,",668,"Imperium et magno penitus par regia caelo,","['SY', 'CM', 'CM', 'CM', 'DI', 'DI', None]",1,['Jason']
0.926829268292683,669,"tuque fretum divosque pater sortite biformes,",669,"Tuque, fretum diuosque pater sortite biformes,","['CF', 'CM', 'CF', 'CM', 'CF', None]",0,['Jason']
0.8421052631578947,670,"seu casus nox ista fuit seu volvitur axis,",670,"Seu casus nox ista fuit seu, uoluitur axis","['CM', 'CM', 'DI', 'CF', 'CM', 'DI', 'DI', None]",0,['Jason']
0.6428571428571429,671,"ut superum sic claret opus, tollique vicissim",671,"Vt superum, sic stare operam tollique uicissim","['CM', 'CM', 'DI', 'SY', 'CM', 'CF', None]",1,['Jason']
0.9285714285714286,672,"pontus habet, seu te subitae nova puppis imago",672,"Pontus habet, seu te subitae noua puppis imago","['CF', 'CM', 'DI', 'CM', 'CM', 'DI', 'CF', None]",0,['Jason']
1.0,673,armorumque hominumque truces consurgere in iras,673,Armorumque hominumque truces consurgere in iras,"['SY', 'CF', 'CM', 'SY', 'DI', None]",2,['Jason']
1.0,674,"impulit, haec luerim satis et tua numina, rector,",674,"Impulit, haec luerim satis et tua numina, rector,","['DI', 'CM', 'CM', 'DI', 'CM', 'DI', 'DI', None]",0,['Jason']
1.0,675,iam fuerint meliora mihi. da reddere terris,675,Iam fuerint meliora mihi. da reddere terris,"['CM', 'CM', 'CF', 'CM', 'DI', 'DI', None]",0,['Jason']
1.0,676,has animas patriaeque amplecti limina portae.,676,Has animas patriaeque amplecti limina portae.,"['CM', 'CM', 'SY', 'DI', 'DI', None]",1,['Jason']
1.0,677,tum quocumque loco meritas tibi plurimus aras,677,Tum quocumque loco meritas tibi plurimus aras,"['CM', 'CF', 'CM', 'CM', 'DI', 'DI', None]",0,['Jason']
1.0,678,"pascit honos, ubicumque rotis horrendus equisque",678,"Pascit honos, ubicumque rotis horrendus equisque","['CF', 'CM', 'CF', 'CM', 'CF', None]",0,['Jason']
1.0,679,"stas, pater, atque ingens utrimque fluentia Triton",679,"Stas, pater, atque ingens utrimque fluentia Triton","['CM', 'DI', 'SY', 'CM', 'CF', 'DI', None]",1,['Jason']
1.0,680,"frena tenet, tantus nostras condere per urbes.'",680,"Frena tenet, tantus nostras condere per urbes.""","['CF', 'CM', 'CM', 'CM', 'CF', 'DI', None]",0,['Jason']
0.9318181818181818,681,dixerat haec. oritur clamor dextraeque sequuntur,681,Dixerat haec. oritur clamor dextraeque sequentum,"['DI', 'CM', 'CM', 'CM', 'CF', None]",0,
1.0,682,verba ducis. sic cum stabulis et messibus ingens,682,Verba ducis. sic cum stabulis et messibus ingens,"['CF', 'CM', 'DI', 'CM', 'CM', 'DI', 'DI', None]",0,
0.9736842105263158,683,ira deum et Calabri populator Sirius arvi,683,Ira deum et Calabri populator Sirius arui,"['CF', 'SY', 'CM', 'CM', 'DI', 'DI', None]",1,
1.0,684,"incubuit, coit agrestum manus anxia priscum",684,"Incubuit, coit agrestum manus anxia priscum","['CM', 'DI', 'CM', 'DI', 'DI', None]",0,
0.926829268292683,685,"in nemus, et miseris dictat pia vota sacerdos.",685,In nemus et miseris dictat pia uota sacerdos.,"['CM', 'DI', 'CM', 'CM', 'CM', 'DI', 'CF', None]",0,
1.0,686,ecce autem molli Zephyros descendere lapsu,686,Ecce autem molli Zephyros descendere lapsu,"['SY', 'CM', 'CM', 'CM', 'DI', None]",1,
0.85,687,aspiciunt; volat immissis cava pinus habenis,687,Aspiciunt; uolat immissis caua pinus habenis,"['CM', 'DI', 'CM', 'DI', 'CF', None]",0,
0.9318181818181818,688,infinditque salum et spumas vomit aere tridenti:,688,Infinditque salum et spumas uomit aere tridenti;,"['CF', 'SY', 'CM', 'CM', 'DI', 'CF', None]",1,
1.0,689,Tiphys agit tacitique sedent ad iussa ministri;,689,Tiphys agit tacitique sedent ad iussa ministri:,"['CF', 'CM', 'CF', 'CM', 'DI', 'CF', None]",0,
0.925,690,qualiter ad summi solium Iovis omnia circum,690,Qualiter ad summi solium Iouis omnia circum,"['DI', 'CM', 'CM', 'CM', 'DI', 'DI', None]",0,
0.8536585365853658,691,"prona parata deo, ventique imbresque nivesque",691,"Prona parata deo, uentique imbresque niuesque","['CF', 'CF', 'CM', 'SY', 'CF', None]",1,
1.0,692,fulguraque et tonitrus et adhuc in fontibus amnes.,692,Fulguraque et tonitrus et adhuc in fontibus amnes.,"['SY', 'CM', 'CM', 'CF', 'CM', 'DI', 'DI', None]",1,
1.0,693,At subitus curaque ducem metus acrior omni,693,At subitus curaque ducem metus acrior omni,"['CM', 'CM', 'CF', 'CM', 'DI', 'DI', None]",0,
1.0,694,"mensque mali praesaga quatit, quod regis adortus",694,"Mensque mali praesaga quatit, quod regis adortus","['CF', 'CM', 'CF', 'CM', 'DI', 'CF', None]",0,
1.0,695,progeniem raptoque dolis crudelis Acasto,695,Progeniem raptoque dolis crudelis Acasto,"['CM', 'CF', 'CM', 'CF', None]",0,
1.0,696,cetera nuda neci medioque in crimine patrem,696,Cetera nuda neci medioque in crimine patrem,"['DI', 'CF', 'CM', 'SY', 'DI', 'DI', None]",1,
0.8461538461538461,697,"liquerit ac nullis inopem vallaverit armis,",697,"Liquerit ac nullis inopem uallauerit armis,","['DI', 'CM', 'CM', 'CM', 'DI', None]",0,
1.0,698,ipse procul nunc tuta tenens; ruat omnis in illum,698,Ipse procul nunc tuta tenens; ruat omnis in illum,"['CF', 'CM', 'DI', 'CF', 'CM', 'DI', 'CF', 'DI', None]",0,
0.8636363636363636,699,quippe furor. nec vana pavet trepidatque futuris.,699,Quippe furor. nec uana pauet trepidatque futuris.,"['CF', 'CM', 'DI', 'CF', 'CM', 'CF', None]",0,
0.8604651162790697,700,Saevit atrox Pelias inimicaque vertice ab alto,700,Saeuit atrox Pelias inimicaque uertice ab alto,"['CF', 'CM', 'CM', 'DI', 'SY', 'DI', None]",1,
0.8571428571428571,701,vela videt nee qua se ardens effundere possit.,701,Vela uidet nec qua se ardens effundere possit.,"['CF', 'CM', 'DI', 'CM', 'SY', 'CM', 'DI', None]",1,
0.9285714285714286,702,"nil animi, nil regna iuvant; fremit obice ponti",702,"Nil animi, nil regna iuuant; fremit obice ponti","['CM', 'CM', 'DI', 'CF', 'CM', 'DI', 'DI', None]",0,
1.0,703,clausa cohors telisque salum facibusque coruscat.,703,"Clausa cohors, telisque salum facibusque coruscat.","['CF', 'CM', 'CF', 'CM', 'CF', None]",0,
0.8048780487804879,704,"haut secus, aerisona volucer cum Daedalus ora",704,"Haud secus, aerisona uolucer cum Daedalus Ida","['CM', 'DI', 'CM', 'CM', 'DI', 'DI', None]",0,
0.9210526315789473,705,"prosiluit iuxtaque comes brevioribus alis,",705,"Prosiluit iuxtaque comes breuioribus alis,","['CM', 'CF', 'CM', 'DI', None]",0,
0.918918918918919,706,"nube nova linquente domos, Minoia frustra",706,Nube noua linquente domos Minoia frustra,"['CF', 'CM', 'CF', 'CM', 'DI', None]",0,
0.9142857142857143,707,infremuit manus et visu lassatur inani,707,Infremuit manus et uisu lassatur inani,"['CM', 'DI', 'CM', 'CM', 'CF', None]",0,
1.0,708,omnis eques plenisque redit Gortyna pharetris.,708,Omnis eques plenisque redit Gortyna pharetris.,"['CF', 'CM', 'CF', 'CM', 'CF', None]",0,
1.0,709,quin etiam in thalamis primoque in limine Acasti,709,Quin etiam in thalamis primoque in limine Acasti,"['CM', 'SY', 'CM', 'CM', 'SY', 'DI', 'SY', None]",3,
0.9230769230769231,710,fusus humo iuvenis gressus et inania signa,710,Fusus humo iuuenis gressus et inania signa,"['CF', 'CM', 'CM', 'CM', 'CF', 'DI', None]",0,
0.925,711,ore premit sparsisque legens vestigia canis,711,Ore premit sparsisque legens uestigia canis,"['CF', 'CM', 'CF', 'CM', 'DI', None]",0,
1.0,712,"'te quoque iam maesti forsan genitoris imago,",712,"""Te quoque iam maesti forsan genitoris imago,","['CM', 'DI', 'CM', 'CM', 'CM', 'CF', None]",0,['Pelias']
1.0,713,"nate', ait 'et luctus subeunt suspiria nostri,",713,"Nate,"" ait ""et luctus subeunt suspiria nostri","['SY', 'DI', 'CM', 'CM', 'CM', 'DI', None]",1,['Pelias']
1.0,714,iamque dolos circumque trucis discrimina leti,714,Iamque dolos circumque trucis discrimina leti,"['CF', 'CM', 'CF', 'CM', 'DI', None]",0,['Pelias']
0.9318181818181818,715,"mille vides. qua te, infelix, quibus insequar oris?",715,"Mille uides. qua te, infelix, quibus insequar oris?","['CF', 'CM', 'DI', 'SY', 'CM', 'DI', 'DI', None]",1,['Pelias']
1.0,716,non Scythicas ferus ille domos nec ad ostia Ponti,716,Non Scythicas ferus ille domos nec ad ostia Ponti,"['CM', 'CM', 'DI', 'CF', 'CM', 'CF', 'DI', 'DI', None]",0,['Pelias']
1.0,717,"tendit iter, falsae sed captum laudis amore",717,"Tendit iter, falsae sed captum laudis amore","['CF', 'CM', 'CM', 'DI', 'DI', 'CF', None]",0,['Pelias']
1.0,718,"te, puer, in nostrae durus tormenta senectae",718,"Te, puer, in nostrae durus tormenta senectae","['CM', 'DI', 'CM', 'CM', 'CM', 'CF', None]",0,['Pelias']
0.9318181818181818,719,nune lacerat. celsis an si freta puppibus essent,719,Nunc lacerat. celsis an si freta puppibus essent,"['CM', 'CM', 'CM', 'DI', 'CM', 'DI', 'DI', None]",0,['Pelias']
0.7804878048780488,720,"pervia, non ultro iuvenes classemque decissem?",720,"Peruia, non ultro iuuenes classemque dedissem?","['DI', 'CM', 'CM', 'CM', 'CF', None]",0,['Pelias']
1.0,721,"o domus, o freti nequiquam prole penates.'",721,"O domus, o freti nequiquam prole penates!""","['CM', 'DI', 'CM', 'CM', 'DI', 'CF', None]",0,['Pelias']
1.0,722,dixit et extemplo furiis iraque minaci,722,Dixit et extemplo furiis iraque minaci,"['CF', 'DI', 'CM', 'CM', 'CF', None]",0,['Pelias']
0.926829268292683,723,"terribilis: 'sunt hic etiam tua vulnera, praedo,",723,"Terribilis ""sunt hic etiam tua uulnera, praedo,","['CM', 'DI', 'CM', 'CM', 'DI', 'DI', None]",0,['Pelias']
1.0,724,sunt lacrimae carusque parens.' simul aedibus altis,724,"Sunt lacrimae carusque parens"": simul aedibus altis","['CM', 'CM', 'CF', 'CM', 'DI', 'DI', None]",0,['Pelias']
0.9333333333333333,725,itque reditque fremens rerumque asperrima versat:,725,Itque reditque fremens rerumque asperrima uersat.,"['CF', 'CF', 'CM', 'SY', 'DI', None]",1,
0.9285714285714286,726,Bistonas ad meritos cum cornua saeva Thyoneus,726,Bistonas ad meritos cum cornua saeua Thyoneus,"['DI', 'CM', 'CM', 'DI', 'DI', 'CF', None]",0,
1.0,727,"torsit et infelix iam mille furoribus Haemus,",727,"Torsit, et infelix iam mille furoribus Haemus,","['CF', 'DI', 'CM', 'DI', 'CF', 'DI', None]",0,
1.0,728,"iam Rhodopes nemora alta gemunt, talem incita longis",728,"Iam Rhodopes nemora alta gemunt, talem incita longis","['CM', 'CM', 'SY', 'CF', 'CM', 'SY', 'DI', None]",2,
1.0,729,porticibus coniunxque fugit natique Lycurgum.,729,Porticibus coniunxque fugit natique Lycurgum.,"['CM', 'CF', 'CM', 'CF', None]",0,
0.9230769230769231,730,Tartareo tum sacra Iovi Stygiisque ferebat,730,Tartareo tum sacra Ioui Stygiisque ferebat,"['CM', 'DI', 'CF', 'CM', 'CF', None]",0,
0.9166666666666666,731,"manibus Alcimede tanto super auxia nato,",731,"Manibus Alcimede tanto super anxia nato,","['DI', 'CM', 'CM', 'DI', 'DI', None]",0,
1.0,732,siquid ab excitis melius praenosceret umbris.,732,Siquid ab excitis melius praenosceret umbris.,"['CF', 'DI', 'CM', 'CM', 'DI', None]",0,
1.0,733,ipsum etiam curisque parem talesque prementem,733,Ipsum etiam curisque parem talesque prementem,"['SY', 'CM', 'CF', 'CM', 'CF', None]",1,
1.0,734,"corde metus ducit, facilem tamen, Aesona coniunx.",734,"Corde metus ducit, facilem tamen, Aesona coniunx.","['CF', 'CM', 'CM', 'CM', 'DI', 'DI', None]",0,
0.9347826086956522,735,in scrobibus cruor et largus Phlegethontis aperti,735,In scrobibus cruor et largus Phlegethontis operti,"['CM', 'CM', 'DI', 'CM', 'CM', 'CF', None]",0,
0.7906976744186046,736,"stagnat honos, saevoque vocat grandaeva tumultu",736,"Stagnat honos, saeuoque uocat grandaeua tumultu","['CF', 'CM', 'CF', 'CM', 'CF', None]",0,
0.925,737,Thessalis exanimes atavos magnaeque nepotem,737,Thessalis exanimes atauos magnaeque nepotem,"['DI', 'CM', 'CM', 'CF', None]",0,
0.918918918918919,738,Pleiones. et iam tenues ad carmina vultus,738,Pleiones. et iam tenues ad carmina uultus,"['CM', 'DI', 'CM', 'CM', 'DI', 'DI', None]",0,
1.0,739,extulerat maestosque tuens natumque nurumque,739,Extulerat maestosque tuens natumque nurumque,"['CM', 'CF', 'CM', 'CF', None]",0,
1.0,740,talia libato pandebat sanguine Cretheus:,740,Talia libato pandebat sanguine Cretheus:,"['DI', 'CM', 'DI', 'DI', None]",0,
0.9347826086956522,741,"'mitte metus, volat ille mari quantumque propinquat,",741,"""Mitte metus, uolat ille mari, quantumque propinquat","['CF', 'CM', 'DI', 'CF', 'CM', 'CF', None]",0,['ghost of Cretheus']
0.9302325581395349,742,iam magis atque magis variis stupet Aea deorum,742,Iam magis atque magis uariis stupet Aea deorum,"['CM', 'DI', 'CF', 'CM', 'CM', 'DI', 'CF', None]",0,['ghost of Cretheus']
1.0,743,prodigiis quatiuntque truces oracula Colchos.,743,Prodigiis quatiuntque truces oracula Colchos.,"['CM', 'CF', 'CM', 'DI', None]",0,['ghost of Cretheus']
1.0,744,"heu quibus ingreditur fatis, qui gentibus horror",744,"Heu quibus ingreditur fatis, qui gentibus horror","['CM', 'DI', 'CM', 'CM', 'DI', 'DI', None]",0,['ghost of Cretheus']
1.0,745,pergit. mox Scythiae spoliis nuribusque superbus,745,Pergit! mox Scythiae spoliis nuribusque superbus,"['DI', 'CM', 'CM', 'CM', 'CF', None]",0,['ghost of Cretheus']
0.8636363636363636,746,adveniet; cuperem ipse graves tum rumpere terras.,746,Adueniet; cuperem ipse graues tum rumpere terras.,"['CM', 'SY', 'CF', 'CM', 'DI', 'DI', None]",1,['ghost of Cretheus']
1.0,747,sed tibi triste nefas fraternaque turbidus arma,747,Sed tibi triste nefas fraternaque turbidus arma,"['CM', 'DI', 'CF', 'CM', 'DI', 'DI', None]",0,['ghost of Cretheus']
0.9210526315789473,748,rex parat et saevos irarum concipit ignes.,748,Rex parat et saeuos irarum concipit ignes.,"['CM', 'DI', 'CM', 'CM', 'DI', 'DI', None]",0,['ghost of Cretheus']
0.94,749,quin rapis hine animam et famulos citus effugis artus?,749,Quin rapis hinc animam et famulos citus effugis artus?,"['CM', 'DI', 'CM', 'SY', 'CM', 'CM', 'DI', 'DI', None]",1,['ghost of Cretheus']
1.0,750,"i, meus es, iam te in lucos pia turba silentum",750,"I, meus es, iam te <in> lucos pia turba silentum","['CM', 'DI', 'CM', 'DI', 'SY', 'CM', 'CM', 'DI', 'CF', None]",1,['ghost of Cretheus']
0.8780487804878049,751,secretisque ciet volitans pater Aeolus arvis.',751,"Secretisque ciet uolitans pater Aeolus aruis.""","['CF', 'CM', 'CM', 'DI', 'DI', None]",0,['ghost of Cretheus']
0.918918918918919,752,Horruits interea famulum clamore supremo,752,Horruit interea famulum clamore supremo,"['DI', 'CM', 'CM', 'CF', None]",0,
1.0,753,"maesta domus, regemque fragor per moenia differt",753,"Maesta domus, regemque fragor per moenia differt","['CF', 'CM', 'CF', 'CM', 'DI', 'DI', None]",0,
0.925,754,mille ciere manus et iam dare iussa vocatis.,754,Mille ciere manus et iam dare iussa uocatis.,"['CF', 'CF', 'CM', 'DI', 'CM', 'DI', 'CF', None]",0,
0.925,755,flagrantes aras vestemque nemusque sacerdos,755,Flagrantes aras uestemque nemusque sacerdos,"['CM', 'CM', 'CF', 'CF', None]",0,
0.9333333333333333,756,"praecipitat, subitisque pavens circumspicit Aeson,",756,Praecipitat subitisque pauens circumspicit Aeson,"['CM', 'CF', 'CM', 'DI', None]",0,
0.8536585365853658,757,quid moveat. quam multa leo cunctatus in arta,757,Quid moueat. quam multa leo cunctatur in arta,"['CM', 'CM', 'DI', 'CF', 'CM', 'CF', 'DI', None]",0,
0.925,758,"mole virum rictuque genas et lumina pressit,",758,"Mole uirum rictuque genas et lumina pressit,","['CF', 'CM', 'CF', 'CM', 'DI', 'DI', None]",0,
1.0,759,"sic curae subiere ducem, ferrumne capessat",759,"Sic curae subiere ducem, ferrumne capessat","['CM', 'CM', 'CF', 'CM', 'CF', None]",0,
0.9210526315789473,760,imbelle atque aevi senior gestamina primi,760,"Imbelle atque aeui senior gestamina primi,","['SY', 'SY', 'CM', 'CM', 'DI', None]",2,
0.918918918918919,761,an patres regnique acuat mutabile vulgus.,761,An patres regnique acuat mutabile uulgus.,"['CM', 'CM', 'SY', 'CM', 'DI', None]",1,
1.0,762,contra effusa manus haerensque in pectore coniunx,762,Contra effusa manus haerensque in pectore coniunx,"['SY', 'CF', 'CM', 'SY', 'DI', 'DI', None]",2,
1.0,763,'me quoque' ait 'casus comitem quicumque propinquat,763,"""Me quoque"" ait ""casus comitem quicumque propinquat","['CM', 'SY', 'CM', 'CM', 'CM', 'CF', None]",1,['Alcimede']
0.918918918918919,764,"accipies, nec fata traham natumque videbo",764,"Accipies, nec fata traham natumque uidebo","['CM', 'DI', 'CF', 'CM', 'CF', None]",0,['Alcimede']
1.0,765,"te sine, sat caeli patiens, cum prima per altum",765,"Te sine, sat caeli patiens, cum prima per altum","['CM', 'DI', 'CM', 'CM', 'CM', 'DI', 'CF', 'DI', None]",0,['Alcimede']
1.0,766,"vela dedit, potui quae tantum ferre dolorem.'",766,"Vela dedit potui quae tantum ferre dolorem.""","['CF', 'CM', 'CM', 'DI', 'DI', 'CF', None]",0,['Alcimede']
1.0,767,"talia per lacrimas. et iam circumspicit Aeson,",767,Talia per lacrimas. et iam circumspicit Aeson,"['DI', 'CM', 'CM', 'DI', 'CM', 'DI', None]",0,
0.926829268292683,768,"praeveniat quo fine minas, quae fata capessat",768,"Praeueniat quo fine minas, quae fata capessat","['CM', 'DI', 'CF', 'CM', 'DI', 'CF', None]",0,
1.0,769,digna satis: magnos obitus natumque domumque,769,Digna satis; magnos obitus natumque domumque,"['CF', 'CM', 'CM', 'CM', 'CF', None]",0,
1.0,770,et genus Aeolium pugnataque poscere bella.,770,Et genus Aeolium pugnataque poscere bella.,"['CM', 'DI', 'CM', 'DI', 'DI', None]",0,
0.9302325581395349,771,"est etiam ante oculos aevi rudis altera proles,",771,"Est etiam ante oculos aeui rudis altera proles,","['CM', 'SY', 'SY', 'CM', 'CM', 'DI', 'DI', None]",2,
1.0,772,ingentes animos et fortia discere facta,772,Ingentes animos et fortia discere facta,"['CM', 'CM', 'DI', 'DI', 'DI', None]",0,
0.926829268292683,773,quem velit atque olim leti meminisse paterni.,773,Quem uelit atque olim leti meminisse paterni.,"['CM', 'DI', 'SY', 'CM', 'CM', 'CF', None]",1,
0.85,774,ergo sacra novat. veteris sub nocte cupressi,774,Ergo sacra nouat. ueteris sub nocte cupressi,"['DI', 'CF', 'CM', 'CM', 'DI', 'CF', None]",0,
1.0,775,sordidus et multa pallens ferrugine taurus,775,Sordidus et multa pallens ferrugine taurus,"['DI', 'CM', 'CM', 'CM', 'DI', None]",0,
0.926829268292683,776,"stabat adhuc, cui caeruleae per cornua vittae",776,"Stabat adhuc, cui caeruleae per cornua uittae","['CF', 'CM', 'DI', 'CM', 'DI', 'DI', None]",0,
1.0,777,et taxi frons hirta comis; ipse aeger anhelans,777,Et taxi frons hirta comis; ipse aeger anhelans,"['CM', 'CM', 'DI', 'CF', 'CM', 'SY', 'CF', None]",1,
0.9230769230769231,778,impatiensque loci visaque exterritus umbra.,778,Impatiensque loci uisaque exterritus umbra.,"['CF', 'CM', 'SY', 'DI', None]",1,
1.0,779,hunc sibi praecipuum gentis de more nefandae,779,Hunc sibi praecipuum gentis de more nefandae,"['CM', 'DI', 'CM', 'CM', 'DI', 'CF', None]",0,
0.8648648648648649,780,Thessalis in seros Ditis servaverat usus:,780,"Thessalis in seros Ditis seruauerat usus,","['DI', 'CM', 'CM', 'CM', 'DI', None]",0,
1.0,781,tergeminam cum placat eram Stygiasque supremo,781,Tergeminam cum placat eram Stygiasque supremo,"['CM', 'DI', 'CF', 'CM', 'CF', None]",0,
0.975,782,"obsecrat igne domos, iam iam exorabile retro",782,"Obsecrat igne domos, iamiam exorabile retro","['DI', 'CF', 'CM', 'SY', 'DI', None]",1,
0.8823529411764706,783,carmen agens; neque enim ante leves niger avehit umbras,783,Carmen agens; neque enim ante leues niger auehit umbras,"['CF', 'CM', 'SY', 'SY', 'CF', 'CM', 'DI', 'DI', None]",2,
0.9069767441860465,784,"portitor, et vinctae primis stant faucibus Orci.",784,Portitor et cunctae primis stant faucibus Orci.,"['DI', 'CM', 'CM', 'CM', 'DI', 'DI', None]",0,
1.0,785,illum ubi terrificis superesse in tempore sacris,785,Illum ubi terrificis superesse in tempore sacris,"['SY', 'DI', 'CM', 'SY', 'DI', 'DI', None]",2,
1.0,786,"conspexit, statuit leto supremaque fatur",786,"Conspexit, statuit leto supremaque fatur","['CM', 'CM', 'CM', 'DI', None]",0,
1.0,787,ipse manu tangens damnati cornua tauri:,787,Ipse manu tangens damnati cornua tauri:,"['CF', 'CM', 'CM', 'DI', 'DI', None]",0,
0.9318181818181818,788,"'vos, quibus imperium Iovis et non segne peractum",788,"""Vos, quibus imperium Iouis et non segne peractum","['CM', 'DI', 'CM', 'DI', 'CM', 'DI', 'CF', None]",0,['Aeson']
1.0,789,"lucis iter, mihi conciliis, mihi cognita bellis",789,"Lucis iter, mihi conciliis, mihi cognita bellis","['CF', 'CM', 'DI', 'CM', 'DI', 'DI', None]",0,['Aeson']
1.0,790,nomina magnorum fama sacrata nepotum;,790,"Nomina, magnorum fama sacrata nepotum;","['DI', 'CM', 'CM', 'CF', None]",0,['Aeson']
0.926829268292683,791,"tuque, excite parens umbris, ut nostra videres",791,"Tuque, excite parens umbris ut nostra uideres","['SY', 'CF', 'CM', 'CM', 'DI', 'CF', None]",1,['Aeson']
1.0,792,"funera et oblitos superum paterere dolores,",792,"Funera et oblitos superum paterere dolores,","['SY', 'DI', 'CM', 'CM', 'CF', None]",1,['Aeson']
0.9333333333333333,793,da placidae mihi sedis iter meque hostia vestris,793,"Da placidae mihi sedis iter, meque hostia uestris","['CM', 'CM', 'DI', 'CF', 'CM', 'SY', 'DI', None]",1,['Aeson']
1.0,794,"conciliet praemissa locis. tu, nuntia sontum",794,"Conciliet praemissa locis. tu, nuntia sontum","['CM', 'CF', 'CM', 'DI', 'DI', None]",0,['Aeson']
0.9302325581395349,795,"virgo Iovi, terras oculis quae prospicis aequis,",795,"Virgo Ioui, terras oculis quae prospicis aequis,","['CF', 'CM', 'CM', 'CM', 'DI', 'DI', None]",0,['Aeson']
0.9024390243902439,796,ultricesque deae Fasque et grandaeva Furorum,796,Vltricesque deae Fasque et grandaeua Furorum,"['CF', 'CM', 'SY', 'CM', 'CF', None]",1,['Aeson']
1.0,797,"poena parens, meritis regis succedite tectis",797,"Poena parens, meritis regis succedite tectis","['CF', 'CM', 'CM', 'CM', 'DI', None]",0,['Aeson']
0.925,798,et saevas inferte faces. sacer effera raptet,798,Et saeuas inferte faces. sacer effera raptet,"['CM', 'CM', 'CF', 'CM', 'DI', 'DI', None]",0,['Aeson']
0.7,799,corda pavor; nee sola mei gravia adfore nati,799,"Corda pauor, nec sola mei grauia affore nati","['CF', 'CM', 'DI', 'CF', 'CM', 'SY', 'DI', None]",1,['Aeson']
1.0,800,arma ratemque putet: classes et Pontica signa,800,Arma ratemque putet; classes et Pontica signa,"['CF', 'CF', 'CM', 'CM', 'DI', 'DI', None]",0,['Aeson']
1.0,801,atque indignatos temerato litore reges,801,Atque indignatos temerato litore reges,"['SY', 'CM', 'DI', 'DI', None]",1,['Aeson']
1.0,802,mente agitet semperque metu decurrat ad undas,802,Mente agitet semperque metu decurrat ad undas,"['SY', 'CM', 'CF', 'CM', 'CF', 'DI', None]",1,['Aeson']
0.8372093023255814,803,arena ciens; mors sera viam temptataque claudat,803,Arma ciens: mors sera uiam temptataque claudat,"['CF', 'CM', 'DI', 'CF', 'CM', 'DI', None]",0,['Aeson']
1.0,804,"effugia et nostras nequeat praecurrere diras,",804,"Effugia et nostras nequeat praecurrere diras,","['SY', 'CM', 'CM', 'CM', 'DI', None]",1,['Aeson']
0.9285714285714286,805,sed reduces iam iamque viros auroque coruscum,805,Sed reduces iam iamque uiros auroque coruscum,"['CM', 'CM', 'DI', 'CF', 'CM', 'CF', None]",0,['Aeson']
0.9285714285714286,806,cernat iter. stabo insultans et ovantia contra,806,Cernat iter. stabo insultans et ouantia contra,"['CF', 'CM', 'SY', 'CM', 'CF', 'DI', None]",1,['Aeson']
0.925,807,"ora manusque feram. tum, vobis siquod inausum",807,Ora manusque feram. tum uobis siquod inausum,"['CF', 'CF', 'CM', 'DI', 'DI', 'CF', None]",0,['Aeson']
0.8918918918918919,808,arcanumque nefas et adhuc incondita leti,808,Arcanumque nefas et adhuc incognita leti,"['CF', 'CM', 'CF', 'CM', 'DI', None]",0,['Aeson']
1.0,809,"sors superest, date fallaci pudibunda senectae",809,"Sors superest, date fallaci pudibunda senectae","['CM', 'CM', 'DI', 'CM', 'CF', None]",0,['Aeson']
1.0,810,exitia indecoresque obitus. non Marte nec armis,810,Exitia indecoresque obitus. non Marte nec armis,"['SY', 'SY', 'CM', 'DI', 'CF', 'DI', None]",2,['Aeson']
0.95,811,"aut nati, precor, ille mei dignatus ut umquam",811,Aut precor ille mei nati dignatus ut umquam,"['CM', 'DI', 'CF', 'CM', 'CM', 'CF', 'DI', None]",0,['Aeson']
1.0,812,"ense cadat; quae fida manus, quae cara suorum",812,"Ense cadat; quae fida, manus, quae cara, suorum","['CF', 'CM', 'DI', 'CF', 'CM', 'DI', 'CF', None]",0,['Aeson']
1.0,813,diripiat laceretque senem nec membra sepulchro,813,Diripiat laceretque senem nec membra sepulchro,"['CM', 'CF', 'CM', 'DI', 'CF', None]",0,['Aeson']
