comp,perseus_n,perseus_text,pc_n,pc_text,pc_bounds,elision,speaker
1.0,165,venimus ad questus: socium te iungere coeptis,165,Venimus ad questus: socium te iungere coeptis,"['DI', 'CM', 'CM', 'CM', 'DI', 'DI', None]",0,['Jason']
1.0,166,est animus; neque enim Telamon aut Canthus et Idas,166,Est animus; neque enim Telamon aut Canthus et Idas,"['CM', 'CM', 'SY', 'CM', 'CM', 'DI', 'CF', 'DI', None]",1,['Jason']
0.9285714285714286,167,Tyndareusque puer mihi vellere dignior Helles.,167,Tyndareusque puer mihi uellere dignior Helles.,"['CF', 'CM', 'DI', 'DI', 'DI', None]",0,['Jason']
1.0,168,"o quantum terrae, quantum cognoscere caeli",168,"O quantum terrae, quantum cognoscere caeli","['CM', 'CM', 'CM', 'CM', 'DI', None]",0,['Jason']
1.0,169,"permissum est, pelagus quantos aperimus in usus.",169,Permissum est! pelagus quantos aperimus in usus!,"['CM', 'PE', 'CM', 'CM', 'CF', 'DI', None]",0,['Jason']
0.9318181818181818,170,nunc forsan grave reris opus; sed laeta recurret,170,"Nunc forsan graue reris opus, sed laeta recurret","['CM', 'CM', 'DI', 'CF', 'CM', 'DI', 'CF', None]",0,['Jason']
1.0,171,"cum ratis et caram cum iam mihi reddet Iolcon,",171,Cum ratis et caram cum iam mihi reddet Iolcon,"['CM', 'DI', 'CM', 'CM', 'DI', 'CM', 'DI', 'CF', None]",0,['Jason']
0.9318181818181818,172,"quis pudor heu nostros tibi tune audire labores,",172,"Quis pudor heu nostros tibi tunc audire labores,","['CM', 'DI', 'CM', 'CM', 'DI', 'CM', 'CF', None]",0,['Jason']
0.9230769230769231,173,quam referam visas tua per suspiria gentes.',173,"Quam referam uisas tua per suspiria gentes!""","['CM', 'CM', 'CM', 'DI', 'CM', 'DI', None]",0,['Jason']
0.925,174,Nec passus rex plura virum: 'sat multa parato,174,"Nec passus rex plura uirum ""sat multa parato","['CM', 'CM', 'DI', 'CF', 'CM', 'DI', 'CF', None]",0,['Acastus']
0.8571428571428571,175,"in quaecumque vocas; nec nos' ait 'optume, segnes",175,"In quaecumque uocas; nec nos"" ait, ""optime, segnes","['CM', 'CF', 'CM', 'DI', 'CM', 'DI', 'DI', None]",0,['Acastus']
0.925,176,credideris patriisve magis confidere regnis,176,Credideris patriisue magis confidere regnis,"['CM', 'CF', 'CM', 'DI', None]",0,['Acastus']
0.9024390243902439,177,"quam tibi, si primos duce te virtutis honoris",177,"Quam tibi, si primos duce te uirtutis honores","['CM', 'DI', 'CM', 'CM', 'DI', 'CM', 'CF', None]",0,['Acastus']
0.6829268292682927,178,carpere fraternae sedeatque adcrescere famae.,178,"Carpere, fraternae si des accrescere famae.","['DI', 'CM', 'DI', 'CM', 'DI', None]",0,['Acastus']
1.0,179,"quin ego, nequa metu nimio me cura parentis",179,"Quin ego, nequa metu nimio me cura parentis","['CM', 'DI', 'CF', 'CM', 'CM', 'DI', 'CF', None]",0,['Acastus']
1.0,180,"impediat, fallam ignarum subitusque paratis",180,"Impediat, fallam ignarum subitusque paratis","['CM', 'SY', 'CM', 'CF', None]",1,['Acastus']
1.0,181,"tunc adero, primas linquet cum puppis harenas.'",181,"Tunc adero, primas linquet cum puppis harenas.""","['CM', 'CM', 'CM', 'CM', 'DI', 'CF', None]",0,['Acastus']
1.0,182,dixerat. ille animos promissaque talia laetus,182,Dixerat. ille animos promissaque talia laetus,"['DI', 'SY', 'CM', 'DI', 'DI', None]",1,
0.8461538461538461,183,accipit et gressus avidos ad litora vertit.,183,Accipit et gressus auidos ad litora uertit.,"['DI', 'CM', 'CM', 'CM', 'DI', 'DI', None]",0,
1.0,184,At ducis imperiis Minyae monituque frequentes,184,At ducis imperiis Minyae monituque frequentes,"['CM', 'DI', 'CM', 'CM', 'CF', None]",0,
1.0,185,puppem umeris subeunt et tento poplite proni,185,Puppem umeris subeunt et tento poplite proni,"['SY', 'CM', 'CM', 'DI', 'DI', 'DI', None]",1,
1.0,186,decurrunt intrantque fretum. non clamor anhelis,186,Decurrunt intrantque fretum; non clamor anhelis,"['CM', 'CF', 'CM', 'DI', 'CF', None]",0,
1.0,187,nauticus aut blandus testudine defuit Orpheus.,187,Nauticus aut blandus testudine defuit Orpheus.,"['DI', 'CM', 'CM', 'DI', 'DI', None]",0,
1.0,188,"tum laeti statuunt aras. tibi, rector aquarum,",188,"Tum laeti statuunt aras. tibi, rector aquarum,","['CM', 'CM', 'CM', 'CM', 'DI', 'CF', None]",0,
0.926829268292683,189,"summus honor, tibi caeruleis in litore vittis",189,"Summus honor, tibi caeruleis in litore uittis","['CF', 'CM', 'DI', 'CM', 'DI', 'DI', None]",0,
0.8636363636363636,190,et Zephyris Glaucoque bovem Thetidique iuvencam,190,Et Zephyris Glaucoque bouem Thetidique iuuencam,"['CM', 'CM', 'CF', 'CM', 'CF', None]",0,
1.0,191,deicit Ancaeus. non illo certior alter,191,Deicit Ancaeus: non illo certior alter,"['DI', 'CM', 'DI', 'DI', 'DI', None]",0,
1.0,192,pinguia letifera perfringere colla bipenni.,192,Pinguia letifera perfringere colla bipenni.,"['DI', 'CM', 'DI', 'CF', None]",0,
1.0,193,ipse ter aequoreo libans carchesia patri,193,Ipse ter aequoreo libans carchesia patri,"['CF', 'DI', 'CM', 'CM', 'DI', None]",0,
1.0,194,sic ait Aesonides: 'o qui spumantia nutu,194,"Sic ait Aesonides: ""o qui spumantia nutu","['CM', 'DI', 'CM', 'DI', 'CM', 'DI', None]",0,['Jason']
1.0,195,"regna quatis terrasque salo complecteris omnes,",195,"Regna quatis terrasque salo complecteris omnes,","['CF', 'CM', 'CF', 'CM', 'DI', None]",0,['Jason']
0.9210526315789473,196,da veniam. scio me cunctis e gentibus unum,196,Da ueniam. scio me cunctis e gentibus unum,"['CM', 'CM', 'DI', 'CM', 'CM', 'DI', 'DI', None]",0,['Jason']
0.8648648648648649,197,inlicitas temptare vias hiememque mereri:,197,Illicitas temptare uias hiememque mereri:,"['CM', 'CF', 'CM', 'CF', None]",0,['Jason']
1.0,198,"sed non sponte feror, nec nunc mihi iungere montes",198,"Sed non sponte feror, nec nunc mihi iungere montes","['CM', 'DI', 'CF', 'CM', 'DI', 'CM', 'DI', 'DI', None]",0,['Jason']
1.0,199,mens tamen aut summo deposcere fulmen Olympo.,199,Mens tamen aut summo deposcere fulmen Olympo.,"['CM', 'DI', 'CM', 'CM', 'DI', 'CF', None]",0,['Jason']
0.925,200,ne Peliae te vota trahant: ille aspera iussa,200,Ne Peliae te uota trahant; ille aspera iussa,"['CM', 'CM', 'DI', 'CF', 'CM', 'SY', 'DI', None]",1,['Jason']
1.0,201,repperit et Colchos in me luctumque meorum:,201,Repperit et Colchos in me luctumque meorum.,"['DI', 'CM', 'CM', 'DI', 'CM', 'CF', None]",0,['Jason']
1.0,202,†illumetu tantum ... non indignantibus undis,202,*illumetu* tantum non indignantibus undis,"['CM', 'CM', 'DI', 'DI', None]",0,['Jason']
1.0,203,hoc caput accipias et pressam regibus alnum.',203,"Hoc caput accipias et pressam regibus alnum.""","['CM', 'DI', 'CM', 'DI', 'DI', 'DI', None]",0,['Jason']
1.0,204,sic fatus pingui cumulat libamine flammam.,204,Sic fatus pingui cumulat libamine flammam.,"['CM', 'CM', 'CM', 'CM', 'DI', None]",0,
1.0,205,Protulit ut crinem densis luctatus in extis,205,Protulit ut crinem densis luctatus in extis,"['DI', 'CM', 'CM', 'CM', 'CF', 'DI', None]",0,
0.9210526315789473,206,"ignis et escendit salientia viscera tauri,",206,"Ignis et escendit salientia uiscera tauri,","['CF', 'DI', 'CM', 'DI', 'DI', None]",0,
1.0,207,ecce sacer totusque dei per litora Mopsus,207,Ecce sacer totusque dei per litora Mopsus,"['CF', 'CM', 'CF', 'CM', 'DI', 'DI', None]",0,
0.8421052631578947,208,immanis visu vittamque comamque per auras,208,Immanis uisu uittamque comamque per auras,"['CM', 'CM', 'CF', 'CF', 'DI', None]",0,
0.926829268292683,209,"surgentem laurusque rotat. vox reddita tandem,",209,"Surgentem laurusque rotat. uox reddita tandem,","['CM', 'CF', 'CM', 'DI', 'DI', None]",0,
0.8461538461538461,210,vox horrenda viris; tum facta silentia vati:,210,Vox horrenda uiris; tum facta silentia uati.,"['CM', 'CF', 'CM', 'DI', 'CF', 'DI', None]",0,
1.0,211,'heu quaenam aspicio. nostris modo concitus ausis,211,"""Heu quaenam aspicio? nostris modo concitus ausis","['CM', 'SY', 'CM', 'CM', 'DI', 'DI', None]",1,['Mopsus (son of Ampyx)']
0.926829268292683,212,aequoreos vocat ecce deos Neptunus et ingens,212,Aequoreos uocat ecce deos Neptunus et ingens,"['CM', 'DI', 'CF', 'CM', 'CF', 'DI', None]",0,['Mopsus (son of Ampyx)']
1.0,213,concilium. fremere et legem defendere cuncti,213,Concilium. fremere et legem defendere cuncti,"['CM', 'SY', 'CM', 'CM', 'DI', None]",1,['Mopsus (son of Ampyx)']
1.0,214,"hortantur. sic amplexu, sic pectora fratris,",214,"Hortantur. sic amplexu, sic, pectora fratris,","['CM', 'DI', 'CM', 'DI', 'DI', None]",0,['Mopsus (son of Ampyx)']
1.0,215,"Iuno, tene; tuque o puppem ne desere, Pallas:",215,"Iuno, tene, tuque o puppem ne desere, Pallas;","['CF', 'CM', 'SY', 'CM', 'CM', 'DI', 'DI', None]",1,['Mopsus (son of Ampyx)']
1.0,216,nunc patrui nunc flecte minas. cessere ratemque,216,"Nunc patrui, nunc, flecte minas. cessere ratemque","['CM', 'CM', 'DI', 'CF', 'CM', 'CF', None]",0,['Mopsus (son of Ampyx)']
1.0,217,accepere mari. per quot discrimina rerum,217,Accepere mari. per quot discrimina rerum,"['CF', 'CM', 'DI', 'CM', 'DI', None]",0,['Mopsus (son of Ampyx)']
1.0,218,expedior. subita cur pulcher harundine crines,218,Expedior! subita cur pulcher harundine crines,"['CM', 'CM', 'DI', 'CF', 'DI', None]",0,['Mopsus (son of Ampyx)']
0.9333333333333333,219,velat Hylas? unde urna umeris niveosque per artus,219,Velat Hylas? unde urna umeris niueosque per artus,"['CF', 'CM', 'SY', 'SY', 'CM', 'CF', 'DI', None]",2,['Mopsus (son of Ampyx)']
0.8604651162790697,220,"caeruleae vestes? unde haec tibi vulnera, Pollux?",220,"Caeruleae uestes? unde haec tibi uulnera, Pollux?","['CM', 'CM', 'SY', 'CM', 'DI', 'DI', None]",1,['Mopsus (son of Ampyx)']
1.0,221,quantus 10 tumidis taurorum e naribus ignis?,221,Quantus io tumidis taurorum e naribus ignis!,"['CF', 'CM', 'CM', 'SY', 'DI', 'DI', None]",1,['Mopsus (son of Ampyx)']
1.0,222,tollunt se galeae sulcisque ex omnibus hastae,222,Tollunt se galeae sulcisque ex omnibus hastae,"['DI', 'CM', 'CM', 'SY', 'DI', 'DI', None]",1,['Mopsus (son of Ampyx)']
0.9302325581395349,223,et iam iamque umeri. quem circum vellera Martem,223,Et iam iamque umeri. quem circum uellera Martem,"['CM', 'DI', 'SY', 'CM', 'DI', 'DI', 'DI', None]",1,['Mopsus (son of Ampyx)']
1.0,224,aspicio? quaenam aligeris secat anguibus auras,224,Aspicio? quaenam aligeris secat anguibus auras,"['CM', 'SY', 'CM', 'DI', 'DI', None]",1,['Mopsus (son of Ampyx)']
0.9545454545454546,225,"caede madens? quos ense ferit? miser eripe parvos,",225,"Caede madens? quos ense ferit? miser, eripe paruos,","['CF', 'CM', 'DI', 'CF', 'CM', 'DI', 'DI', None]",0,['Mopsus (son of Ampyx)']
1.0,226,Aesonide. cerno et thalamos ardere iugales.',226,"Aesonide. cerno et thalamos ardere iugales.""","['CM', 'SY', 'CM', 'CM', 'CF', None]",1,['Mopsus (son of Ampyx)']
1.0,227,Iamdudum... Minyas ambage ducemque,227,Iamdudum ** Minyas ambage ducemque,"['CM', None, 'CM', 'CM', 'CF']",0,
1.0,228,"terrificat; sed enim contra Phoebeius Idmon,",228,Terrificat; sed enim contra Phoebeius Idmon,"['CM', 'CF', 'CM', 'CM', 'DI', None]",0,
0.9230769230769231,229,"non pallore viris, non ullo horrore comarum",229,"Non pallore uiris, non ullo horrore comarum","['CM', 'CF', 'CM', 'DI', 'SY', 'CF', None]",1,
1.0,230,"terribilis, plenus fatis Phoeboque quieto,",230,"Terribilis, plenus fatis Phoeboque quieto,","['CM', 'CM', 'CM', 'CF', None]",0,
0.9512195121951219,231,cui genitor tribuit monitu praenoscere divum,231,Cui genitor tribuit monitu praenoscere diuum,"['CM', 'CM', 'CM', 'CM', 'DI', None]",0,
1.0,232,"omina, seu flammas seu lubrica comminus exta",232,"Omina, seu flammas seu lubrica comminus exta","['DI', 'CM', 'CM', 'DI', 'DI', 'DI', None]",0,
0.918918918918919,233,"seu plenum certis interroget aera pennis,",233,"Seu plenum certis interroget aera pinnis,","['CM', 'CM', 'CM', 'DI', 'DI', None]",0,
1.0,234,sic sociis Mopsoque canit: 'quantum augur Apollo,234,"Sic sociis Mopsoque canit: ""quantum augur Apollo","['CM', 'CM', 'CF', 'CM', 'SY', 'CF', None]",1,['Idmon']
1.0,235,"flammaque prima docet, praeduri plena laboris",235,"Flammaque prima docet, praeduri plena laboris","['DI', 'CF', 'CM', 'DI', 'CF', None]",0,['Idmon']
0.9347826086956522,236,"cerno equidem, patiens sed quae ratis omnia vincet.",236,"Cerno equidem, patiens sed quae ratis omnia uincet.","['SY', 'CM', 'CM', 'DI', 'CM', 'DI', 'DI', None]",1,['Idmon']
1.0,237,ingentes durate animae dulcesque parentum,237,Ingentes durate animae dulcesque parentum,"['CM', 'SY', 'CM', 'CF', None]",1,['Idmon']
1.0,238,"tendite ad amplexus.' lacrimae cecidere canenti,",238,"Tendite ad amplexus."" lacrimae cecidere canenti","['SY', 'DI', 'CM', 'CM', 'CF', None]",1,['Idmon']
0.8604651162790697,239,quod sibi iam clusos invenit in ignibus Argos.,239,Quod sibi iam clausos inuenit in ignibus Argos.,"['CM', 'DI', 'CM', 'CM', 'CF', 'DI', 'DI', None]",0,
1.0,240,"Vix ea fatus erat, iungit cum talia ductor",240,Vix ea fatus erat iungit cum talia ductor,"['CM', 'DI', 'CF', 'CM', 'CM', 'DI', 'DI', None]",0,
0.918918918918919,241,"Aesonius: 'superum quando consulta videtis,",241,"Aesonius: ""superum quando consulta uidetis,","['CM', 'CM', 'CM', 'CF', None]",0,['Jason']
0.9024390243902439,242,o socii (quantisque datur spes maxima coeptis!),242,"O socii, tantisque datur spes maxima coeptis,","['CM', 'CM', 'CF', 'CM', 'DI', 'DI', None]",0,['Jason']
0.8666666666666667,243,vos quoque nunc vires animosque adferte paternos.,243,Vos quoque nunc uires animosque afferte paternos.,"['CM', 'DI', 'CM', 'CM', 'SY', 'CF', None]",1,['Jason']
1.0,244,non mihi Thessalici pietas culpanda tyranni,244,Non mihi Thessalici pietas culpanda tyranni,"['CM', 'DI', 'CM', 'CM', 'CF', None]",0,['Jason']
0.925,245,"suspective doli: deus haec, deus omine dextro",245,"Suspectiue doli: deus haec, deus, omine dextro","['CF', 'CM', 'DI', 'CM', 'DI', 'DI', None]",0,['Jason']
0.9166666666666666,246,imperat; ipse suo voluit commercia mundo,246,Imperat; ipse suo uoluit commercia mundo,"['DI', 'CF', 'CM', 'CM', 'DI', None]",0,['Jason']
1.0,247,Iuppiter et tantos hominum miscere labores.,247,Iuppiter et tantos hominum miscere labores.,"['DI', 'CM', 'CM', 'CM', 'CF', None]",0,['Jason']
0.8333333333333334,248,"ite, viri, mecum dubiisque evincite rebus,",248,"Ite, uiri, mecum dubiisque euincite rebus","['CF', 'CM', 'CM', 'SY', 'DI', None]",1,['Jason']
0.9347826086956522,249,quae meminisse iuvet nostrisque nepotibus instent.,249,Quae meminisse iuuet nostrisque nepotibus instent.,"['CM', 'CF', 'CM', 'CF', 'DI', None]",0,['Jason']
0.7368421052631579,250,"hanc vero, socii, venientem litore laeti",250,"Hanc uero, socii, uenientem <in> litore laeti","['CM', 'CM', 'CM', 'SY', 'DI', 'DI', None]",1,['Jason']
0.9210526315789473,251,dulcibus adloquiis ludoque educite noctem.',251,"Dulcibus alloquiis ludoque educite noctem.""","['DI', 'CM', 'SY', 'DI', None]",1,['Jason']
0.9166666666666666,252,"paretur. molli iuvenes funduntur in alga,",252,"Paretur. molli iuuenes funduntur in alga,","['CM', 'CM', 'CM', 'CF', 'DI', None]",0,
1.0,253,conspicuusque toris Tirynthius. exta ministri,253,Conspicuusque toris Tirynthius. exta ministri,"['CF', 'CM', 'DI', 'CF', None]",0,
0.9318181818181818,254,rapta simul veribus Cereremque dedere canistris.,254,Rapta simul ueribus Cereremque dedere canistris.,"['CF', 'CM', 'CM', 'CF', 'CF', None]",0,
0.926829268292683,255,Iamque aderat summo decurrens vertice Chiron,255,Iamque aderat summo decurrens uertice Chiron,"['SY', 'CM', 'CM', 'DI', 'DI', None]",1,
1.0,256,clamantemque patri procul ostendebat Achillen.,256,Clamantemque patri procul ostendebat Achillem.,"['CF', 'CM', 'DI', 'CF', None]",0,
0.8787878787878788,257,ut puer ad notas erectum Pelea voces,257,Vt puer ad notas erectum Pelea uoces,"['CM', 'DI', 'CM', 'CM', 'DI', 'DI', None]",0,
1.0,258,"vidit et ingenti tendentem bracchia passu,",258,"Vidit et ingenti tendentem bracchia passu,","['CF', 'DI', 'CM', 'DI', 'DI', None]",0,
0.9117647058823529,259,adsiluit caraque diu cervice pependit.,259,Adsiluit caraque diu ceruice pependit.,"['CM', 'CF', 'CM', 'CF', None]",0,
0.8378378378378378,260,ilium nec valido spumantia pocula Baccho,260,Illum nec ualido spumantia pocula Baccho,"['DI', 'CM', 'CM', 'DI', 'DI', None]",0,
0.925,261,sollicitant veteri nec conspicienda metallo,261,Sollicitant ueteri nec conspicienda metallo,"['CM', 'CM', 'DI', 'CF', None]",0,
1.0,262,signa tenent; stupet in ducibus magnumque sonantes,262,Signa tenent: stupet in ducibus magnumque sonantes,"['CF', 'CM', 'DI', 'CM', 'CM', 'CF', None]",0,
1.0,263,haurit et Herculeo fert comminus ora leoni.,263,Haurit et Herculeo fert comminus ora leoni.,"['CF', 'DI', 'CM', 'DI', 'DI', 'CF', None]",0,
1.0,264,laetus at impliciti Peleus rapit oscula nati,264,Laetus at impliciti Peleus rapit oscula nati,"['CF', 'DI', 'CM', 'CM', 'DI', 'DI', None]",0,
1.0,265,suspiciensque polum 'placido si currere fluctu,265,"Suspiciensque polum ""placido si currere fluctu","['CF', 'CM', 'CM', 'DI', 'DI', None]",0,['Peleus']
0.8461538461538461,266,"Pelea vultis' ait 'ventosque optare ferentes,",266,"Pelea uultis"" ait ""uentosque optare ferentes,","['DI', 'CF', 'CM', 'SY', 'CF', None]",1,['Peleus']
0.868421052631579,267,"hoc, superi, servate caput. tu cetera, Chiron,",267,"Hoc, superi, seruate caput. tu cetera, Chilon,","['CM', 'CM', 'CF', 'CM', 'DI', 'DI', None]",0,['Peleus']
0.925,268,da mihi. te parvus lituos et bella loquentem,268,Da mihi. te paruus lituos et bella loquentem,"['CM', 'DI', 'CM', 'CM', 'CM', 'DI', 'CF', None]",0,['Peleus']
1.0,269,miretur; sub te puerilia tela magistro,269,Miretur; sub te puerilia tela magistro,"['CM', 'DI', 'CM', 'DI', 'CF', None]",0,['Peleus']
0.975,270,senator ferat et nostram festinet ad hastam.',270,"Venator ferat et nostram festinet ad hastam.""","['CM', 'DI', 'CM', 'CM', 'CF', 'DI', None]",0,['Peleus']
0.8571428571428571,271,omnibus inde mero calor additus: ire per altum,271,Omnibus inde uiae calor additus; ire per altum,"['DI', 'CF', 'CM', 'DI', 'DI', 'CF', 'DI', None]",0,
0.926829268292683,272,magna mente volunt. Phrixi promittitur absens,272,Magna mente uolunt. Phrixi promittitur absens,"['DI', 'CF', 'CM', 'CM', 'DI', None]",0,
0.972972972972973,273,yellus et auratis Argo reditura corymbis.,273,Vellus et auratis Argo reditura corymbis.,"['CF', 'DI', 'CM', 'CM', 'CF', None]",0,
1.0,274,Sol ruit et totum Minyis laetantibus undae,274,Sol ruit et totum Minyis laetantibus undae,"['CM', 'DI', 'CM', 'CM', 'CM', 'DI', None]",0,
0.9705882352941176,275,deduxere diem. sparguntur litore curvo,275,Deduxere diem. sparguntur litore curuo,"['CF', 'CM', 'DI', 'DI', None]",0,
1.0,276,lumina nondum ullis terras monstrantia nautis.,276,Lumina nondum ullis terras monstrantia nautis.,"['DI', 'SY', 'CM', 'CM', 'DI', None]",1,
0.8421052631578947,277,Thracius hie noctem dulci testudine vates,277,Thracius hic noctem dulci testudine uates,"['DI', 'CM', 'CM', 'CM', 'DI', None]",0,
0.9285714285714286,278,"extrahit, ut steterit redimitus tempora vittis",278,"Extrahit, ut steterit redimitus tempora uittis","['DI', 'CM', 'CM', 'DI', 'DI', None]",0,
1.0,279,Phrixus et iniustas contectus nubibus aras,279,Phrixus et iniustas contectus nubibus aras,"['CF', 'DI', 'CM', 'DI', 'DI', None]",0,
1.0,280,fugerit Inoo linquens Athamanta Learcho;,280,Fugerit Inoo linquens Athamanta Learcho;,"['DI', 'CM', 'CM', 'CF', None]",0,
0.926829268292683,281,aureus ut iuvenem miserantibus intulit undis,281,Aureus ut iuuenem miserantibus intulit undis,"['DI', 'CM', 'CM', 'DI', 'DI', None]",0,
0.926829268292683,282,vector et adstrictis ut sedit cornibus Helle.,282,Vector et astrictis ut sedit cornibus Helle.,"['CF', 'DI', 'CM', 'DI', 'DI', 'DI', None]",0,
0.9302325581395349,283,septem Aurora vias totidemque peregerat umbras,283,Septem Aurora uias totidemque peregerat umbras,"['SY', 'CF', 'CM', 'CF', 'DI', None]",1,
0.925,284,"Luna polo, dirimique procul non aequore visa",284,"Luna polo, dirimique procul non aequore uisa","['CF', 'CM', 'CF', 'CM', 'DI', 'DI', None]",0,
1.0,285,coeperat a gemina discedere Sestos Abydo.,285,Coeperat a gemina discedere Sestos Abydo.,"['DI', 'CM', 'CM', 'DI', 'CF', None]",0,
0.9210526315789473,286,hic soror Aeoliden aevum mansura per omne,286,Hic soror Aeoliden aeuum mansura per omne,"['CM', 'DI', 'CM', 'CM', 'CF', 'DI', None]",0,
0.8536585365853658,287,"deserit, heu saevae nequiquam erepta novercae.",287,"Deserit, heu saeuae nequiquam erepta nouercae.","['DI', 'CM', 'CM', 'SY', 'CF', None]",1,
1.0,288,illa quidem fessis longe petit umida palmis,288,Illa quidem fessis longe petit umida palmis,"['CF', 'CM', 'CM', 'CM', 'DI', 'DI', None]",0,
0.9230769230769231,289,"vellera, sed bibulas urgenti pondere vestes",289,"Vellera, sed bibulas urgenti pondere uestes","['DI', 'CM', 'CM', 'DI', 'DI', None]",0,
0.8974358974358975,290,unda trahit levique manus labuntur ab auro.,290,Vnda trahit leuique manus labuntur ab auro.,"['CF', 'CM', 'CF', 'CM', 'CF', 'DI', None]",0,
1.0,291,"quis tibi, Phrixe, dolor, rapido cum concitus aestu",291,"Quis tibi, Phrixe, dolor, rapido cum concitus aestu","['CM', 'DI', 'CF', 'CM', 'CM', 'DI', 'DI', None]",0,
0.9210526315789473,292,respiceres miserae clamantia virginis ora,292,Respiceres miserae clamantia uirginis ora,"['CM', 'CM', 'DI', 'DI', None]",0,
1.0,293,extremasque manus sparsosque per aequora crines.,293,Extremasque manus sparsosque per aequora crines!,"['CF', 'CM', 'CF', 'DI', 'DI', None]",0,
1.0,294,"Iamque mero ludoque modus, positique quietis",294,Iamque mero ludoque modus positique quietis,"['CF', 'CM', 'CF', 'CM', 'CF', None]",0,
1.0,295,conticuere toris; solus quibus ordine fusis,295,Conticuere toris; solus quibus ordine fusis,"['CF', 'CM', 'CM', 'DI', 'DI', None]",0,
0.9302325581395349,296,impatiens somni ductor manet. hunc gravis Aeson,296,Impatiens somni ductor manet. hunc grauis Aeson,"['CM', 'CM', 'CM', 'DI', 'CM', 'DI', None]",0,
0.9318181818181818,297,et pariter vigil Alcimede spectantque tenentque,297,Et pariter uigil Alcimede spectantque tenentque,"['CM', 'CM', 'DI', 'CM', 'CF', None]",0,
1.0,298,pleni oculos. illis placidi sermonis Iason,298,Pleni oculos. illis placidi sermonis Iason,"['SY', 'CM', 'CM', 'CM', 'CF', None]",1,
0.9230769230769231,299,suggerit adfatus turbataque pectora mulcet.,299,Suggerit affatus turbataque pectora mulcet.,"['DI', 'CM', 'DI', 'DI', None]",0,
0.85,300,"mox, ubi victa gravi ceciderunt lumina somno,",300,Mox ubi uicta graui ceciderunt lumina somno,"['CM', 'DI', 'CF', 'CM', 'DI', 'DI', None]",0,
1.0,301,visa coronatae fulgens tutela carinae,301,Visa coronatae fulgens tutela carinae,"['CF', 'CM', 'CM', 'CF', None]",0,
1.0,302,vocibus his instare duci: 'Dodonida quercum,302,"Vocibus his instare duci: ""Dodonida quercum","['DI', 'CM', 'CF', 'CM', 'DI', None]",0,['Argo']
0.8837209302325582,309,"dixerat. ille pavens, laeto quamquam omine divum,",309,"Dixerat. ille pauens, laeto quamquam omine diuum,","['DI', 'CF', 'CM', 'CM', 'SY', 'DI', None]",1,
0.9024390243902439,310,prosiluit stratis. Minyas simul optulit omnis,310,Prosiluit stratis. Minyas simul obtulit omnes,"['CM', 'CM', 'CM', 'DI', 'DI', None]",0,
0.9230769230769231,311,alma novo crispans pelagus Tithonia Phoebo.,311,Alma nouo crispans pelagus Tithonia Phoebo.,"['CF', 'CM', 'CM', 'CM', 'DI', None]",0,
1.0,312,discurrunt transtris: hi celso cornua malo,312,Discurrunt transtris; hi celso cornua malo,"['CM', 'CM', 'DI', 'DI', 'DI', None]",0,
1.0,313,"expediunt, alii tonsas in marmore summo",313,"Expediunt, alii tonsas in marmore summo","['CM', 'CM', 'CM', 'DI', 'DI', None]",0,
1.0,314,"praetemptant, prora funem legit Argus ab alta.",314,"Praetemptant, prora funem legit Argus ab alta.","['CM', 'CM', 'CM', 'DI', 'CF', 'DI', None]",0,
1.0,315,Increscunt matrum gemitus et fortia languent,315,Increscunt matrum gemitus et fortia languent,"['CM', 'CM', 'CM', 'DI', 'DI', None]",0,
1.0,316,corda patrum; longis flentes amplexibus haerent.,316,Corda patrum; longis flentes amplexibus haerent.,"['CF', 'CM', 'CM', 'CM', 'DI', None]",0,
0.9090909090909091,317,vox tamen Alcimedes planctus super eminet omnis.,317,Vox tamen Alcimedes planctus supereminet omnes.,"['CM', 'DI', 'CM', 'CM', 'DI', None]",0,
0.9285714285714286,318,"femineis tantum illa furens ululatibus opstat,",318,Femineis tantum illa furens ululatibus obstat,"['CM', 'SY', 'CF', 'CM', 'DI', None]",1,
1.0,319,"obruat Idaeam quantum tuba Martia buxum,",319,Obruat Idaeam quantum tuba Martia buxum,"['DI', 'CM', 'CM', 'DI', 'DI', None]",0,
1.0,320,"fatur et haec: 'nate indignos aditure labores,",320,"Fatur et haec: ""nate indignos aditure labores,","['CF', 'DI', 'CM', 'SY', 'CM', 'CF', None]",1,['Alcimede']
0.925,321,dividimur; nec ad hos animum componere casus,321,Diuidimur; nec ad hos animum componere casus,"['CM', 'CF', 'DI', 'CM', 'CM', 'DI', None]",0,['Alcimede']
1.0,322,"ante datum, sed bella tibi terrasque timebam.",322,"Ante datum, sed bella tibi terrasque timebam.","['CF', 'CM', 'DI', 'CF', 'CM', 'CF', None]",0,['Alcimede']
1.0,323,vota aliis facienda deis. si fata reducunt,323,Vota aliis facienda deis. si fata reducunt,"['SY', 'CM', 'CF', 'CM', 'DI', 'CF', None]",1,['Alcimede']
1.0,324,"te mihi, si trepidis placabile matribus aequor,",324,"Te mihi, si trepidis placabile matribus aequor,","['CM', 'DI', 'CM', 'CM', 'DI', 'DI', None]",0,['Alcimede']
1.0,325,possum equidem lucemque pati longumque timorem.,325,Possum equidem lucemque pati longumque timorem.,"['SY', 'CM', 'CF', 'CM', 'CF', None]",1,['Alcimede']
1.0,326,"sin aliud Fortuna parat, miserere parentum,",326,"Sin aliud fortuna parat, miserere parentum,","['CM', 'CM', 'CF', 'CM', 'CF', None]",0,['Alcimede']
1.0,327,"Mors bona, dum metus est nec adhuc dolor. ei mihi, Colchos",327,"Mors bona, dum metus est nec adhuc dolor. ei mihi, Colchos","['CM', 'DI', 'CM', 'DI', 'CM', 'CF', 'CM', 'DI', 'CM', 'DI', None]",0,['Alcimede']
0.825,328,unde ego et avecti timuissem vellera Phrixi?,328,Vnde ego et auecti timuissem uellera Phrixi?,"['SY', 'SY', 'DI', 'CM', 'DI', 'DI', None]",2,['Alcimede']
0.9285714285714286,329,"quos iam mente dies, quam saeva insomnia curis",329,"Quos iam mente dies, quam saeua insomnia curis","['CM', 'DI', 'CF', 'CM', 'DI', 'SY', 'DI', None]",1,['Alcimede']
1.0,330,prospicio. quotiens raucos ad litoris ictus,330,Prospicio! quotiens raucos ad litoris ictus,"['CM', 'CM', 'CM', 'DI', 'DI', None]",0,['Alcimede']
