comp,perseus_n,perseus_text,pc_n,pc_text,pc_bounds,elision,speaker
1.0,331,deficiam Scythicum metuens pontumque polumque,331,Deficiam Scythicum metuens pontumque polumque,"['CM', 'CM', 'CM', 'CF', None]",0,['Alcimede']
1.0,332,nec de te credam nostris ingrata serenis.,332,Nec de te credam nostris ingrata serenis!,"['CM', 'DI', 'CM', 'CM', 'CM', 'CF', None]",0,['Alcimede']
0.926829268292683,333,"da, precor, amplexus haesuraque verba relinque",333,"Da, precor, amplexus haesuraque uerba relinque","['CM', 'DI', 'CM', 'DI', 'CF', None]",0,['Alcimede']
1.0,334,auribus et dulci iam nunc preme lumina dextra.',334,"Auribus et dulci iam nunc preme lumina dextra.""","['DI', 'CM', 'CM', 'DI', 'CM', 'DI', 'DI', None]",0,['Alcimede']
1.0,335,talibus Alcimede maeret; sed fortior Aeson,335,Talibus Alcimede maeret; sed fortior Aeson,"['DI', 'CM', 'CM', 'DI', 'DI', None]",0,
1.0,336,"attollens dictis animos: 'o si mihi sanguis,",336,"Attollens dictis animos ""o si mihi sanguis","['CM', 'CM', 'CM', 'DI', 'CM', 'DI', None]",0,['Aeson']
1.0,337,"quantus erat, cum signiferum cratera minantem",337,Quantus erat cum signiferum cratera minantem,"['CF', 'CM', 'DI', 'CM', 'CF', None]",0,['Aeson']
0.9285714285714286,338,"non leviore Pholum manus haec compescuit auro,",338,Non leuiore Pholum manus haec compescuit auro!,"['CM', 'CF', 'CM', 'DI', 'CM', 'DI', None]",0,['Aeson']
1.0,339,primus in aeratis posuissem puppibus arma,339,Primus in aeratis posuissem puppibus arma,"['CF', 'DI', 'CM', 'DI', 'DI', None]",0,['Aeson']
1.0,340,concussoque ratem gauderem tollere remo.,340,Concussoque ratem gauderem tollere remo.,"['CF', 'CM', 'DI', 'DI', None]",0,['Aeson']
0.925,341,sed patriae valuere preces auditaque magnis,341,Sed patriae ualuere preces auditaque magnis,"['CM', 'CM', 'CF', 'CM', 'DI', None]",0,['Aeson']
0.925,342,vota deis: video nostro tot in aequore reges,342,Vota deis: uideo nostro tot in aequore reges,"['CF', 'CM', 'CM', 'CM', 'CF', 'DI', 'DI', None]",0,['Aeson']
1.0,343,"teque ducem. tales, tales ego ducere suetus",343,"Teque ducem. tales, tales ego ducere suetus","['CF', 'CM', 'CM', 'CM', 'DI', 'DI', None]",0,['Aeson']
1.0,344,"atque sequi. nunc ille dies (det Iuppiter oro),",344,"Atque sequi. nunc ille dies (det Iuppiter oro),","['CF', 'CM', 'DI', 'CF', 'CM', 'DI', 'DI', None]",0,['Aeson']
1.0,345,"ille super, quo te Scythici regisque marisque",345,Ille super quo te Scythici regisque marisque,"['CF', 'CM', 'DI', 'CM', 'CM', 'CF', None]",0,['Aeson']
0.926829268292683,346,victorem atque umeros ardentem vellere rapto,346,Victorem atque umeros ardentem uellere rapto,"['SY', 'SY', 'CM', 'DI', 'DI', None]",2,['Aeson']
0.8205128205128205,347,accipiam cedamque tuae mea facta iuventae.',347,"Accipiam cedantque tuae mea facta iuuentae.""","['CM', 'CF', 'CM', 'DI', 'CF', None]",0,['Aeson']
0.9210526315789473,348,sic ait. ille suo conlapsam pectore matrem,348,Sic ait. ille suo collapsam pectore matrem,"['CM', 'DI', 'CF', 'CM', 'DI', 'DI', None]",0,
0.918918918918919,349,sustinuit magnaque senem cervice recepit.,349,Sustinuit magnaque senem ceruice recepit.,"['CM', 'CF', 'CM', 'CF', None]",0,
0.9772727272727273,350,Et iam finis erat. Zephyrumque ratemque morantis,350,Et iam finis erat. Zephyrumque ratemque morantes,"['CM', 'DI', 'CF', 'CM', 'CF', 'CF', None]",0,
0.9230769230769231,351,solverat amplexus tristi tuba tertia signo.,351,Soluerat amplexus tristi tuba tertia signo.,"['DI', 'CM', 'CM', 'DI', 'DI', None]",0,
0.9333333333333333,352,"dant remo sua quisque viri, dant nomina transtris.",352,"Dant remo sua quisque uiri, dant nomina transtris.","['CM', 'CM', 'DI', 'CF', 'CM', 'DI', 'DI', None]",0,
0.9047619047619048,353,"hinc laevom Telamon pelagus tenet, altior inde",353,"Hinc laeuum Telamon pelagus tenet, altior inde","['CM', 'CM', 'CM', 'CM', 'DI', 'DI', None]",0,
1.0,354,"occupat Alcides aliud mare, cetera pubes",354,"Occupat Alcides aliud mare, cetera pubes","['DI', 'CM', 'CM', 'DI', 'DI', None]",0,
0.926829268292683,355,"dividitur: celer Asterion, quem matre cadentem",355,"Diuiditur. celer Asterion, quem matre cadentem","['CM', 'DI', 'CM', 'DI', 'CF', None]",0,
0.8648648648648649,356,"Piresius gemino fovit pater amne Cometes,",356,"Peresius gemino fouit pater amne Cometes,","['CM', 'CM', 'CM', 'DI', 'CF', None]",0,
0.918918918918919,357,segnior Apidani vires ubi sentit Enipeus.,357,"Segnior Apidani uires ubi sentit Enipeus,","['DI', 'CM', 'CM', 'DI', 'CF', None]",0,
1.0,358,nititur hinc Talaus fratrisque Leodocus urget,358,Nititur hinc Talaus fratrisque Leodocus urget,"['DI', 'CM', 'CM', 'CF', 'DI', None]",0,
1.0,359,"remo terga sui, quos nobile contulit Argos.",359,"Remo terga sui, quos nobile contulit Argos.","['DI', 'CF', 'CM', 'DI', 'DI', 'DI', None]",0,
0.9347826086956522,360,hinc quoque missus adest quamvis arcentibus Idmon,360,Hinc quoque missus adest quamuis arcentibus Idmon,"['CM', 'DI', 'CF', 'CM', 'CM', 'DI', None]",0,
0.9166666666666666,361,alitibus; sed turpe viro timuisse futura.,361,Alitibus; sed turpe uiro timuisse futura.,"['CM', 'DI', 'CF', 'CM', 'CF', None]",0,
1.0,362,hic et Naubolides tortas consurgit in undas,362,Hic et Naubolides tortas consurgit in undas,"['CM', 'DI', 'CM', 'CM', 'CF', 'DI', None]",0,
1.0,363,"Iphitus, hic patrium frangit Neptunius aequor",363,"Iphitus, hic patrium frangit Neptunius aequor","['DI', 'CM', 'CM', 'CM', 'DI', None]",0,
1.0,364,qui tenet undisonam Psamathen semperque patentem,364,Qui tenet undisonam Psamathen semperque patentem,"['CM', 'DI', 'CM', 'CM', 'CF', None]",0,
1.0,365,"Taenaron Euphemus, mollique a litore Pellae",365,"Taenaron Euphemus, mollique a litore Pellae","['DI', 'CM', 'SY', 'DI', 'DI', None]",1,
1.0,366,Deucalion certus iaculis et comminus ense,366,Deucalion certus iaculis et comminus ense,"['CM', 'CM', 'CM', 'DI', 'DI', None]",0,
1.0,367,"nobilis Amphion, pariter quos edidit Hypso",367,"Nobilis Amphion, pariter quos edidit Hypso","['DI', 'CM', 'CM', 'DI', 'DI', None]",0,
0.775,368,nec potuit similes voluitve ediscere vultus.,368,Nec potuit similes uoluitue ediscere uultus.,"['CM', 'CM', 'CM', 'SY', 'DI', None]",1,
0.9230769230769231,369,tum valida Clymenus percusso pectore tonsa,369,Tum ualida Clymenus percusso pectore tonsa,"['CM', 'CM', 'CM', 'DI', 'DI', None]",0,
0.9767441860465116,370,"frater et Iphiclus puppem trahit, et face saeva",370,"Frater et Iphiclus puppem trahit, et face saeua","['CF', 'DI', 'CM', 'CM', 'DI', 'CM', 'DI', None]",0,
1.0,371,"in tua mox Danaos acturus saxa, Caphereu,",371,"In tua mox Danaos acturus saxa, Caphereu,","['CM', 'DI', 'CM', 'CM', 'DI', 'CF', None]",0,
0.875,372,"Nauplius, et tortum non a love fulmen Oileus",372,"Nauplius, et tortum non a Ioue fulmen Oileus","['DI', 'CM', 'CM', 'DI', 'CM', 'DI', 'CF', None]",0,
1.0,373,"qui gemet, Euboicas nato stridente per undas,",373,"Qui gemet Euboicas nato stridente per undas,","['CM', 'DI', 'CM', 'CM', 'CF', 'DI', None]",0,
1.0,374,quique Erymanthei sudantem pondere monstri,374,Quique Erymanthei sudantem pondere monstri,"['SY', 'CM', 'DI', 'DI', None]",1,
1.0,375,Amphitryoniaden Tegeaeo limine Cepheus,375,Amphitryoniaden Tegeaeo limine Cepheus,"['CM', 'DI', 'DI', None]",0,
0.925,376,"iuvit, et Amphidamas (at frater plenior actis",376,"Iuuit, et Amphidamas (at frater plenior actis","['CF', 'DI', 'CM', 'DI', 'DI', 'DI', None]",0,
0.9142857142857143,377,maluit Ancaeo vellus contingere Phrixi),377,"Maluit Ancaeo uellus contingere Phrixi),","['DI', 'CM', 'CM', 'DI', None]",0,
0.918918918918919,378,"tectus et Eurytion servato colla capillo,",378,Tectus et Eurytion seruato colla capillo,"['CF', 'DI', 'CM', 'DI', 'CF', None]",0,
1.0,379,quem pater Aonias reducem tondebit ad aras.,379,Quem pater Aonias reducem tondebit ad aras.,"['CM', 'DI', 'CM', 'CM', 'CF', 'DI', None]",0,
1.0,380,"te quoque Thessalicae, Nestor, rapit in freta puppis",380,"Te quoque Thessalicae, Nestor, rapit in freta puppis","['CM', 'DI', 'CM', 'CM', 'DI', 'CM', 'DI', None]",0,
0.9117647058823529,381,"fama, Mycenaeis olim qui candida velis",381,"Fama, Mycenaeis olim qui candida uelis","['CF', 'CM', 'CM', 'DI', 'DI', None]",0,
0.7857142857142857,382,aequora et instantes mirabere mille magistros.,382,Aequora nec nantes mirabere mille magistros.,"['DI', 'CM', 'CM', 'DI', 'CF', None]",0,
0.85,383,hic vates Phoebique fides non vana parentis,383,Hic uates Phoebique fides non uana parentis,"['CM', 'CM', 'CF', 'CM', 'DI', 'CF', None]",0,
1.0,384,"Mopsus, puniceo cui circumfusa cothurno",384,"Mopsus, puniceo cui circumfusa cothurno","['DI', 'CM', 'DI', 'CF', None]",0,
0.9285714285714286,385,palla imos ferit alba pedes vittataque fronte,385,Palla imos ferit alba pedes uittataque fronte,"['SY', 'CM', 'DI', 'CF', 'CM', 'DI', None]",1,
1.0,386,cassis et in summo laurus Peneia cono.,386,Cassis et in summo laurus Peneia cono.,"['CF', 'DI', 'CM', 'CM', 'CM', 'DI', None]",0,
1.0,387,quin etiam Herculeo consurgit ab ordine Tydeus,387,Quin etiam Herculeo consurgit ab ordine Tydeus,"['CM', 'SY', 'CM', 'CF', 'DI', 'DI', None]",1,
0.9230769230769231,388,"Nelidesque Periclymenus, quem parva Methone",388,"Nelidesque Periclymenus, quem parua Methone","['CF', 'CM', 'DI', 'CF', None]",0,
0.8780487804878049,389,†felevis Elis equis et fluctibus obvius Aulon,389,*feleuis* Elis equis et fluctibus obuius Aulon,"['DI', 'CF', 'CM', 'DI', 'DI', 'DI', None]",0,
0.775,390,caestibus adversos viderunt frangere vultus. —,390,Caestibus aduersos uiderunt frangere uultus.,"['DI', 'CM', 'DI', 'DI', None]",0,
1.0,391,"Tu quoque Phrixeos remo, Poeantie, Colchos",391,"Tu quoque Phrixeos remo, Poeantie, Colchos","['CM', 'DI', 'CM', 'CM', 'DI', None]",0,
0.925,392,"bis Lemnon visure petis, nunc cuspide patris",392,"Bis Lemnon uisure petis, nunc cuspide patris","['CM', 'CM', 'CF', 'CM', 'DI', 'DI', None]",0,
0.8648648648648649,393,"inclitus, Herculeas olim moture sagittas.",393,"Inclitus, Herculeas olim torture sagittas.","['DI', 'CM', 'CM', 'CF', None]",0,
0.9210526315789473,394,proximus hinc Butes Actaeis dives ab oris;,394,Proximus hinc Butes Actaeis diues ab oris;,"['DI', 'CM', 'CM', 'DI', 'CF', 'DI', None]",0,
1.0,395,innumeras nam claudit apes longaque superbus,395,Innumeras nam claudit apes longaque superbus,"['CM', 'DI', 'CF', 'CM', 'CF', None]",0,
1.0,396,"fuscat nube diem, dum plenas nectare cellas",396,Fuscat nube diem dum plenas nectare cellas,"['DI', 'CF', 'CM', 'DI', 'DI', 'DI', None]",0,
1.0,397,pandit et in dulcem reges dimittit Hymetton.,397,Pandit et in dulcem reges dimittit Hymetton.,"['CF', 'DI', 'CM', 'CM', 'CM', 'CF', None]",0,
1.0,398,"insequeris casusque tuos expressa, Phalere,",398,"Insequeris casusque tuos expressa, Phalere,","['CM', 'CF', 'CM', 'CF', None]",0,
0.8048780487804879,399,arma geris; patula nam lapsus ab arbore parvum,399,Arma geris; *uacua* nam lapsus ab arbore paruum,"['CF', 'CM', 'CM', 'DI', 'CF', 'DI', 'DI', None]",0,
0.9230769230769231,400,te quater ardenti tergo circumvenit anguis:,400,"Te quater ardenti tergo circumuenit anguis,","['CM', 'DI', 'CM', 'CM', 'DI', None]",0,
1.0,401,stat procul intendens dubium pater anxius arcum.,401,Stat procul intendens dubium pater anxius arcum.,"['CM', 'DI', 'CM', 'CM', 'DI', 'DI', None]",0,
0.9024390243902439,402,tune caelata metus alios gerit arma Eribotes,402,Tum caelata metus alios gerit arma Eribotes.,"['CM', 'CF', 'CM', 'CM', 'DI', 'SY', None]",1,
0.9736842105263158,403,nec Peleus fretus soceris et coniuge diva,403,Nec Peleus fretus soceris et coniuge diua,"['CM', 'CM', 'CM', 'CM', 'DI', 'DI', None]",0,
1.0,404,"defuit, ac prora splendet tua cuspis ab alta,",404,"Defuit, ac prora splendet tua cuspis ab alta,","['DI', 'CM', 'CM', 'CM', 'DI', 'CF', 'DI', None]",0,
1.0,405,"Aeacide: tantum haec aliis excelsior hastis,",405,Aeacide; tantum haec aliis excelsior hastis,"['CM', 'SY', 'CM', 'CM', 'DI', None]",1,
0.8421052631578947,406,quantum Peliacas in vertice vicerat ornos.,406,Quantum Peliacas in uertice uicerat ornos.,"['DI', 'CM', 'DI', 'DI', 'DI', None]",0,
1.0,407,"linquit et Actorides natum Chironis in antro,",407,Linquit et Actorides natum Chironis in antro,"['CF', 'DI', 'CM', 'CM', 'CF', 'DI', None]",0,
0.972972972972973,408,ut socius caro pariter meditetur Achilli,408,Vt socius caro pariter meditetur Achilli,"['CM', 'CM', 'CM', 'CM', 'CF', None]",0,
0.9318181818181818,409,"fila lyrae pariterque leves puer incitet hastas, ...",409,Fila lyrae pariterque leues puer incitet hastas,"['CF', 'CM', 'CF', 'CM', 'DI', 'DI', None]",0,
1.0,410,discat eques placidi conscendere terga magistri ...,410,Discat eques placidi conscendere terga magistri,"['CF', 'CM', 'CM', 'DI', 'CF', None]",0,
1.0,411,et quem fama genus non est decepta Lyaei,411,Et quem fama genus non est decepta Lyaei,"['CM', 'DI', 'CF', 'CM', 'DI', 'CM', 'CF', None]",0,
0.9210526315789473,412,Phlias immissus patrios de vertice crines.,412,Phlias immissus patrios de uertice crines.,"['DI', 'CM', 'CM', 'DI', 'DI', None]",0,
1.0,413,"nec timet Ancaeum genetrix committere ponto,",413,Nec timet Ancaeum genetrix committere ponto,"['CM', 'DI', 'CM', 'CM', 'DI', None]",0,
1.0,414,plena tulit quem rege maris. securus in aequor,414,Plena tulit quem rege maris. securus in aequor,"['CF', 'CM', 'DI', 'CF', 'CM', 'CF', 'DI', None]",0,
0.9210526315789473,415,"haut minus Erginus, proles Neptunia, fertur,",415,"Haud minus Erginus, proles Neptunia, fertur","['CM', 'DI', 'CM', 'CM', 'DI', None]",0,
1.0,416,"qui maris insidias, clarae qui sidera noctis",416,"Qui maris insidias, clarae qui sidera noctis","['CM', 'DI', 'CM', 'CM', 'DI', 'DI', None]",0,
1.0,417,"norit et e clausis quem destinet Aeolus antris,",417,Norit et e clausis quem destinet Aeolus antris,"['CF', 'DI', 'CM', 'CM', 'DI', 'DI', 'DI', None]",0,
1.0,418,"non metuat cui regna ratis, cui tradere caelum",418,"Non metuat cui regna ratis, cui tradere caelum","['CM', 'CM', 'DI', 'CF', 'CM', 'DI', 'DI', None]",0,
0.9166666666666666,419,adsidua Tiphys vultum lassatus ab Arcto.,419,Adsidua Tiphys uultum lassatus ab Arcto.,"['CM', 'CM', 'CM', 'CF', 'DI', None]",0,
0.925,420,taurea vulnifico portat celer aspera plumbo,420,Taurea uulnifico portat celer aspera plumbo,"['DI', 'CM', 'CM', 'DI', 'DI', None]",0,
0.8636363636363636,421,"terga Lacon, saltem in vacuos ut bracchia ventos",421,Terga Lacon saltem in uacuos ut bracchia uentos,"['CF', 'CM', 'SY', 'CM', 'CM', 'DI', 'DI', None]",1,
1.0,422,spargat et Oebalium Pagaseia puppis alumnum,422,Spargat et Oebalium Pagaseia puppis alumnum,"['CF', 'DI', 'CM', 'DI', 'CF', None]",0,
1.0,423,spectet securo celebrantem litora ludo.,423,Spectet securo celebrantem litora ludo;,"['DI', 'CM', 'DI', 'DI', None]",0,
1.0,424,oraque Thessalico melior contundere freno,424,Oraque Thessalico melior contundere freno,"['DI', 'CM', 'CM', 'DI', None]",0,
0.926829268292683,425,"vectorem pavidae Castor dum quaereret Helles,",425,Vectorem pauidae Castor dum quaereret Helles,"['CM', 'CM', 'CM', 'DI', 'DI', None]",0,
1.0,426,passus Amyclaea pinguescere Cyllaron herba.,426,Passus Amyclaea pinguescere Cyllaron herba.,"['CF', 'CM', 'DI', 'DI', None]",0,
1.0,427,illis Taenario pariter tremit ignea fuco,427,Illis Taenario pariter tremit ignea fuco,"['DI', 'CM', 'CM', 'DI', 'DI', None]",0,
1.0,428,"purpura, quod gemina mater spectabile tela",428,"Purpura, quod gemina mater spectabile tela","['DI', 'CM', 'CM', 'CM', 'DI', None]",0,
0.9230769230769231,429,duxit opus; bis Taygeton silvasque comantes,429,Duxit opus; bis Taygeton siluasque comantes,"['CF', 'CM', 'DI', 'CM', 'CF', None]",0,
1.0,430,"struxerat, Eurotan molli bis fuderat auro;",430,"Struxerat, Eurotan molli bis fuderat auro;","['DI', 'CM', 'CM', 'DI', 'DI', None]",0,
0.926829268292683,431,quemque suus sonipes niveo de stamine portat,431,Quemque suus sonipes niueo de stamine portat,"['CF', 'CM', 'CM', 'CM', 'DI', 'DI', None]",0,
0.9230769230769231,432,et volat amborum patrius de pectore cycnus.,432,Et uolat amborum patrius de pectore cycnus.,"['CM', 'DI', 'CM', 'CM', 'DI', 'DI', None]",0,
0.8461538461538461,433,at tibi collectas solvit iam fibula vestes,433,At tibi collectas soluit iam fibula uestes,"['CM', 'DI', 'CM', 'CM', 'DI', 'DI', None]",0,
1.0,434,ostenditque umeros fortes spatiumque superbi,434,Ostenditque umeros fortes spatiumque superbi,"['SY', 'CM', 'CM', 'CF', None]",1,
1.0,435,"pectoris Herculeis aequum, Meleagre, lacertis.",435,"Pectoris Herculeis aequum, Meleagre, lacertis.","['DI', 'CM', 'CM', 'CF', None]",0,
0.926829268292683,436,"hinc numerosa phalanx, proles Cyllenia: certus",436,"Hic numerosa phalanx, proles Cyllenia: certus","['CM', 'CF', 'CM', 'CM', 'DI', None]",0,
0.9230769230769231,437,Aethalides subitas nervo redeunte sagittas,437,Aethalides subitas neruo redeunte sagittas,"['CM', 'CM', 'CM', 'CF', None]",0,
1.0,438,"cogere; tu medios gladio bonus ire per hostes,",438,"Cogere; tu medios gladio bonus ire per hostes,","['DI', 'CM', 'CM', 'CM', 'DI', 'CF', 'DI', None]",0,
1.0,439,"Euryte; nec patrio Minyis ignobilis usu,",439,Euryte; nec patrio Minyis ignobilis usu,"['DI', 'CM', 'CM', 'CM', 'DI', None]",0,
0.926829268292683,440,"nuntia verba ducis populis qui reddit, Echion.",440,Nuntia uerba ducis populis qui reddit Echion.,"['DI', 'CF', 'CM', 'CM', 'DI', 'CF', None]",0,
1.0,441,"sed non, Iphi, tuis Argo reditura lacertis",441,"Sed non, Iphi, tuis Argo reditura lacertis","['CM', 'DI', 'CF', 'CM', 'CM', 'CF', None]",0,
0.9090909090909091,442,heu celerem Scythica te maesta relinquet harena,442,Heu cinerem Scythica te maesta relinquet harena,"['CM', 'CM', 'CM', 'DI', 'CF', 'CF', None]",0,
0.8947368421052632,443,cessantemque tuo lugebit in ordine remum.,443,Cessantemque tuum lugebit in ordine remum.,"['CF', 'CM', 'CF', 'DI', 'DI', None]",0,
1.0,444,te quoque dant campi tanto pastore Pheraei,444,Te quoque dant campi tanto pastore Pheraei,"['CM', 'DI', 'CM', 'CM', 'CM', 'CF', None]",0,
0.9444444444444444,445,"felices, Admete; tuis nam pendit in arvis",445,"Felices, Admete; tuis nam pendit in aruis","['CM', 'CF', 'CM', 'DI', 'CF', 'DI', None]",0,
1.0,446,"Delius, ingrato Steropen quod fuderat arcu.",446,Delius ingrato Steropen quod fuderat arcu.,"['DI', 'CM', 'CM', 'DI', 'DI', None]",0,
0.8717948717948718,447,a quotiens famulo notis soror obvia silvis,447,A quotiens famulo notis soror obuia siluis,"['CM', 'CM', 'CM', 'CM', 'DI', 'DI', None]",0,
0.925,448,"flevit, ubi Ossaeae captaret frigora quercus",448,Fleuit ubi Ossaeae captaret frigora quercus,"['CF', 'SY', 'CM', 'DI', 'DI', None]",1,
1.0,449,perderet et pingui miseros Boebeide crines.,449,Perderet et pingui miseros Boebeide crines!,"['DI', 'CM', 'CM', 'CM', 'DI', None]",0,
0.9166666666666666,450,insurgit transtris et remo Nerea versat,450,Insurgit transtris et remo Nerea uersat,"['CM', 'CM', 'DI', 'DI', 'DI', None]",0,
0.85,451,"Canthus, in Aeaeo volvet quem barbara cuspis",451,"Canthus, in Aeaeo uoluet quem barbara cuspis","['CF', 'DI', 'CM', 'CM', 'DI', 'DI', None]",0,
0.926829268292683,452,"pulvere; at interea clari decus adiacet orbis,",452,Puluere; at interea clari decus adiacet orbis,"['SY', 'DI', 'CM', 'CM', 'DI', 'DI', None]",1,
1.0,453,quem genitor gestabat Abas: secat aurea fluctu,453,Quem genitor gestabat Abas (secat aurea fluctu,"['CM', 'CM', 'CF', 'CM', 'DI', 'DI', None]",0,
1.0,454,"tegmina Chalcidicas fugiens Euripus harenas,",454,Tegmina Chalcidicas fugiens Euripus harenas,"['DI', 'CM', 'CM', 'CF', None]",0,
1.0,455,celsaque semiferum contorquens frena luporum,455,Celsaque semiferum contorquens frena luporum,"['DI', 'CM', 'DI', 'CF', None]",0,
0.925,456,"surgis ab ostrifero medius, Neptune, Geraesto.",456,"Surgis ab ostrifero medius, Neptune, Gerasto).","['CF', 'DI', 'CM', 'CM', 'CF', None]",0,
0.9166666666666666,457,"at tibi Palladia pinu, Polypheme, revecto",457,"At tibi Palladia pinu, Polypheme, reuecto","['CM', 'DI', 'CM', 'CM', 'CF', None]",0,
0.926829268292683,458,ante urbem ardentis restat deprendere patris,458,Ante urbem ardentes restat deprendere patris,"['SY', 'SY', 'CM', 'CM', 'DI', None]",2,
1.0,459,"reliquias, multum famulis pia iusta moratis,",459,"Reliquias, multum famulis pia iusta moratis","['CM', 'CM', 'CM', 'DI', 'CF', None]",0,
0.8421052631578947,460,si venias. breviore petit iam caerula remo,460,Si uenias. breuiore petit iam caerula remo,"['CM', 'CM', 'CF', 'CM', 'DI', 'DI', None]",0,
0.9285714285714286,461,occupat et longe sua transtra novissimus Idas.,461,Occupat et longe sua transtra nouissimus Idas.,"['DI', 'CM', 'CM', 'DI', 'CF', 'DI', None]",0,
0.8421052631578947,462,"at frater magnos Lynceus servatur in usus,",462,"At frater magnos Lynceus seruatus in usus,","['CM', 'CM', 'CM', 'CM', 'CF', 'DI', None]",0,
1.0,463,"quem tulit Arene, possit qui rumpere terras",463,"Quem tulit Arene, possit qui rumpere terras","['CM', 'DI', 'CM', 'CM', 'DI', 'DI', None]",0,
0.925,464,et Styga transmisso tacitam deprendere visu.,464,Et Styga transmisso tacitam deprendere uisu.,"['CM', 'DI', 'CM', 'CM', 'DI', None]",0,
1.0,465,fluctibus e mediis terras dabit ille magistro,465,Fluctibus e mediis terras dabit ille magistro,"['DI', 'CM', 'CM', 'CM', 'DI', 'CF', None]",0,
1.0,466,"et dabit astra rati, cumque aethera Iuppiter umbra",466,"Et dabit astra rati, cumque aethera Iuppiter umbra","['CM', 'DI', 'CF', 'CM', 'SY', 'DI', 'DI', None]",1,
1.0,467,"perdiderit, solus transibit nubila Lynceus.",467,Perdiderit solus transibit nubila Lynceus.,"['CM', 'CM', 'DI', 'DI', None]",0,
0.918918918918919,468,"quin et Cecropiae proles vacat Orithyiae,",468,Quin et Cecropiae proles uacat Orithyiae,"['CM', 'DI', 'CM', 'CM', 'DI', None]",0,
1.0,469,temperet ut tremulos Zetes fraterque ceruchos.,469,Temperet ut tremulos Zetes fraterque ceruchos.,"['DI', 'CM', 'CM', 'CM', 'CF', None]",0,
0.9302325581395349,470,nec vero Odrysius transtris impenditur Orpheus,470,Nec uero Odrysius transtris impenditur Orpheus,"['CM', 'SY', 'CM', 'CM', 'DI', None]",1,
1.0,471,"aut pontum remo subigit, sed carmine tonsas",471,"Aut pontum remo subigit, sed carmine tonsas","['CM', 'CM', 'CM', 'CM', 'DI', 'DI', None]",0,
1.0,472,"ire docet, summo passim ne gurgite pugnent.",472,Ire docet summo passim ne gurgite pugnent.,"['CF', 'CM', 'CM', 'CM', 'DI', 'DI', None]",0,
0.925,473,donat et Iphiclo pelagus iuvenumque labores,473,Donat et Iphiclo pelagus iuuenumque labores,"['CF', 'DI', 'CM', 'CM', 'CF', None]",0,
0.9743589743589743,474,"Aesonides, fessum Phylace quem miserat aevo",474,"Aesonides, fessum Phylace quem miserat aeuo","['CM', 'CM', 'CM', 'DI', 'DI', None]",0,
1.0,475,"non iam operum in partem, monitus sed tradat ut acres",475,"Non iam operum in partem, monitus sed tradat ut acres","['CM', 'SY', 'SY', 'CM', 'CM', 'CM', 'DI', 'CF', 'DI', None]",2,
0.8461538461538461,476,magnorumque viros qui laudibus urat avorum.,476,Magnorumque uiros qui laudibus urat auorum.,"['CF', 'CM', 'DI', 'DI', 'CF', None]",0,
1.0,477,"Arge, tuae tibi cura ratis, te moenia doctum",477,"Arge, tuae tibi cura ratis, te moenia doctum","['CF', 'CM', 'DI', 'CF', 'CM', 'DI', 'DI', None]",0,
1.0,478,"Thespia Palladio dant munere; sors tibi, nequa",478,Thespia Palladio dant munere; sors tibi nequa,"['DI', 'CM', 'DI', 'DI', 'CM', 'DI', None]",0,
1.0,479,parte trahat tacitum puppis mare fissaque fluctu,479,Parte trahat tacitum puppis mare fissaque fluctu,"['CF', 'CM', 'CM', 'CM', 'DI', 'DI', None]",0,
0.868421052631579,480,vel pice vel molli conducere vulnera cera.,480,Vel pice uel molli conducere uulnera cera.,"['CM', 'DI', 'CM', 'CM', 'DI', 'DI', None]",0,
0.9210526315789473,481,pervigil Arcadio Tiphys pendebat ab astro,481,Peruigil Arcadio Tiphys pendebat ab astro,"['DI', 'CM', 'CM', 'CF', 'DI', None]",0,
1.0,482,"Hagniades, felix stellis qui segnibus usum",482,"Hagniades, felix stellis qui segnibus usum","['CM', 'CM', 'CM', 'DI', 'DI', None]",0,
1.0,483,et dedit aequoreos caelo duce tendere cursus.,483,Et dedit aequoreos caelo duce tendere cursus.,"['CM', 'DI', 'CM', 'CM', 'DI', 'DI', None]",0,
1.0,484,Ecce per obliqui rapidum compendia montis,484,Ecce per obliqui rapidum compendia montis,"['CF', 'DI', 'CM', 'CM', 'DI', None]",0,
0.8809523809523809,485,ductor avens laetusque dolis agnoscit Acastum,485,Ductor ouans laetusque dolis agnoscit Acastum,"['CF', 'CM', 'CF', 'CM', 'CF', None]",0,
1.0,486,horrentem iaculis et parmae luce coruscum.,486,Horrentem iaculis et parmae luce coruscum.,"['CM', 'CM', 'DI', 'DI', 'CF', None]",0,
0.9285714285714286,487,ille ubi se mediae per scuta virosque carinae,487,Ille ubi se mediae per scuta uirosque carinae,"['SY', 'DI', 'CM', 'CM', 'DI', 'CF', 'CF', None]",1,
1.0,488,"intulit, ardenti Aesonides retinacula ferro",488,"Intulit, ardenti Aesonides retinacula ferro","['DI', 'SY', 'CM', 'DI', None]",1,
0.8571428571428571,489,abscidit; haut aliter saltus vastataque pernix,489,Abscidit: haud aliter saltus uastataque pernix,"['DI', 'CM', 'CM', 'CM', 'DI', None]",0,
0.8780487804878049,490,venator cum lustra fugit dominoque timentem,490,Venator quam lustra fugit dominoque timentem,"['CM', 'DI', 'CF', 'CM', 'CF', None]",0,
0.8837209302325582,491,"urget equum, teneras compressans pectore tigres,",491,"Vrget equum, teneras compressus pectore tigres","['CF', 'CM', 'CM', 'DI', 'DI', None]",0,
0.8461538461538461,492,"quas astu rapuit pavido, dum saeva relictis",492,"Quas astu rapuit pauido, dum saeua relictis","['CM', 'CM', 'CM', 'CM', 'DI', 'CF', None]",0,
0.8,493,mater in adverso catulis venatur Amano.,493,Mater in auerso catulis uenatur Amano.,"['CF', 'DI', 'CM', 'CM', 'CF', None]",0,
1.0,494,it pariter propulsa ratis; stant litore matres,494,It pariter propulsa ratis; stant litore matres,"['CM', 'CM', 'CF', 'CM', 'DI', 'DI', None]",0,
0.8409090909090909,495,claraque vela oculis percussaque sole secuntur,495,Claraque uela oculis percussaque sole sequuntur,"['DI', 'SY', 'CM', 'DI', 'CF', None]",1,
0.925,496,"scuta virum, donec iam celsior arbore pontus",496,"Scuta uirum, donec iam celsior arbore pontus","['CF', 'CM', 'CM', 'DI', 'DI', 'DI', None]",0,
1.0,497,immensusque ratem spectantibus abstulit aer.,497,Immensusque ratem spectantibus abstulit aer.,"['CF', 'CM', 'DI', 'DI', None]",0,
